alert_message,alert_type,alert_message_snpm_trap,alert_code,severity,recommended_action
License expired,LICENSE_EXPIRED,System.License.License_Expired,SIO01.02.0000001,5 (Critical),"To resume operational mode, contact EMC Support for license renewal. If you have already renewed your license, install it."
The system's license will expire in n days,LICENSE_ABOUT_TO_EXPIRE,System.License.License_Is_About_To_Expire,SIO01.02.0000002,3 (Error) 2 (Warning) according to time left and limits,"Contact EMC Support for license renewal. If you have already renewed your license, install it."
PowerFlex OS is using a trial license,TRIAL_LICENSE_USED,System.License.Trial_License_Used,SIO01.02.0000003,2 (Warning),Purchase a license and install it.
Oscillating failures reported,OBJECT_HAS_OSCILLATING_FAILURES,System.Oscillating_Failures.Object_has_oscillating_failures,SIO01.03.0000001,2 (Warning),"Check oscillating failures of the component and take action accordingly. If the oscillating failure does not indicate a problem, change the settings of the oscillating failure window to supress this alert"
There are oscillating network failures. Download network counters for detailed information,OBJECT_HAS_OSCILLATING_NETWORK_FAILURES,System.Oscillating_Failures.OBJECT_HAS_OSCILLATING_NETWORK_FAILURES,SIO01.03.0000002,2 (Warning),"Check the oscillating failure report, that can be accessed from one of the management interfaces. Check whether there is a problem with network links, fix, and restart the counters."
No valid MDM credentials are configured in PowerFlex OS Gateway,GW_CONFIGURATION_INVALID_MDM_CREDENTIALS,System.Credentials.GW_CONFIGURATION_INVALID_MDM_CREDENTIALS,SIO01.04.0000001,5 (Critical),Configure the MDM credentials in the PowerFlex OS Gateway using the FOSGWTool.
MDM credentials are not configured in the PowerFlex OS Gateway,MDM_CREDENTIALS_ARE_NOT_CONFIGURED,System.Credentials.MDM_CREDENTIALS_ARE_NOT_CONFIGURED,SIO01.04.0000002,5 (Critical),Configure MDM credentials on the PowerFlex OS Gateway using theFOSGWTool
The MDM user configured in PowerFlex OS Gateway requires a password change,GW_REQUIRES_MDM_USER_PW_CHANGE,System.Credentials.GW_REQUIRES_MDM_USER_PW_CHANGE,SIO01.04.0000004,5 (Critical),Configure MDM credentials on the PowerFlex OS Gateway using the FOSGWTool
System upgrade is in progress,UPGRADE_IN_PROGRESS,System.Upgrade.UPGRADE_IN_PROGRESS,SIO01.05.0000001,3 (Error),"Monitor the upgrade process, and check that it is completed successfully."
PowerFlex OS Gateway version is too old,GW_TOO_OLD,System.Upgrade.GW_TOO_OLD,SIO01.05.0000002,5 (Critical),Upgrade the PowerFlex OS Gateway to the same version as the rest of your system.
The MDM is not operating in clustered mode,MDM_NOT_CLUSTERED,MDM.MDM_Cluster.MDM_Not_Clustered,SIO02.01.0000001,5 (Critical),"MDM cluster was manually set to SINGLE mode. Confirm that this is an expected operation. Working in SINGLE mode is not recommended. Prepare the cluster modules (if needed), and return to CLUSTER mode."
MDM fails over frequently,MDM_FAILS_OVER_FREQUENTLY,MDM.MDM_Cluster.MDM_Fails_Over_Frequently,SIO02.01.0000003,5 (Critical) 3 (Error) 2 (Warning) according to disconnect count and hardcoded values (2/3/10),The MDMs frequently swap ownership. No action required.
Forward rebuild cannot proceed,FWD_REBUILD_STUCK,MDM.MDM_Cluster.FWD_REBUILD_STUCK,SIO02.01.0000004,2 (Warning)-5 (Critical),"Check the system for lack of spare capacity and/or failed capacity, and either fix the problem or add capacity if necessary."
Backward rebuild cannot proceed,BKWD_REBUILD_STUCK,MDM.MDM_Cluster.BKWD_REBUILD_STUCK,SIO02.01.0000005,2 (Warning)-5 (Critical),"Check the system for lack of spare capacity and/or failed capacity, and either fix the problem or add capacity if necessary."
Rebalance cannot proceed,REBALANCE_STUCK,MDM.MDM_Cluster.REBALANCE_STUCK,SIO02.01.0000006,5 (Critical) 3 (Error) 2 (Warning),"Add a physical disk; if this is not possible, reduce the spare policy while maintaining enough spare to sustain a rebuild, if necessary."
"The MDM cluster is degraded, and data is not protected",CLUSTER_DEGRADED,MDM.MDM_Cluster.CLUSTER_DEGRADED,SIO02.01.0000007,3 (Error)-5 (Critical),"Check that all MDM cluster nodes are functioning correctly, and fix and replace faulty nodes, if necessary, in order to return to full protection."
"Cannot connect to the MDM cluster, but the cluster itself is operational",MDM_CONNECTION_LOST,MDM.MDM_Cluster.MDM_CONNECTION_LOST,SIO02.01.0000008,3 (Error),Check the connection to the MDM
The MDM is not operating in Clustered mode,MDM_NOT_CLUSTERED_VOLUMES_EXIST,MDM.MDM_Cluster.MDM_Not_Clustered_Volume_Exist,SIO02.01.0000009,5 (Critical),"The MDM cluster was manually set to SINGLE mode. Working in SINGLE mode is not recommended. Single mode means that there is only one copy of the MDM repository. If you lose this copy, all System configurations and all the data on all the existing volumes will be lost. Please verify that this is an expected operation. Prepare the cluster modules (if needed), and return to CLUSTERED mode as soon as possible."
Inactive Protection Domain,PD_INACTIVE,MDM.Protection_Domain.Protection_Inactive,SIO02.02.0000001,2 (Warning),"Protection Domain was inactivated by a user command. Confirm that this is an expected operation. This is usually done for maintenance. When maintenance is complete, reactivate the Protection Domain."
Storage Pool has failed capacity,STORAGE_POOL_HAS_FAILED_CAPACITY,MDM.Storage_Pool.Storage_Pool_has_Failed_Capacity,SIO02.04.0000001,5 (Critical),"For the given Storage Pool, for some blocks, both primary and secondary copies are inaccessible. Check and fix the state of all devices in the Storage Pool and all the server's holding devices in the Storage Pool."
Storage Pool has degraded capacity,STORAGE_POOL_HAS_DEGRADED_CAPACITY,MDM.Storage_Pool.Storage_Pool_has_Degraded_Capacity,SIO02.04.0000002,3 (Error),"For the given Storage Pool, for some blocks, one of the two copies is inaccessble. Check if a server is offline or if there is another server hardware-related issue. Check if a storage device is down."
Capacity utilization above critical threshold,CAPACITY_UTILIZATION_ABOVE_CRITICAL_THRESHOLD,MDM.Storage_Pool.Capacity_Utilization_Above_Critical_Threshold,SIO02.04.0000003,5 (Critical),"The capacity utilization of the Storage Pool is reaching a critical threshold. Remove unneeded volumes and snapshots, if possible, or add physical storage."
Capacity utilization above high threshold,CAPACITY_UTILIZATION_ABOVE_HIGH_THRESHOLD,MDM.Storage_Pool.Capacity_Utilization_Above_High_Threshold,SIO02.04.0000004,2 (Warning) 3 (Error),"The capacity utilization of the Storage Pool is reaching a high threshold. Remove unneeded volumes and snapshots, if possible, or add physical storage."
Failure recovery capacity is below the threshold,FAILURE_RECOVERY_CAPACITY_BELOW_THRESHOLD,MDM.Storage_Pool.Failure_Recovery_Capacity_Below_Threshold,SIO02.04.0000005,3 (Error),The capacity available for recovery in a degraded storage event is lower than the predefined threshold. Replace failed hardware or add more physical storage.
Background device scanning has found data conflicts,BACKGROUND_SCANNER_COMPARE_ERROR,MDM.Storage_Pool.Background_Scanner_Compare_Error,SIO02.04.0000007,5 (Critical),Primary and secondary data copies do not match. Check the volumes running on the Storage Pool for any consistency issues. Contact Customer Support for assistance.
Configured spare capacity is smaller than the size of the largest Fault Set,CONFIGURED_SPARE_CAPACITY_SMALLER_THAN_LARGEST_FAULT_UNIT,MDM.Storage_Pool.Configured_Spare_Capacity_Smaller_Than_Largest_Fault_Unit,SIO02.04.0000008,2 (Warning),"Increase the ""spare percentage"", configured in the Storage Pool and reserved for failure recovery, so that it is larger than the largest Fault Unit in the Storage Pool."
The Storage Pool relies too heavily (over 50%) on capacity from a single SDS or Fault Set. Balance capacity over other SDSs or Fault Sets.,STORAGE_POOL_UNBALANCED,MDM.Storage_Pool.STORAGE_POOL_UNBALANCED,SIO02.04.0000009,3 (Error),"Move some physical disks from the large SDS to the others, or add disks to the smaller SDS in order to approximate the capacity of the large SDS as much as possible."
Storage Pool does not meet the minimum requirement of 3 fault units,NOT_ENOUGH_FAULT_UNITS_IN_SP,MDM.Storage_Pool.Not_Enough_Fault_Units,SIO02.04.0000010,3 (Error),Add more SDSs to the Storage Pool to meet the minimum requirement of 3 hosts.
"There are cluster certificates pending approval. For more information, open System Settings > Connection.",UNTRUSTED_CERTIFICATE,MDM.CERTIFICATE.UNTRUSTED_CERTIFICATE,SIO02.05.0000001,3 (Error),Pending for approval certificates can be viewed and approved via System Settings > Connection.
Master MDM Certificate is about to expire,CERTIFICATE_ABOUT_TO_EXPIRE,MDM.CERTIFICATE.CERTIFICATE_ABOUT_TO_EXPIRE,SIO02.05.0000002,5 (Critical),Install a valid SSL certificate on the MDM before the old one expires
Master MDM Certificate has expired,MDM_CERTIFICATE_EXPIRED,MDM.CERTIFICATE.MDM_CERTIFICATE_EXPIRED,SIO02.05.0000003,5 (Critical),Install a valid SSL certificate on the host
Secure connection disabled on MDM,MDM_SECURE_CONNECTION_DISABLED,MDM.CERTIFICATE.MDM_SECURE_CONNECTION_DISABLED,SIO02.05.0000004,5 (Critical),Enable secure connections on the MDM in order to protect your login information
The self-signed certificate presented by the Master MDM is not trusted,MDM_SELF_SIGNED_CERTIFICATE_NOT_TRUSTED,MDM.CERTIFICATE.MDM_SELF_SIGNED_CERTIFICATE_NOT_TRUSTED,SIO02.05.0000005,5 (Critical),"Check the certificate, and trust it if you see fit to do so"
MDM does not support secure connections,MDM_SECURE_CONNECTION_NOT_SUPPORTED,MDM.CERTIFICATE.MDM_SECURE_CONNECTION_NOT_SUPPORTED,SIO02.05.0000006,5 (Critical),Check MDM cluster nodes
The validity period of the certificate presented by the Master MDM starts in the future,MDM_CERTIFICATE_NOT_YET_VALID,MDM.CERTIFICATE.MDM_CERTIFICATE_NOT_YET_VALID,SIO02.05.0000007,5 (Critical),The time and date on the computer where the certificate was created is not consistent with the time and date set in the PowerFlex OS system. Replace the certificate or fix the system time.
The Certificate Authority that signed the Master MDM's certificate is not trusted,MDM_CA_SIGNED_CERTIFICATE_CA_NOT_TRUSTED,MDM.CERTIFICATE.MDM_CA_SIGNED_CERTIFICATE_CA_NOT_TRUSTED,SIO02.05.0000008,5 (Critical),Trust the CA certificate if you see fit
SDS is disconnected,SDS_DISCONNECTED,SDS.SDS.SDS_Disconnected,SIO03.01.0000001,3 (Error),The SDS service may be down or unreachable over the network. Verify that the SDS service is up and running and that the network is properly connected.
SDS disconnects frequently,SDS_DISCONNECTS_FREQUENTLY,SDS.SDS.SDS_Disconnected_Frequently,SIO03.01.0000002,3 (Error) 2 (Warning) according to disconnect count and hard-coded,"The SDS connection is fluctuating due to an unstable network connection. Check the SDS data network connection for Packet Drops, and try to disconnect one of the ports to see if the SDS disconnection issue is resolved by using only one port. If this does not resolve the issue, switch to the other port. If there is still an issue, it may be due to a Faulty NIC, Faulty Switch ports, or a faulty switch. If there is no issue with another switch, the issue was switch-related. Otherwise, the issue may be due to a faulty NIC, which requires NIC replacement."
Memory allocation for RAM Read Cache failed on SDS,SDS_RMCACHE_MEMORY_ALLOCATION_FAILED,SDS.SDS.SDS_Rmcache_Memory_allocation_Failed,SIO03.01.0000003,2 (Warning),"The system failed to allocate memory to the SDS RAM Read-Cache. For 32 GB RAM or less, up to 50% of the memory can be allocated for caching. From 32 GB or more, up to 75% of the memory can be allocated for caching. Reduce the configured RAM Read-Cache memory to match the allocation conditions."
DRL mode: Hardened,DRL_MODE_NON_VOLATILE,SDS.SDS.DRL_MODE_NON_VOLATILE,SIO03.01.0000004,1 (Info),"DRL Mode is configured to ""Hardened"" instead of ""Volatile"". Both modes are configurable."
RFcache card I/O error,RFCACHE_CARD_IO_ERROR,SDS.SDS.RFCACHE_CARD_IO_ERROR,SIO03.01.0000005,2 (Warning),"Disable caching on the device and check the health of the device, because it may be faulty. If necessary, replace the device."
RFcache skipped due to heavy load,RFCACHE_CACHE_SKIP_DUE_TO_HEAVY_LOAD,SDS.SDS.RFCACHE_CACHE_SKIP_DUE_TO_HEAVY_LOAD,SIO03.01.0000006,2 (Warning),"Read Flash Cache is working under a heavy load, and therefore has skipped some IOs. This is a temporary error which should resolve itself. If it persists, try to balance the Storage Pool contents across more SDSs, or add more cache cards."
RFcache IO stack error,RFCACHE_IO_STUCK_ERROR,SDS.SDS.RFCACHE_IO_STUCK_ERROR,SIO03.01.0000007,2 (Warning),"IO has become stuck on the cache device. Disable caching on the device and check the health of the device, because it may be faulty. If necessary, replace the device."
RFcache resources are low,RFCACHE_LOW_RESOURCES,SDS.SDS.RFCACHE_LOW_RESOURCES,SIO03.01.0000008,2 (Warning),There is not enough RAM available on the server for Read Flash Cache optimal operation. Increase the amount of available RAM.
RFcache source configuration is not consistent,RFCACHE_INCONSISTENT_SOURCE_CONFIGURATION,SDS.SDS.RFCACHE_INCONSISTENT_SOURCE_CONFIGURATION,SIO03.01.0000010,2 (Warning),Check RFcache state of all disks in the pool and adjust them so that all disks have the same caching state.
RFcache cache configuration is not consistent,RFCACHE_INCONSISTENT_CACHE_CONFIGURATION,SDS.SDS.RFCACHE_INCONSISTENT_CACHE_CONFIGURATION,SIO03.01.0000011,2 (Warning),Query the system to determine what is not consistent in the configurations of the Read Flash cache driver and the SDS where the cache device is located.
RFcache device does not exist,RFCACHE_DEVICE_DOES_NOT_EXIST,SDS.SDS.RFCACHE_DEVICE_DOES_NOT_EXIST,SIO03.01.0000012,2 (Warning),You tried to add a cache device that does not exist. Check and fix Read Flash Cache configuration.
RFcache API mismatch,RFCACHE_API_ERROR_MISMATCH,SDS.SDS.RFCACHE_API_ERROR_MISMATCH,SIO03.01.0000013,2 (Warning),"The Read Flash Cache (xcache) driver version and SDS version do not match. Try to upgrade them to the same version. If the problem persists, contact Customer Support."
SDS is in Maintenance Mode,SDS_IN_MAINTENANCE,SDS.SDS.SDS_IN_MAINTENANCE,SIO03.01.0000014,2 (Warning),"The SDS is currently in Maintenance Mode. Exit Maintenance Mode once maintenance is complete. If an NDU is in progress, ignore this warning."
Device failed,DEVICE_FAILED,SDS.Device.Device_Failed,SIO03.02.0000001,3 (Error),"The SDS device could not be opened, read from or written to. Validate the device state. Check the cause of the error, and determine if it is a human error or a system malfunction. Check hardware if needed."
Device test is done and device is pending activation,DEVICE_PENDING_ACTIVATION,SDS.Device.Device_Pending_Activation,SIO03.02.0000002,2 (Warning),The SDS device has been added and tested. Activate the SDS device.
Device has fixed read errors,FIXED_READ_ERROR_COUNT_ABOVE_WARNING_THRESHOLD,SDS.Device.FIXED_READ_ERROR_COUNT_ABOVE_WARNING_THRESHOLD,SIO03.02.0000003,3 (Error) if counter > 0,"Read from the SDS device failed. Data was corrected from the other copy. No action is required, but note that the device might be faulty."
Device has fixed read errors,FIXED_READ_ERROR_COUNT_ABOVE_CRITICAL_THRESHOLD,SDS.Device.FIXED_READ_ERROR_COUNT_ABOVE_CRITICAL_THRESHOLD,SIO03.02.0000004,5 (Critical) if counter >= 5,SDS device read failed more than 5 times. Replace the physical device.
"Device failed: All IO to the device will be stopped, and data will be relocated to another device.",DEVICE_ERROR_ERROR,SDS.Device.Device_ErrorError,SIO03.02.0000005,5 (Critical),"Check the device, and if necessary, replace it"
"Device failed: All IO to the device will be stopped, and data will be relocated to another device.",DEVICE_ERROR_WARNING,SDS.Device.Device_ErrorWarning,SIO03.02.0000006,3 (Error),"Check the device, and if necessary, replace it"
Device malfunction has been detected.,DEVICE_ERROR_NOTICE,SDS.Device.Device_ErrorNotice,SIO03.02.0000007,2 (Warning),"Check the device, and if necessary, replace it"
Minor failures have been detected in device performance.,DEVICE_ERROR_INFO,SDS.Device.Device_ErrorInfo,SIO03.02.0000008,2 (Warning),"Check the device, and if necessary, replace it"
"Disk temperature is above the configured threshold, and may fail soon if no action is taken.",SMART_TEMPERATURE_STATE_FAILED_NOW,SDS.Device.SMART_Temperature_State_failed.Now,SIO03.02.0000009,3 (Error),Check the temperature in the server and at the data center. Check if a fan alert is raised in the node.
"The disk is near the end of its working life, and should be replaced.",SMART_END_OF_LIFE_STATE_FAILED_NOW,SDS.Device.SMART_End_Of_Life_State_Failed_Now,SIO03.02.0000011,3 (Error),Replace the disk.
"The disk may be about to fail, or may be operating with reduced performance.",SMART_AGGREGATED_STATE_FAILED_NOW,SDS.Device.SMART_Aggregated_State_Failed_Now,SIO03.02.0000013,3 (Error),Consider replacing the disk.
The SDC is either down or unreachable over the network,SDC_DISCONNECTED,SDC.SDC.SDC_DISCONNECTED,SIO04.01.0000001,3 (Error),Verify that the SDC service is up and running and that the network is properly configured and connected.
No more SDCs can be defined on this system; the maximum has been reached,SDC_MAX_COUNT,SDC.SDC.SDC_Max_Count,SIO04.01.0000002,3 (Error),The maximum number of SDCs in the system has been reached (1024^2).
Errors have been detected on the Physical Disk,PHYSICAL_DRIVE_BAD_STATE,Storage_Controller.Physical_Drive.BAD_STATE,SIO06.01.0000001,5 (Critical),Replace the Physical Disk.
Physical Disk state is erroneous (Hot Spare),PHYSICAL_DRIVE_HOT_SPARE,Storage_Controller.Physical_Drive.HOT_SPARE,SIO06.01.0000002,3 (Error),Errors have been detected on a spare Physical Disk. Replace the Physical Disk.
The Physical Disk is not being used by the system,PHYSICAL_DRIVE_NOT_IN_USE,Storage_Controller.Physical_Drive.NOT_IN_USE,SIO06.01.0000003,3 (Error),Access the storage controller and configure the disk.
SSD lifespan is over endurance threshold,PHYSICAL_DRIVE_ENDURANCE_USED_ABOVE_THRESHOLD,Storage_Controller.Physical_Drive.Endurance_Used_Above_Threshold,SIO06.01.0000004,5 (Critical),Replace the SSD device.
The Physical Disk temperature has exceeded the configured threshold,PHYSICAL_DRIVE_INVALID_TEMPERATURE,Storage_Controller.Physical_Drive.INVALID_TEMPERATURE,SIO06.01.0000005,5 (Critical) 3 (Error),"Ensure that the server and its environment are properly cooled. Ensure that the internal chassis fans are working, and that there is adequate airflow."
The Physical Drive's cache is not disabled,PHYSICAL_DRIVE_INVALID_PD_CACHE_POLICY,Storage_Controller.Physical_Drive.INVALID_PD_CACHE_POLICY,SIO06.01.0000006,3 (Error),Disable the Physical Drive physical cache. Note: This may cause DI issues in power cycle scenarios.
Device was requested to use as DAS Cache but it is not,DEVICE_SHOULD_USE_AS_DAS_CACHE_BUT_IT_IS_NOT,Storage_Controller.Physical_Drive.Device_Should_Use_As_Das_Cache_But_It_Is_Not,SIO06.01.0000007,3 (Error),
"The Logical Disk read policy is not set to ""Read-Ahead""",LOGICAL_DISK_INVALID_READ_AHEAD_POLICY,Storage_Controller.Logical_Disk.INVALID_READ_AHEAD_POLICY,SIO06.02.0000001,3 (Error),"Access the storage controller and change the Logical Disk's read policy to ""Read Ahead""."
The Logical Disk IO policy is not Configured properly (Write-Back),LOGICAL_DISK_INVALID_WRITE_BACK_POLICY,Storage_Controller.Logical_Disk.INVALID_WRITE_BACK_POLICY,SIO06.02.0000002,3 (Error),"Check the Raid controller battery status, a fault in the battery will impact the Write-Back functionality."
"Logical Disk access mode is not set to ""Read-Write""",LOGICAL_DISK_INVALID_ACCESS_MODE,Storage_Controller.Logical_Disk.INVALID_ACCESS_MODE,SIO06.02.0000003,5 (Critical),"Access the storage controller and change the logical disk's access mode to ""Read-Write""."
The Logical Disk RAID level is not set to RAID0,LOGICAL_DISK_INVALID_RAID_LEVEL,Storage_Controller.Logical_Disk.INVALID_RAID_LEVEL,SIO06.02.0000004,3 (Error),"The RAID type is set in the storage controller is incorrect. Access the storage controller, verify that the Logical Disk does not contain any data that is not backed-up, destroy the Logical Disk, and re-create the logical disk as RAID0."
"Logical Disk caching policy is not set to ""DirectIO""",LOGICAL_DISK_INVALID_CACHE_POLICY,Storage_Controller.Logical_Disk.INVALID_CACHE_POLICY,SIO06.02.0000005,3 (Error),"Access the storage controller, and change the RAID0 caching policy for the Logical Disk to ""DirectIO""."
Logical disk is no longer being cached,LOGICAL_DISK_NO_LONGER_CACHED,Storage_Controller.Logical_Disk.LOGICAL_DISK_NO_LONGER_CACHED,SIO06.02.0000006,3 (Error),Disable the Physical Drive physical cache. Note: This may cause DI issues in power cycle scenarios.
The state of the backup battery in the storage controller is not optimal,BATTERY_INVALID_STATE,Storage_Controller.Battery.Invalid_State,SIO06.03.0000001,5 (Critical) 3 (Error),"The backup battery is not fully charged, but it will recharge itself while the storage controller is powered on."
The backup battery in the storage controller needs to be replaced,BATTERY_REPLACEMENT_REQUIRED,Storage_Controller.Battery.REPLACEMENT_REQUIRED,SIO06.03.0000002,5 (Critical),The backup battery in the storage controller may be nearing the end of its working life. Replace the battery.
The storage controller battery temperature is not within the configured threshold,BATTERY_INVALID_TEMPERATURE,Storage_Controller.Battery.INVALID_TEMPERATURE,SIO06.03.0000003,3 (Error),Check the temperature in the server and at the data center. Check if a fan alert is raised in the node. Check the battery and the RAID controller and replace faulty items.
There is no backup battery installed in the storage controller,BATTERY_NOT_PRESENT,Storage_Controller.Battery.NOT_PRESENT,SIO06.03.0000004,5 (Critical),Install a backup battery in the storage controller.
The storage controller contains an incompatible battery pack,BATTERY_INVALID_PACK_ENERGY,Storage_Controller.Battery.Invalid_Pack_Energy,SIO06.03.0000005,3 (Error),Replace the storage controller battery with one that is compatible with your controller's model.
RAID controller's battery has invalid voltage state,BATTERY_INVALID_VOLTAGE,Storage_Controller.Battery.Invalid_Voltage,SIO06.03.0000006,3 (Error),Check the RAID controller's battery. It may need to be replaced.
Hypervisor boot drive state is not OK,BOOT_DRIVE_INVALID_STATE,Node.Boot_Drive.Invalid_State,SIO07.01.0000001,3 (Error),The drive on which the ESXi hypervisor is installed has reported an error. Replace the drive and reinstall the ESXi on the new drive.
The storage controller is not operating optimally,STORAGE_CONTROLLER_INVALID_STATE,Node.Storage_Controller.Invalid_State,SIO07.02.0000001,5 (Critical),"The storage controller may be faulty, and should be replaced."
The storage controller temperature has exceeded the configured threshold,STORAGE_CONTROLLER_INVALID_TEMPERATURE,Node.Storage_Controller.Invalid_Temperature,SIO07.02.0000002,5 (Critical) 3 (Error),Ensure that the server and its environment are properly cooled and that all the chassis fans are functional.
CacheCade license is not installed,STORAGE_CONTROLLER_CACHECADE_NOT_LICENSED,Node.Storage_Controller.Cachecade_Not_Licensed,SIO07.02.0000003,3 (Error),Install a CacheCade license on the storage controller.
Some of the disk slots in the storage controller are empty,STORAGE_CONTROLLER_NOT_ALL_SLOTS_FULL,Node.Storage_Controller.Not_All_Slots_Full,SIO07.02.0000004,3 (Error),"Add more disks if needed. If a disk was removed during a FRU (Field Replacement Unit) operation, insert the new disk into the chassis."
The BOSS storage controller is in an Error state,STORAGE_CONTROLLER_BOSS_ERROR_STATE,Node.Storage_Controller.Boss_Error_State,SIO07.02.0000006,5 (Critical) 3 (Error),"The BOSS storage controller is faulty, and should be replaced."
The BOSS storage controller is in a Degraded state,STORAGE_CONTROLLER_BOSS_DEGRADED_STATE,Node.Storage_Controller.Boss_Degraded_State,SIO07.02.0000007,5 (Critical),"The BOSS storage controller may be faulty, and should be replaced."
The physical CPU socket is not enabled,SOCKET_DISABLED,Node.Cpu_Socket.Disabled,SIO07.03.0000001,3 (Error),Enable the CPU socket in the server BIOS.
Not all CPU cores are enabled,SOCKET_NOT_ALL_CORES_ENABLED,Node.Cpu_Socket.NOT_ALL_CORES_ENABLED,SIO07.03.0000002,3 (Error),Change the physical CPU core configuration in the server BIOS.
CPU is not operating at full speed,SOCKET_SPEED_IS_NOT_MAX_SPEED,Node.Cpu_Socket.SPEED_IS_NOT_MAX_SPEED,SIO07.03.0000003,3 (Error),Set the CPU clock speed in the server's BIOS to its maximum speed.
CPU temperature is not within threshold,CPU_SOCKET_INVALID_TEMPERATURE,Node.Cpu_Socket.INVALID_TEMPERATURE,SIO07.03.0000004,5 (Critical) 3 (Error),The server's CPU temperature has exceeded the configured threshold. Make sure that the server is properly cooled and that the CPU and internal chassis fans are active.
The CPU Voltage Regulator's temperature is higher than the configured threshold,CPU_SOCKET_INVALID_VR_TEMPERATURE,Node.Cpu_Socket.INVALID_VR_TEMPERATURE,SIO07.03.0000005,5 (Critical) 3 (Error),Make sure that the server is properly cooled and that the CPU and internal chassis fans are active.
The CPU Voltage Regulator's voltage is not within the configured threshold,CPU_SOCKET_INVALID_VR_VOLTAGE,Node.Cpu_Socket.INVALID_VR_VOLTAGE,SIO07.03.0000006,5 (Critical) 3 (Error),"1. Verify that the power supply is functioning correctly. 2. Try to replace a port in the Power Distribution Unit, or supply an external power source to check it. 3. Replace the power cable. 4. Replace the Power Supply Unit module."
