id,action,"activity_action","change_type",template
3767,"acl_modified","Local Upgrade Authorized",endpoint,"Local Upgrade authorized for Site {{ site_name }} in Account {{ account_name }} until {{ expiry_date }} by user {{ user_name }}"
3768,"acl_modified","Local Upgrade Authorized",endpoint,"Local Upgrade authorized for {{ computer_name }} in Site {{ site_name}} in Account {{ account_name }} until {{ expiry_date }} by user {{ user_name }}"
3769,unknown,"Local Upgrade Authorized",unknown,"Local Upgrade authorized for {{ endpoints_count }} Endpoints until {{ expiry_date }} by user {{ user_name }}"
3770,modified,"Local Upgrade Authorization Expiry Date Changed",unknown,"Local Upgrade Authorization expiry date was changed to {{ expiry_date }} for Site {{ site_name }} in Account {{ account_name }} by user {{ user_name }}"
3771,modified,"Local Upgrade Authorization Expiry Date Changed",endpoint,"Local Upgrade Authorization expiry date was changed to {{ expiry_date }} for {{ computer_name }} in Site {{ site_name }} in Account {{ account_name }} by user {{ user_name }}"
3772,unknown,"Local Upgrade Unauthorized",unknown,"Local Upgrade unauthorized for Site {{ site_name }} in Account {{ account_name }} by user {{ user_name }}"
3773,"acl_modified","Local Upgrade Authorization Inherits from Site Level",unknown,"Local Upgrade Authorization selected to inherit from Site {{ site_name }} in Account {{ account_name }} for {{ computer_name }} by user {{ user_name }}"
3774,"acl_modified","Local Upgrade Authorization Inherits from Site Level",unknown,"Local Upgrade Authorization selected to inherit from Site Level for  {{ endpoints_count }} Endpoints in Site {{ site_name }} in Account {{ account_name }} by user {{ user_name }}"
3775,unknown,"Downloaded list of authorized agents",agent,"A list of Agents authorized for Local Upgrade for Site {{ site_name }} in Account {{ account_name }} was downloaded by user {{ user_name }}"
38,modified,"Immune Settings Modified",mgmt,
39,modified,"Research Settings Modified",mgmt,"The management user {{ username }} changed Share data with SentinelOne settings to {{ ""on"" if new_value else ""off"" }} for {% if group_name %}{{ group_name }} at {{ site_name }}{% elif site_name %} {{ site_name }}{% else %} all Sites{% endif %}."
40,modified,"Cloud Intelligence Settings Modified",mgmt,"The management user {{ username }} changed Cloud intelligence settings to{{ ""ON"" if cloud_intelligence_on else ""OFF"" }}."
4001,modified,"Suspicious Threat Was Marked As Threat",incident,"The management user {{ username }} marked the suspicious activity {{ file_display_name }} as threat."
4002,modified,"Suspicious Threat Was Resolved",threat,"The management user {{ username }} marked the suspicious activity {{ file_display_name }} as resolved."
4003,created,"New Suspicious Threat Not Mitigated",threat,"Threat with confidence level suspicious detected: {{ file_display_name }}."
4004,modified,"Policy Setting - Show Suspicious Activities Configuration Enabled",agent,"The management user {{ username }} turned on Show suspicious for {% if group_name %}{{ group_name }} at {{ site_name }}{% elif site_name %} {{ site_name }}{% else %} all Sites{% endif %}."
4005,modified,"Policy Setting - Show Suspicious Activities Configuration Disabled",agent,"The management user {{ username }} turned off Show suspicious for {% if group_name %}{{ group_name }} at {{ site_name }}{% elif site_name %} {{ site_name }}{% else %} all Sites{% endif %}."
4006,modified,"Session Timeout Timeout Modified",mgmt,"The management user {{ username }} changed ""Session Timeout"" configuration for {% if scope_level == ""Global"" %}{{ scope_level }}{% else %}{{ scope_level }} {{ scope_name }}{% endif %} from {{ old_value }} to {{ new_value }} minutes."
4007,modified,"Suspicious Threat Was Marked As Benign",mgmt,"The management user {{ username }} marked the suspicious activity {{ file_display_name }} as benign."
4008,modified,"Threat Mitigation Status Changed",mgmt,"Status of threat {{ file_display_name }} on agent {{ computer_name }} changed from {{ original_status }} to {{ new_status }}."
4009,modified,"Process Was Marked As Threat",incident,"The management user {{ username }} marked the process {{ file_display_name }} as threat."
4010,unknown,unknown,threat,unknown
4011,modified,"Suspicious Threat Was Unresolved",threat,"The management user {{ username }} marked the suspicious activity {{ file_display_name }} as unresolved."
4012,modified,"UI Inactivity Timeout Modified",mgmt,"The management user {{ username }} changed ""Inactivity Timeout"" configuration for {% if scope_level == ""Global"" %}{{ scope_level }}{% else %}{{ scope_level }} {{ scope_name }}{% endif %} from {{ old_value }} to {{ new_value }} minutes."
4013,modified,"Password Expiration Modified",unknown,"The management user {{ username }} changed the Password Expiration configuration for {% if scope_level == ""Global"" %}{{ scope_level }}{% else %}{{ scope_level }} {{ scope_name }}{% endif %} from {{ old_value }} to {{ new_value }} days."
4020,created,"New Threat Note Added",note,"The Management user {{ username }} added the following note to {{ file_display_name }} in endpoint {{ computer_name}} : {{ note_details }}"
4021,modified,"Threat Note Updated",note,"The Management user {{ username }} edited the following note on {{ file_display_name }} in endpoint {{ computer_name}} : {{ note_details }}"
4022,deleted,"Threat Note Deleted",note,"The Management user {{ username }} deleted the following note from {{ file_display_name }} in endpoint {{ computer_name}} : {{ note_details }}"
41,modified,"Learning Mode Settings Modified",mgmt,"The management user {{ username }} modified the suspicious mitigation policy to{% if new_value == true %} detect for {% elif new_value == false %} protect for {% endif %}{% if group_name %}{{ group_name }} at {{ site_name }}{% elif site_name %} {{ site_name }}{% else %} all Sites{% endif %}."
4100,modified,"User Marked Deep Visibility Event As Threat",mgmt,"Mark as Threat command on event {{ storyline}} has been sent to {{ computer_name }} by {{ username }}."
4101,modified,"User Marked Deep Visibility Event As Suspicious",mgmt,"Mark as Suspicious command on ID {{ storyline}} has been sent to {{ computer_name }} by {{ username }}."
4102,modified,"Agent Failed To Mark Deep Visibility Event As Threat",mgmt,"The ""Mark as Threat"" command on ID {{ group_id }} could not be completed {% if error == ""idNotFound"" %}because the ID does not exist anymore in the agent {{ computer_name }}.{% elif error == ""alreadyClassifiedAsThreat"" %}because the ID is already marked as a threat by agent {{ computer_name }}.{% elif error == ""idExcluded"" %}because the ID is part of an exclusion list for agent {{ computer_name }}.{% elif error == ""statusNotSupported"" %}because agent {{ computer_name }} does not acknowledge the status ""threat"".{% else %}in agent {{ computer_name }} due to an unknown error.{% endif %}"
4103,modified,"Agent Failed To Mark Deep Visibility Event As Suspicious",mgmt,"The ""Mark as Suspicious"" command on ID {{ group_id }} could not be completed {% if error == ""idNotFound"" %}because the ID does not exist anymore in the agent {{ computer_name }}.{% elif error == ""alreadyClassifiedAsSuspicious"" %}because the ID is already marked as suspicious by agent {{ computer_name }}.{% elif error == ""threatCantBeClassifiedAsSuspicious"" %}because the ID is already marked as threat by agent {{ computer_name }}.{% elif error == ""idExcluded"" %}because the ID is part of an exclusion list for agent {{ computer_name }}.{% elif error == ""statusNotSupported"" %}because agent {{ computer_name }} does not acknowledge the status ""suspicious"".{% else %}in agent {{ computer_name }} due to an unknown error.{% endif %}"
4104,modified,"STAR Manual Response Marked Event As Malicious",mgmt,"The Management user {{ username }} marked an alert generated by the Custom Rule {{ rule_name }} on process {{ storyline }}, for endpoint {{computer_name}}, in {{ account_name }}/{{ site_name}}/{{ group_name }} as a malicious threat.{% if threat_already_exists %}Threat already exists for this Storyline.{% endif %}"
4105,modified,"STAR Manual Response Marked Event As Suspicious",mgmt,"The Management user {{ username }} marked an alert generated by the Custom Rule {{ rule_name }} on process {{ storyline }}, for endpoint {{computer_name}}, in {{ account_name }}/{{ site_name}}/{{ group_name }} as suspicious.{% if threat_already_exists %}Threat already exists for this Storyline.{% endif %}"
4106,modified,"STAR Active Response Marked Event As Malicious",mgmt,"Custom Rule {{ rule_name }} automatically marked {{ storyline }} as a malicious threat in {{ account_name }}/{{ site_name}}/{{ group_name }}. detected on {{computer_name}}. {% if threat_already_exists %}Threat already exists for this Storyline.{% endif %}"
4107,modified,"STAR Active Response Marked Event As Suspicious",mgmt,"Custom Rule {{ rule_name }} automatically marked {{ storyline }} as a suspicious threat in {{ account_name }}/{{ site_name}}/{{ group_name }}. detected on {{computer_name}}. {% if threat_already_exists %}Threat already exists for this Storyline.{% endif %}"
4108,unknown,"New Malicious Threat Not Mitigated",threat,"Threat with confidence level malicious detected by SentinelOne Cloud: {{ alert_process_name }}"
4109,unknown,"New Suspicious Threat Not Mitigated",threat,"Threat with confidence level suspicious detected by SentinelOne Cloud: {{ alert_process_name }}."
4110,unknown,"Singularity Threat Intelligence Engine Marked Event As Malicious",threat,"Singularity Threat Intelligence engine automatically marked {{ storyline }} as a malicious threat in {{ account_name }}/{{ site_name}}/{{ group_name }}. detected on {{computer_name}}. {% if threat_already_exists %}Threat already exists for this Storyline.{% endif %}"
4111,unknown,"Watchtower Cloud Detection Engine Marked Event As Threat",threat,"Watchtower Cloud Detection engine marked {{ storyline }} as a threat in {{ account_name }}/{{ site_name}}/{{ group_name }}. detected on {{computer_name}}. {% if threat_already_exists %}Threat already exists for this Storyline.{% endif %}"
4112,unknown,"Watchtower Cloud Detection Engine Marked Event As Suspicious",unknown,"Watchtower Cloud Detection engine marked {{ storyline }} as suspicious in {{ account_name }}/{{ site_name}}/{{ group_name }}. detected on {{computer_name}}. {% if threat_already_exists %}Threat already exists for this Storyline.{% endif %}"
4113,unknown,"Singularity Threat Intelligence Engine Marked Event As Suspicious",threat,"Singularity Threat Intelligence engine automatically marked {{ storyline }} as a suspicious threat in {{ account_name }}/{{ site_name}}/{{ group_name }}. detected on {{computer_name}}. {% if threat_already_exists %}Threat already exists for this Storyline.{% endif %}"
42,modified,"Global 2FA modified",mgmt,"The management user {{ username }} {{ ""enabled"" if global_two_fa_enabled else ""disabled"" }} the scope 2FA for {% if scope_level == ""Global"" %}{{ scope_level }}{% else %}{{ scope_level }} {{ scope_name }}{% endif %}."
43,modified,"Agent updated",agent,"Agent {{ computer_name }} was successfully updated to version {{ agent_updated_version }}."
44,modified,"Auto decommission On",mgmt,"The management user {{ username }} turned on Auto decommission for {% if group_name %}{{ group_name }} at {{ site_name }}{% elif site_name %} {{ site_name }}{% else %} all Sites{% endif %}."
45,modified,"Auto decommission Off",mgmt,"The management user {{ username }} turned off Auto decommission for {% if group_name %}{{ group_name }} at {{ site_name }}{% elif site_name %} {{ site_name }}{% else %} all Sites{% endif %}."
46,modified,"Auto Decommission Period Modified",mgmt,"The management user {{ username }} modified Auto decommissioned period to {{ new_value }} days for{% if group_name %} {{ group_name }} at {{ site_name }}{% elif site_name %} {{ site_name }}{% else %} all Sites{% endif %}."
47,modified,"Agent Decommissioned",agent,"Agent {{ computer_name }} (OS Family: {{ os_type }}, Type: {{ machine_type }}, Cloud Provider: {% if cloud_provider_names %}{{ "", "".join(cloud_provider_names) }}{% else %}N/A{% endif %}) automatically decommissioned."
48,modified,"Agent Recommissioned",agent,"Agent {{ computer_name }} automatically recommissioned."
49,modified,"Agent Request Uninstall",agent,"Machine named: {{ computer_name }} requested to uninstall SentinelOne agent."
5,modified,"Agent Software Update Downloaded",agent,"Software update availability notification was sent to {{ computer_name }} by {{ user_name }}."
50,modified,"Uninstall Agent",agent,"The management user {{ username }} issued an uninstall command to {{ computer_name }}."
5000,started,"AD Sync Started",mgmt,"Active directory synchronization started."
5001,stopped,"AD Sync Finished",mgmt,"Active directory synchronization finished."
5002,started,"Dynamic Group Creation Started",mgmt,"The creation of Dynamic Group {{ group_name }} started."
5003,stopped,"Dynamic Group Creation Finished",mgmt,"The creation of Dynamic Group {{ group_name }} completed."
5004,started,"Dynamic Group Update Started",mgmt,"The update of Dynamic Group {{ group_name }} started."
5005,stopped,"Dynamic Group Update Finished",mgmt,"The update of Dynamic Group {{ group_name }} completed."
5006,deleted,"Group Deleted",mgmt,"The management user {{ username }} deleted the {{ group_type }} Group: {{ group_name }}."
5007,modified,"Group Info Changed",mgmt,"{% if update_name_and_description_message %}{{ update_name_and_description_message }}{% elif update_name_message %}{{ update_name_message }}{% elif update_description_message %}{{ update_description_message }}{% endif %}"
5008,created,"User created a Manual or Pinned Group",mgmt,"The management user {{ username }} created the new {{ group_type }} Group: {{ group_name }}."
5009,modified,"Agent Moved To A Different Group",mgmt,"The Agent {{ computer_name }} moved dynamically from Group {{ old_group_name }} to Group {{ new_group_name }}"
5010,modified,"Group Ranking Changed",mgmt,"The ranking of the Dynamic Group {{ group_name }} was changed"
5011,modified,"Group Policy Reverted",mgmt,"The management user {{ username }} reverted the policy of Group {{ group_name }} to its Site policy."
5012,modified,"Group Token Regenerated",mgmt,"The management user {{ username }} generated a new token for the Static Group {{ group_name }}."
5013,deleted,"Group Deleted Because Site Deleted",mgmt,"Group {{ group_name }} was deleted because its Site, {{ site_name }}, was deleted."
5020,created,"Site Created",mgmt,"The Management user {{ username }} created Site {{ site_name }} in Account {{ account_name }}. {{ licenses_description }}Expiration date: {% if not expiration %}Non-Expire{% else %}{{ expiration }}{% endif %}."
5021,modified,"Site Modified",mgmt,"The management user {{ username }} updated {{ old_site_name }} site. {% if update_name_message %}{{ update_name_message }}{% endif %}{% if update_description_message %}{{ update_description_message }}{% endif %}{% if update_expiration_message %}{{ update_expiration_message }}{% endif %}{% if bundle_message %}{{ bundle_message }}{% endif %}{% if module_message %}{{ module_message }}{% endif %}"
5022,deleted,"Site Deleted",mgmt,"{{ site_name }} was deleted by {{ username }}, {{ licenses_num }} licenses returned to the Account: {{ account_name }}"
5023,modified,"Site Expired",mgmt,"The site {{ site_name }}  at {{ account_name }} expired automatically at {{ site_expiration | datetime}} because the expiration day was over"
5024,modified,"Site Policy Reverted",mgmt,"The management user {{ username }} has reverted {{ site_name }} site policy to default inherited policy."
5025,modified,"Site Marked As Expired",mgmt,"The management user {{ username }} marked site {{ site_name }} at {{ account_name }} as expired"
5026,modified,"Site Duplicated",mgmt,"The management user {{ username }} duplicated {{ source_site_name }} site into {{ site_name }} site."
5027,modified,"Site Token Regenerated",mgmt,"A new token for {{ site_name }} was generated by {{ username }}."
5028,modified,"Site Expired Because Account Expired",mgmt,"Site {{ site_name }} expired when Account {{ account_name }} expired"
5029,deleted,"Site Deleted Because Account Deleted",mgmt,"Site {{ site_name }} deleted when Account {{ account_name }} deleted"
5040,created,"Account Created",mgmt,"The Management user {{ username }} created Account {{ account_name }}. {{ licenses_description }}Expiration date: {% if not expiration %}Non-Expire{% else %}{{ expiration }}{% endif %}."
5041,modified,"Account Modified",mgmt,"The management user {{ username }} updated {{ old_account_name }} account. {% if name_message %}{{ name_message }}{% endif %}{% if expiration_message %}{{ expiration_message }}{% endif %}{% if bundle_message %}{{ bundle_message }}{% endif %}{% if module_message %}{{ module_message }}{% endif %}{% if setting_message %}{{ setting_message }}{% endif %}"
5042,deleted,"Account Deleted",mgmt,"The management user {{ username }} deleted the account {{ account_name }}"
5043,modified,"Account Expired",mgmt,"The account {{ account_name }} expired automatically at {{ account_expiration | datetime}} because the expiration day was over"
5044,modified,"Account Policy Reverted",mgmt,"The management user {{ username }} has reverted {{ account_name }} account policy to global."
5045,modified,"Account Marked As Expired",mgmt,"The management user {{ username }} marked account {{ account_name }} as expired"
51,modified,"Agent Uninstalled",agent,"The machine {{ computer_name }} (OS Family: {{ os_type }}, Type: {{ machine_type }}, Cloud Provider:{% if cloud_provider_names %}{{ "", "".join(cloud_provider_names) }}{% else %}N/A{% endif %}) with IP address {{ external_ip }} was uninstalled."
5120,created,"Device Rule Created",mgmt,"The management user {{ username }} added Device Control rule {{ rule_name }} to {{scope_name}}"
5121,modified,"Device Rule Modified",mgmt,"The management user {{ username }} changed Device Control rule {{ rule_name }} in {{scope_name}}"
5122,deleted,"Device Rule Deleted",mgmt,"The management user {{ username }} deleted the Device Control rule {{ rule_name }} from {{scope_name}} Device Control policy"
5123,modified,"Device Rules Reordered",mgmt,"The management user {{ username }} modified the order of Device Control rules in {{scope_name}}"
5124,modified,"Device Rules Settings Modified",mgmt,"The management user {{ username }} updated Device Control settings in {{scope_name}}. Modified the settings parameter {{ setting }} from {{ previous }} to {{ current }}"
5125,modified,"Device Control Blocked Event",agent,"{{ interface }} device {% if device_name %}{{ device_name }}{% else %}{% endif %} was {{ ""configured as read-only"" if event_type == ""configured-read-only"" else event_type }} on {{ computer_name }}{% if rule_name %} based on rule: {{ rule_name }} in {{ rule_scope_name }}{% else %}{% endif %}."
5126,modified,"Device Control Approved Event",agent,"{{ interface }} device {% if device_name %}{{ device_name }}{% else %}{% endif %} was {{ ""configured as read-only"" if event_type == ""configured-read-only"" else event_type }} on {{ computer_name }}{% if rule_name %} based on rule: {{ rule_name }} in {{ rule_scope_name }}{% else %}{% endif %}."
5127,modified,"Device Rule Moved From Scope",agent,"The management user {{ username }} moved Device Control rule {{ rule_name }} from {{scope_name}}"
5128,modified,"Device Rule Moved To Scope",agent,"The management user {{ username }} moved Device Control rule {{ rule_name }} to {{scope_name}}"
5129,modified,"Device Rule Copied To Scope",agent,"The management user {{ username }} copied Device Control rule {{ rule_name }} to {{scope_name}}"
52,modified,"User Approved Agent Uninstall Request",agent,"The management user {{ username }} approved uninstall agent request on machine {{ computer_name }}."
5220,modified,"Firewall Rule Created",firewall,"The management user {{ username }} added Firewall Control rule {{ rule_name }} to {{scope_level}} {{scope_name}}"
5221,modified,"Firewall Rule Modified",firewall,"The management user {{ username }} changed Firewall Control rule {{ rule_name }} in {{scope_level}} {{scope_name}}"
5222,deleted,"Firewall Rule Deleted",firewall,"The management user {{ username }} deleted the Firewall Control rule {{ rule_name }} from {{scope_level}} {{scope_name}}"
5225,modified,"Firewall Control Settings Modified",firewall,"The management user {{ username }} updated Firewall Control Settings in {{scope_level}} {{scope_name}}. {% if old_status %} Firewall status changed from {{old_status}} to {{new_status}}.{%endif%}{% if old_inheritance_mode %} Inheritance Mode changed from {{old_inheritance_mode}} to {{ new_inheritance_mode }}.{%endif%}{% if new_inherit_settings == ""On"" %} Firewall status is now inherited from the parent scope.{%endif%}{% if new_inherit_settings == ""Off"" %} Firewall status is not inherited from the parent scope anymore.{%endif%}"
5226,modified,"Firewall Rules Reordered",firewall,"The management user {{ username }} modified the order of Firewall Control rules in {{scope_level}} {{ scope_name }}"
5227,started,"User Initiated Fetch Firewall Rules From Agent",user,"The management user {{ username }} initiated a fetch {%if config_state == ""initial"" %}pre-installation {% endif %}firewall rules command to the agent: {{ computer_name }} ({{ external_ip }})."
5228,modified,"Agent Uploaded Firewall Rules","firewall rules","Agent {{ computer_name }} ({{ external_ip }}) successfully uploaded {% if config_state %}{{ config_state }} {% endif %}firewall rules configuration."
5229,"acl_modified","Firewall Rule Moved From Scope",firewall,"The management user {{ username }} moved Firewall Control rule {{ rule_name }} from {{scope_level}} {{scope_name}}"
5230,"acl_modified","Firewall Rule Moved To Scope",firewall,"The management user {{ username }} moved Firewall Control rule {{ rule_name }} to {{scope_level}} {{scope_name}}"
5231,"acl_modified","Firewall Rule Copied To Scope",firewall,"The management user {{ username }} copied Firewall Control rule {{ rule_name }} to {{scope_level}} {{scope_name}}"
5232,modified,"Firewall Control Blocked Event",agent,"Firewall Control blocked traffic on the Endpoint {{ computer_name }}{% if rule_name %} because of rule {{ rule_name }} in {{ rule_scope_level }} {{ rule_scope_name }}{% else %}{% endif %}."
5233,modified,"User Requested Firewall Logging",agent,"The management user {{ username }} requested firewall logging from the agent: {{ computer_name }} ({{ external_ip }}). Local log is {{ ""Enabled"" if report_log else ""Disabled"" }}. Activity Log is {{ ""Enabled"" if report_mgmt else ""Disabled""}}"
5234,modified,"Network Quarantine Rule Created","network quarantine rule","The management user {{ username }} added Network Quarantine rule {{ rule_name }} to {{scope_level}} {{scope_name}}"
5235,modified,"Network Quarantine Rule Modified","network quarantine rule","The management user {{ username }} changed Network Quarantine rule {{ rule_name }} in {{scope_level}} {{scope_name}}"
5236,deleted,"Network Quarantine Rule Deleted","network quarantine rule","The management user {{ username }} deleted the Network Quarantine rule {{ rule_name }} from {{scope_level}} {{ scope_name }} Network Quarantine policy"
5237,modified,"Network Quarantine Control Settings Modified","network quarantine settings","The management user {{ username }} updated Configurable Network Quarantine Settings in {{ scope_level }} {{scope_name}}.{% if old_status %} Network Quarantine status changed from {{old_status}} to {{new_status}}.{%endif%}{% if old_inheritance_mode %} Inheritance Mode changed from {{old_inheritance_mode}} to {{ new_inheritance_mode }}.{%endif%}{% if new_inherit_settings and new_inherit_settings == ""On"" %} Network Quarantine status is now inherited from the parent scope.{%endif%}{% if new_inherit_settings and new_inherit_settings == ""Off"" %} Network quarantine status is not inherited from the parent scope anymore.{%endif%}"
5238,modified,"Network Quarantine Rules Reordered","network quarantine rule","The management user {{ username }} modified the order of Network Quarantine rules in {{ scope_level }} {{ scope_name }}"
5239,modified,"Network Quarantine Rule Moved From Scope","network quarantine rule","The management user {{ username }} moved Network Quarantine rule {{ rule_name }} from {{scope_level}} {{scope_name}}"
5240,modified,"Network Quarantine Rule Moved To Scope","network quarantine rule","The management user {{ username }} moved Network Quarantine rule {{ rule_name }} to {{scope_level}} {{scope_name}}"
5241,modified,"Network Quarantine Rule Copied To Scope","network quarantine rule","The management user {{ username }} copied Network Quarantine rule {{ rule_name }} to {{scope_level}} {{scope_name}}"
5242,created,"Ranger - Device Tag Created",ranger,"The management user {{ username }} added a new {{ tag_type }} Tag {{ tag_name }} to {{ scope_level }} {{ scope_name }}{% if tag_description %} with description {{ tag_description }}{% endif %}."
5243,modified,"Ranger - Device Tag Updated",ranger,"The management user {{ username }} modified the {{ tag_type }} tag {{ tag_name }} in {{ scope_level}} {{scope_name}}.{% if old_tag_name %} The name was changed from {{ old_tag_name }} to {{ new_tag_name }}.{% endif %}{% if old_tag_description %} The description was changed from {{ old_tag_description }} to {{ new_tag_description }}.{% endif %}"
5244,deleted,"Ranger - Device Tag Deleted",ranger,"The management user {{ username }} deleted the {{ tag_type }} Tag {{ tag_name }} from {{ scope_level }} {{ scope_name }}"
