Message,MessageID,Description,Triggers,Actions,"Data_fields"
"SUCCESS_RETRIEVING_TOKEN_FROM_STS","WebServicesSecurity-24","Successfully retrieved Security Token from STS service","All the required input data parameters are correct",,"Web_Service_Provider_end_point_for_which_Security_Token_being_generated|Security_Token_Service_end_point_to_which_STS_client_talks_to|Security_Token_Service_MEX_end_point_address|End_user_credential|Key_Type|Token_Type"
"ERROR_RETRIEVING_TOKEN_FROM_STS","WebServicesSecurity-25","Error in retrieving Security Token from STS service","Some or more required input data parameters are not correct","Check all the required input data parameters.; Check debug file for detailed error","Actual_error_message"
"ERROR_RETRIEVING_TOKEN_FROM_STS","WebServicesSecurity-26","Error in retrieving Security Token from STS service","Some or more required input data parameters are not correct","Check all the required input data parameters.; Check debug file for detailed error","Actual_error_message"
"ERROR_CREATING_SAML11_ASSERTION","WebServicesSecurity-27","Error during creation of SAML 1.1 Assertion by STS","Invalid parameters sent to create SAML 1.1 Assertion","Check all the parameters sent to create SAML 1.1 Assertion.; Check debug file for detailed error","Actual_Error_message"
"ERROR_CREATING_SAML20_ASSERTION","WebServicesSecurity-28","Error during creation of SAML 2.0 Assertion by STS","Invalid parameters sent to create SAML 2.0 Assertion","Check all the parameters sent to create SAML 2.0 Assertion.; Check debug file for detailed error","Actual_Error_message"
"LOGIN_SUCCESS","AUTHENTICATION-100","Authentication is Successful","User authenticated with valid credentials",,"message|no_session"
"LOGIN_SUCCESS_USER","AUTHENTICATION-101","User based authentication is successful","User authenticated with valid credentials",,"message|authentication_type|user_name|no_session"
"LOGIN_SUCCESS_ROLE","AUTHENTICATION-102","Role based authentication is successful","User belonging to role authenticated with valid credentials",,"message|authentication_type|role_name|no_session"
"LOGIN_SUCCESS_SERVICE","AUTHENTICATION-103","Service based authentication is successful","User authenticated with valid credentials to a configured service under realm",,"message|authentication_type|service_name|no_session"
"LOGIN_SUCCESS_LEVEL","AUTHENTICATION-104","Authentication level based authentication is successful","User authenticated with valid credentials to one or more authentication modules having authentication level value greater than or equal to specified authentication level",,"message|authentication_type|authentication_level_value|no_session"
"LOGIN_SUCCESS_MODULE_INSTANCE","AUTHENTICATION-105","Module based authentication is successful","User authenticated with valid credentials to authentication module under realm",,"message|authentication_type|module_name|no_session"
"LOGIN_FAILED","AUTHENTICATION-200","Authentication Failed","Incorrect/invalid credentials presented; User locked out/not active","Enter correct/valid credentials to required authentication module","error_message"
"LOGIN_FAILED_INVALIDPASSWORD","AUTHENTICATION-201","Authentication Failed","Invalid credentials entered","Enter the correct password","error_message"
"LOGIN_FAILED_NOCONFIG","AUTHENTICATION-202","Authentication Failed","Named Configuration (Auth Chain) does not exist","Create and configure a named config for this org","error_message"
"LOGIN_FAILED_NOUSERPROFILE","AUTHENTICATION-203","Authentication Failed","No user profile found for this user","User does not exist in the datastore plugin configured and hence configure the datastore plugin for this realm/org correctly","error_message"
"LOGIN_FAILED_USERINACTIVE","AUTHENTICATION-204","Authentication Failed","This user is not active","Activate the user","error_message"
"LOGIN_FAILED_LOCKEDOUT","AUTHENTICATION-205","Authentication Failed","Max number of failure attempts exceeded. User is Locked out","Contact system administrator","error_message"
"LOGIN_FAILED_ACCOUNTEXPIRED","AUTHENTICATION-206","Authentication Failed","User account has expired","Contact system administrator","error_message"
"LOGIN_FAILED_LOGINTIMEOUT","AUTHENTICATION-207","Authentication Failed","Login timed out","Try to login again","error_message"
"LOGIN_FAILED_MODULEDENIED","AUTHENTICATION-208","Authentication Failed","Authentication module is denied","Configure this module or use some other module","error_message"
"LOGIN_FAILED_MAXSESSIONREACHED","AUTHENTICATION-209","Authentication Failed","Limit for maximum number of allowed session has been reached","Logout of a session or increase the limit","error_message"
"LOGIN_FAILED_INVALIDDOMAIN","AUTHENTICATION-210","Authentication Failed","Org/Realm does not exists","Use a valid Org/Realm","error_message"
"LOGIN_FAILED_ORGINACTIVE","AUTHENTICATION-211","Authentication Failed","Org/Realm is not active","Activate the Org/Realm","error_message"
"LOGIN_FAILED_SESSIONCREATEERROR","AUTHENTICATION-212","Authentication Failed","Cannot create a session","Ensure that session service is configured and maxsession is not reached","error_message"
"LOGIN_FAILED_USER","AUTHENTICATION-213","User based authentication failed","No authentication configuration (chain of one or more authentication modules) configured for user; Incorrect/invalid credentials presented; User locked out/not active","Configure authentication configuration (chain of one or more authentication modules) for user; Enter correct/valid credentials to required authentication module","error_message|authentication_type|user_name"
"LOGIN_FAILED_USER_INVALIDPASSWORD","AUTHENTICATION-214","Authentication Failed","User based Auth. Invalid credentials entered","Enter the correct password","error_message|authentication_type|user_name"
"LOGIN_FAILED_USER_NOCONFIG","AUTHENTICATION-215","Authentication Failed","Named Configuration (Auth Chain) does not exist for this user","Create and configure a named config for this user","error_message|authentication_type|user_name"
"LOGIN_FAILED_USER_NOUSERPROFILE","AUTHENTICATION-216","Authentication Failed","User based Auth. No user profile found for this user","User does not exist in the datastore plugin configured and hence configure the datastore plugin for this realm/org correctly","error_message|authentication_type|user_name"
"LOGIN_FAILED_USER_USERINACTIVE","AUTHENTICATION-217","Authentication Failed","User based Auth. This user is not active","Activate the user","error_message|authentication_type|user_name"
"LOGIN_FAILED_USER_LOCKEDOUT","AUTHENTICATION-218","Authentication Failed","User based Auth. Max number of failure attempts exceeded. User is Locked out","Contact system administrator","error_message|authentication_type|user_name"
"LOGIN_FAILED_USER_ACCOUNTEXPIRED","AUTHENTICATION-219","Authentication Failed","User based Auth. User account has expired","Contact system administrator","error_message|authentication_type|user_name"
"LOGIN_FAILED_USER_LOGINTIMEOUT","AUTHENTICATION-220","Authentication Failed","User based Auth. Login timed out","Try to login again","error_message|authentication_type|user_name"
"LOGIN_FAILED_USER_MODULEDENIED","AUTHENTICATION-221","Authentication Failed","User based Auth. Authentication module is denied","Configure this module or use some other module","error_message|authentication_type|user_name"
"LOGIN_FAILED_USER_MAXSESSIONREACHED","AUTHENTICATION-222","Authentication Failed","User based auth. Limit for maximum number of allowed session has been reached","Logout of a session or increase the limit","error_message|authentication_type|user_name"
"LOGIN_FAILED_USER_INVALIDDOMAIN","AUTHENTICATION-223","Authentication Failed","User based auth. Org/Realm does not exists","Use a valid Org/Realm","error_message|authentication_type|user_name"
"LOGIN_FAILED_USER_ORGINACTIVE","AUTHENTICATION-224","Authentication Failed","User based auth. Org/Realm is not active","Activate the Org/Realm","error_message|authentication_type|user_name"
"LOGIN_FAILED_USER_SESSIONCREATEERROR","AUTHENTICATION-225","Authentication Failed","User based auth. Cannot create a session","Ensure that session service is configured and maxsession is not reached","error_message|authentication_type|user_name"
"LOGIN_FAILED_ROLE","AUTHENTICATION-226","Role based authentication failed","No authentication configuration (chain of one or more authentication modules) configured for role; Incorrect/invalid credentials presented; User does not belong to this role; User locked out/not active","Configure authentication configuration (chain of one or more authentication modules) for role; Enter correct/valid credentials to required authentication module; Assign this role to the authenticating user","error_message|authentication_type|role_name"
"LOGIN_FAILED_ROLE_INVALIDPASSWORD","AUTHENTICATION-227","Authentication Failed","Role based Auth. Invalid credentials entered","Enter the correct password","error_message|authentication_type|role_name"
"LOGIN_FAILED_ROLE_NOCONFIG","AUTHENTICATION-228","Authentication Failed","Named Configuration (Auth Chain) does not exist for this role","Create and configure a named config for this role","error_message|authentication_type|role_name"
"LOGIN_FAILED_ROLE_NOUSERPROFILE","AUTHENTICATION-229","Authentication Failed","Role based Auth. No user profile found for this user","User does not exist in the datastore plugin configured and hence configure the datastore plugin for this realm/org correctly","error_message|authentication_type|role_name"
"LOGIN_FAILED_ROLE_USERINACTIVE","AUTHENTICATION-230","Authentication Failed","Role based Auth. This user is not active","Activate the user","error_message|authentication_type|role_name"
"LOGIN_FAILED_ROLE_LOCKEDOUT","AUTHENTICATION-231","Authentication Failed","Role based Auth. Max number of failure attempts exceeded. User is Locked out","Contact system administrator","error_message|authentication_type|role_name"
"LOGIN_FAILED_ROLE_ACCOUNTEXPIRED","AUTHENTICATION-232","Authentication Failed","Role based Auth. User account has expired","Contact system administrator","error_message|authentication_type|role_name"
"LOGIN_FAILED_ROLE_LOGINTIMEOUT","AUTHENTICATION-233","Authentication Failed","Role based Auth. Login timed out","Try to login again","error_message|authentication_type|role_name"
"LOGIN_FAILED_ROLE_MODULEDENIED","AUTHENTICATION-234","Authentication Failed","Role based Auth. Authentication module is denied","Configure this module or use some other module","error_message|authentication_type|role_name"
"LOGIN_FAILED_ROLE_MAXSESSIONREACHED","AUTHENTICATION-235","Authentication Failed","Role based auth. Limit for maximum number of allowed session has been reached","Logout of a session or increase the limit","error_message|authentication_type|role_name"
"LOGIN_FAILED_ROLE_INVALIDDOMAIN","AUTHENTICATION-236","Authentication Failed","Role based auth. Org/Realm does not exists","Use a valid Org/Realm","error_message|authentication_type|role_name"
"LOGIN_FAILED_ROLE_ORGINACTIVE","AUTHENTICATION-237","Authentication Failed","Role based auth. Org/Realm is not active","Activate the Org/Realm","error_message|authentication_type|role_name"
"LOGIN_FAILED_ROLE_SESSIONCREATEERROR","AUTHENTICATION-238","Authentication Failed","Role based auth. Cannot create a session","Ensure that session service is configured and maxsession is not reached","error_message|authentication_type|role_name"
"LOGIN_FAILED_ROLE_USERNOTFOUND","AUTHENTICATION-239","Authentication Failed","Role based auth. User does not belong to this role","Add the user to this role","error_message|authentication_type|role_name"
"LOGIN_FAILED_SERVICE","AUTHENTICATION-240","Service based authentication failed","No authentication configuration (chain of one or more authentication modules) configured for service; Incorrect/invalid credentials presented; User locked out/not active","Configure authentication configuration (chain of one or more authentication modules) for service; Enter correct/valid credentials to required authentication module","error_message|authentication_type|service_name"
"LOGIN_FAILED_SERVICE_INVALIDPASSWORD","AUTHENTICATION-241","Authentication Failed","Service based Auth. Invalid credentials entered","Enter the correct password","error_message|authentication_type|service_name"
"LOGIN_FAILED_SERVICE_NOCONFIG","AUTHENTICATION-242","Authentication Failed","Named Configuration (Auth Chain) does not exist with this service name","Create and configure a named config","error_message|authentication_type|service_name"
"LOGIN_FAILED_SERVICE_NOUSERPROFILE","AUTHENTICATION-243","Authentication Failed","Service based Auth. No user profile found for this user","User does not exist in the datastore plugin configured and hence configure the datastore plugin for this realm/org correctly","error_message|authentication_type|service_name"
"LOGIN_FAILED_SERVICE_USERINACTIVE","AUTHENTICATION-244","Authentication Failed","Service based Auth. This user is not active","Activate the user","error_message|authentication_type|service_name"
"LOGIN_FAILED_SERVICE_LOCKEDOUT","AUTHENTICATION-245","Authentication Failed","Service based Auth. Max number of failure attempts exceeded. User is Locked out","Contact system administrator","error_message|authentication_type|service_name"
"LOGIN_FAILED_SERVICE_ACCOUNTEXPIRED","AUTHENTICATION-246","Authentication Failed","Service based Auth. User account has expired","Contact system administrator","error_message|authentication_type|service_name"
"LOGIN_FAILED_SERVICE_LOGINTIMEOUT","AUTHENTICATION-247","Authentication Failed","Service based Auth. Login timed out","Try to login again","error_message|authentication_type|service_name"
"LOGIN_FAILED_SERVICE_MODULEDENIED","AUTHENTICATION-248","Authentication Failed","Service based Auth. Authentication module is denied","Configure this module or use some other module","error_message|authentication_type|service_name"
"LOGIN_FAILED_SERVICE_NOSERVICE","AUTHENTICATION-249","Authentication Failed","Service based Auth. Service does not exist","Please use only valid Service","error_message|authentication_type|service_name"
"LOGIN_FAILED_SERVICE_MAXSESSIONREACHED","AUTHENTICATION-250","Authentication Failed","Service based auth. Limit for maximum number of allowed session has been reached","Logout of a session or increase the limit","error_message|authentication_type|service_name"
"LOGIN_FAILED_SERVICE_INVALIDDOMAIN","AUTHENTICATION-251","Authentication Failed","Service based auth. Org/Realm does not exists","Use a valid Org/Realm","error_message|authentication_type|service_name"
"LOGIN_FAILED_SERVICE_ORGINACTIVE","AUTHENTICATION-252","Authentication Failed","Service based auth. Org/Realm is not active","Activate the Org/Realm","error_message|authentication_type|service_name"
"LOGIN_FAILED_SERVICE_SESSIONCREATEERROR","AUTHENTICATION-253","Authentication Failed","Service based auth. Cannot create a session","Ensure that session service is configured and maxsession is not reached","error_message|authentication_type|service_name"
"LOGIN_FAILED_LEVEL","AUTHENTICATION-254","Authentication level based authentication failed","There are no authentication module(s) having authentication level value greater than or equal to specified authentication level; Incorrect/invalid credentials presented to one or more authentication modules having authentication level greater than or equal to specified authentication level; User locked out/not active","Configure one or more authentication modules having authentication level value greater than or equal to required authentication level; Enter correct/valid credentials to one or more authentication modules having authentication level greater than or equal to specified authentication level","error_message|authentication_type|authentication_level_value"
"LOGIN_FAILED_LEVEL_INVALIDPASSWORD","AUTHENTICATION-255","Authentication Failed","Level based Auth. Invalid credentials entered","Enter the correct password","error_message|authentication_type|authentication_level_value"
"LOGIN_FAILED_LEVEL_NOCONFIG","AUTHENTICATION-256","Authentication Failed","Level based Auth. No Auth Configuration available","Create an auth configuration","error_message|authentication_type|authentication_level_value"
"LOGIN_FAILED_LEVEL_NOUSERPROFILE","AUTHENTICATION-257","Authentication Failed","Level based Auth. No user profile found for this user","User does not exist in the datastore plugin configured and hence configure the datastore plugin for this realm/org correctly","error_message|authentication_type|authentication_level_value"
"LOGIN_FAILED_LEVEL_USERINACTIVE","AUTHENTICATION-258","Authentication Failed","Level based Auth. This user is not active","Activate the user","error_message|authentication_type|authentication_level_value"
"LOGIN_FAILED_LEVEL_LOCKEDOUT","AUTHENTICATION-259","Authentication Failed","Level based Auth. Max number of failure attempts exceeded. User is Locked out","Contact system administrator","error_message|authentication_type|authentication_level_value"
"LOGIN_FAILED_LEVEL_ACCOUNTEXPIRED","AUTHENTICATION-260","Authentication Failed","Level based Auth. User account has expired","Contact system administrator","error_message|authentication_type|authentication_level_value"
"LOGIN_FAILED_LEVEL_LOGINTIMEOUT","AUTHENTICATION-261","Authentication Failed","Level based Auth. Login timed out","Try to login again","error_message|authentication_type|authentication_level_value"
"LOGIN_FAILED_LEVEL_MODULEDENIED","AUTHENTICATION-262","Authentication Failed","Level based Auth. Authentication module is denied","Configure this module or use some other module","error_message|authentication_type|authentication_level_value"
"LOGIN_FAILED_LEVEL_INCORRECTLEVEL","AUTHENTICATION-263","Authentication Failed","Level based Auth. Invalid Authg Level","Please specify valid auth level","error_message|authentication_type|authentication_level_value"
"LOGIN_FAILED_LEVEL_MAXSESSIONREACHED","AUTHENTICATION-264","Authentication Failed","Level based auth. Limit for maximum number of allowed session has been reached","Logout of a session or increase the limit","error_message|authentication_type|authentication_level_value"
"LOGIN_FAILED_LEVEL_INVALIDDOMAIN","AUTHENTICATION-265","Authentication Failed","Level based auth. Org/Realm does not exists","Use a valid Org/Realm","error_message|authentication_type|authentication_level_value"
"LOGIN_FAILED_LEVEL_ORGINACTIVE","AUTHENTICATION-266","Authentication Failed","Level based auth. Org/Realm is not active","Activate the Org/Realm","error_message|authentication_type|authentication_level_value"
"LOGIN_FAILED_LEVEL_SESSIONCREATEERROR","AUTHENTICATION-267","Authentication Failed","Level based auth. Cannot create a session","Ensure that session service is configured and maxsession is not reached","error_message|authentication_type|authentication_level_value"
"LOGIN_FAILED_MODULE_INSTANCE","AUTHENTICATION-268","Module based authentication failed","Module is not registered/configured under realm; Incorrect/invalid credentials presented; User locked out/not active","Register/configure authentication module under realm; Enter correct/valid credentials to authentication module","error_message|authentication_type|module_name"
"LOGIN_FAILED_MODULE_INSTANCE_INVALIDPASSWORD","AUTHENTICATION-269","Authentication Failed","Module based Auth. Invalid credentials entered","Enter the correct password","error_message|authentication_type|module_name"
"LOGIN_FAILED_MODULE_INSTANCE_NOUSERPROFILE","AUTHENTICATION-270","Authentication Failed","Module based Auth. No user profile found for this user","User does not exist in the datastore plugin configured and hence configure the datastore plugin for this realm/org correctly","error_message|authentication_type|module_name"
"LOGIN_FAILED_MODULE_INSTANCE_USERINACTIVE","AUTHENTICATION-271","Authentication Failed","Module based Auth. This user is not active","Activate the user","error_message|authentication_type|module_name"
"LOGIN_FAILED_MODULE_INSTANCE_LOCKEDOUT","AUTHENTICATION-272","Authentication Failed","Module based Auth. Max number of failure attempts exceeded. User is Locked out","Contact system administrator","error_message|authentication_type|module_name"
"LOGIN_FAILED_MODULE_INSTANCE_ACCOUNTEXPIRED","AUTHENTICATION-273","Authentication Failed","Module based Auth. User account has expired","Contact system administrator","error_message|authentication_type|module_name"
"LOGIN_FAILED_MODULE_INSTANCE_LOGINTIMEOUT","AUTHENTICATION-274","Authentication Failed","Module based Auth. Login timed out","Try to login again","error_message|authentication_type|module_name"
"LOGIN_FAILED_MODULE_INSTANCE_MODULEDENIED","AUTHENTICATION-275","Authentication Failed","Module based Auth. Authentication module is denied","Configure this module or use some other module","error_message|authentication_type|module_name"
"LOGIN_FAILED_MODULE_INSTANCE_MAXSESSIONREACHED","AUTHENTICATION-276","Authentication Failed","Module based auth. Limit for maximum number of allowed session has been reached","Logout of a session or increase the limit","error_message|authentication_type|module_name"
"LOGIN_FAILED_MODULE_INSTANCE_INVALIDDOMAIN","AUTHENTICATION-277","Authentication Failed","Module based auth. Org/Realm does not exists","Use a valid Org/Realm","error_message|authentication_type|module_name"
"LOGIN_FAILED_MODULE_INSTANCE_ORGINACTIVE","AUTHENTICATION-278","Authentication Failed","Module based auth. Org/Realm is not active","Activate the Org/Realm","error_message|authentication_type|module_name"
"LOGIN_FAILED_MODULE_INSTANCE_SESSIONCREATEERROR","AUTHENTICATION-279","Authentication Failed","Module based auth. Cannot create a session","Ensure that session service is configured and maxsession is not reached","error_message|authentication_type|module_name"
LOGOUT,"AUTHENTICATION-300","User logout is Successful","User logged out",,message
"LOGOUT_USER","AUTHENTICATION-301","User logout is successful from user based authentication","User logged out",,"message|authentication_type|user_name"
"LOGOUT_ROLE","AUTHENTICATION-302","User logout is successful from role based authentication","User belonging to this role logged out",,"message|authentication_type|role_name"
"LOGOUT_SERVICE","AUTHENTICATION-303","User logout is successful from service based authentication","User logged out of a configured service under realm",,"message|authentication_type|service_name"
"LOGOUT_LEVEL","AUTHENTICATION-304","User logout is successful from authentication level based authentication","User logged out of one or more authentication modules having authentication level value greater than or equal to specified authentication level",,"message|authentication_type|authentication_level_value"
"LOGOUT_MODULE_INSTANCE","AUTHENTICATION-305","User logout is successful from module based authentication","User logged out of authentication module under realm",,"message|authentication_type|module_name"
"CHANGE_USER_PASSWORD_FAILED","AUTHENTICATION-306","Change user password failed","Change user password in authentication screen due to directory server password policy","Enter password which meets directory server password policy","error_message"
"CHANGE_USER_PASSWORD_SUCCEEDED","AUTHENTICATION-307","Changing user password succeeded","Change user password in authentication screen due to directory server password policy",,message
"CREATE_USER_PROFILE_FAILED","AUTHENTICATION-308","Create user password failed","Create new user in Membership module","Make sure password entered meets directory server password policy","error_message|user_name"
"ATTEMPT_LOGIN","AMCLI-1","Attempt to login to execute the commandline","Run the Commandline tool",,"user_ID"
"SUCCEED_LOGIN","AMCLI-2","Login to execute the commandline","Run the Commandline tool",,"user_ID"
"FAILED_LOGIN","AMCLI-3","Failed to login","Run the Commandline tool","Check your user ID and password.; Look under debug file for more information","user_ID|error_message"
"ATTEMPT_LOAD_SCHEMA","AMCLI-20","Attempt to load schema to data store","Load Schema through Commandline interface",,"XML_file_name"
"SUCCESS_LOAD_SCHEMA","AMCLI-21","Schema is loaded to data store","Load Schema through Commandline interface",,"XML_file_name"
"FAILED_LOAD_SCHEMA","AMCLI-22","Schema is not loaded to data store","Load Schema through Commandline interface","Look under debug file for more information","XML_file_name|error_message"
"ATTEMPT_DELETE_SERVICE","AMCLI-30","Attempt to delete service from data store","Delete Service through Commandline interface",,"service_name"
"SUCCESS_DELETE_SERVICE","AMCLI-31","Deleted service from data store","Delete Service through Commandline interface",,"service_name"
"FAILED_DELETE_SERVICE","AMCLI-32","Schema is not loaded to data store","Delete Service Schema through Commandline interface","Look under debug file for more information","service_name|error_message"
"ATTEMPT_ADD_ATTRIBUTE_SCHEMA","AMCLI-40","Attempt to attribute schema to an existing service","Add attribute schema through Commandline interface",,"service_name|schema_type|XML_file_name"
"SUCCESS_ADD_ATTRIBUTE_SCHEMA","AMCLI-41","Added attribute schema to existing service","Add attribute schema through Commandline interface",,"service_name|schema_type|XML_file_name"
"FAILED_ADD_ATTRIBUTE_SCHEMA","AMCLI-42","Attribute schema is not added to existing service","Add attribute schema through Commandline interface","Check the service name, schema type and XML file.; Look under debug file for more information","service_name|schema_type|XML_file_name|error_message"
"ATTEMPT_ADD_RESOURCE_BUNDLE","AMCLI-50","Attempt to add resource bundle to data store","Add Resource Bundle through Commandline interface",,"resource_bundle_name|file_name|locale"
"SUCCEED_ADD_RESOURCE_BUNDLE","AMCLI-51","Resource bundle is added to data store","Add Resource Bundle through Commandline interface",,"resource_bundle_name|file_name|locale"
