Message,MessageID,Description,Triggers,Actions,"Data_fields"
"SSO_EXCEPTION_IDENTITY_WRITE_SERVICE_ATTRIBUTE_VALUES","CONSOLE-143","Writing of service attribute values to an identity failed","Unable to write service attribute values to an identity. It may be the single sign on token of the user has expired; or the user does not have permission to perform this operation","Look under data store log for more information","name_of_identity|name_of_service|error_message"
"IDM_EXCEPTION_IDENTITY_WRITE_SERVICE_ATTRIBUTE_VALUES","CONSOLE-144","Writing of service attribute values to an identity failed","Unable to write service attribute values to an identity due to data store error","Look under data store log for more information","name_of_identity|name_of_service|error_message"
"ATTEMPT_READ_ALL_GLOBAL_DEFAULT_ATTRIBUTE_VALUES","CONSOLE-201","Attempt to read all global service default attribute values","View global configuration view of a service",,"name_of_service"
"SUCCEED_READ_ALL_GLOBAL_DEFAULT_ATTRIBUTE_VALUES","CONSOLE-202","Reading of all global service default attribute values succeeded","View global configuration view of a service",,"name_of_service"
"ATTEMPT_READ_GLOBAL_DEFAULT_ATTRIBUTE_VALUES","CONSOLE-203","Attempt to read global service default attribute values","View global configuration view of a service",,"name_of_service|name_of_attribute"
"SUCCEED_READ_GLOBAL_DEFAULT_ATTRIBUTE_VALUES","CONSOLE-204","Reading of global service default attribute values succeeded","View global configuration view of a service",,"name_of_service|name_of_attribute"
"FAILED_READ_GLOBAL_DEFAULT_ATTRIBUTE_VALUES","CONSOLE-205","Reading of global service default attribute values failed","View global configuration view of a service","Look under service management log for more information","name_of_service|name_of_attribute"
"ATTEMPT_WRITE_GLOBAL_DEFAULT_ATTRIBUTE_VALUES","CONSOLE-211","Attempt to write global service default attribute values","Click on Save button in global configuration view of a service",,"name_of_service|name_of_attribute"
"SUCCEED_WRITE_GLOBAL_DEFAULT_ATTRIBUTE_VALUES","CONSOLE-212","Writing of global service default attribute values succeeded","Click on Save button in global configuration view of a service",,"name_of_service|name_of_attribute"
"SSO_EXCEPTION_WRITE_GLOBAL_DEFAULT_ATTRIBUTE_VALUES","CONSOLE-213","Writing of global service default attribute values failed","Unable to write global service default attribute values. It may be the single sign on token of the user has expired; or the user does not have permission to perform this operation","Look under service management log for more information","name_of_service|name_of_attribute|error_message"
"SMS_EXCEPTION_WRITE_GLOBAL_DEFAULT_ATTRIBUTE_VALUES","CONSOLE-214","Writing of global service default attribute values failed","Unable to write service default attribute values due to service management error","Look under service management log for more information","name_of_service|name_of_attribute|error_message"
"ATTEMPT_READ_GLOBAL_SUB_CONFIGURATION_NAMES","CONSOLE-221","Attempt to get sub configuration names","View a global service view of which its service has sub schema",,"name_of_service|name_of_base_global_sub_configuration"
"SUCCEED_READ_GLOBAL_SUB_CONFIGURATION_NAMES","CONSOLE-222","Reading of global sub configuration names succeeded","View a global service view of which its service has sub schema",,"name_of_service|name_of_base_global_sub_configuration"
"SSO_EXCEPTION_READ_GLOBAL_SUB_CONFIGURATION_NAMES","CONSOLE-223","Reading of global sub configuration names failed","Unable to get global sub configuration names. It may be the single sign on token of the user has expired; or the user does not have permission to perform this operation","Look under service management log for more information","name_of_service|name_of_base_global_sub_configuration|error_message"
"SMS_EXCEPTION_READ_GLOBAL_SUB_CONFIGURATION_NAMES","CONSOLE-224","Reading of global sub configuration names failed","Unable to get global sub configuration names due to service management error","Look under service management log for more information","name_of_service|name_of_base_global_sub_configuration|error_message"
"ATTEMPT_DELETE_GLOBAL_SUB_CONFIGURATION","CONSOLE-231","Attempt to delete sub configuration","Click on delete selected button in global service profile view",,"name_of_service|name_of_base_global_sub_configuration|name_of_sub_configuration_to_be_deleted"
"SUCCEED_DELETE_GLOBAL_SUB_CONFIGURATION","CONSOLE-232","Deletion of sub configuration succeeded","Click on delete selected button in global service profile view",,"name_of_service|name_of_base_global_sub_configuration|name_of_sub_configuration_to_be_deleted"
"SSO_EXCEPTION_DELETE_GLOBAL_SUB_CONFIGURATION","CONSOLE-233","Deletion of sub configuration failed","Unable to delete sub configuration. It may be the single sign on token of the user has expired; or the user does not have permission to perform this operation","Look under service management log for more information","name_of_service|name_of_base_global_sub_configuration|name_of_sub_configuration_to_be_deleted|error_message"
"SMS_EXCEPTION_DELETE_GLOBAL_SUB_CONFIGURATION","CONSOLE-234","Deletion of sub configuration failed","Unable to delete sub configuration due to service management error","Look under service management log for more information","name_of_service|name_of_base_global_sub_configuration|name_of_sub_configuration_to_be_deleted|error_message"
"ATTEMPT_CREATE_GLOBAL_SUB_CONFIGURATION","CONSOLE-241","Attempt to create sub configuration","Click on add button in create sub configuration view",,"name_of_service|name_of_base_global_sub_configuration|name_of_sub_configuration_to_be_created|name_of_sub_schema_to_be_created"
"SUCCEED_CREATE_GLOBAL_SUB_CONFIGURATION","CONSOLE-242","Creation of sub configuration succeeded","Click on add button in create sub configuration view",,"name_of_service|name_of_base_global_sub_configuration|name_of_sub_configuration_to_be_created|name_of_sub_schema_to_be_created"
"SSO_EXCEPTION_CREATE_GLOBAL_SUB_CONFIGURATION","CONSOLE-243","Creation of sub configuration failed","Unable to create sub configuration. It may be the single sign on token of the user has expired; or the user does not have permission to perform this operation","Look under service management log for more information","name_of_service|name_of_base_global_sub_configuration|name_of_sub_configuration_to_be_created|name_of_sub_schema_to_be_created|error_message"
"SMS_EXCEPTION_CREATE_GLOBAL_SUB_CONFIGURATION","CONSOLE-244","Creation of sub configuration failed","Unable to create sub configuration due to service management error","Look under service management log for more information","name_of_service|name_of_base_global_sub_configuration|name_of_sub_configuration_to_be_created|name_of_sub_schema_to_be_created|error_message"
"SUCCEED_READ_GLOBAL_SUB_CONFIGURATION_ATTRIBUTE_VALUES","CONSOLE-251","Reading of sub configuration's attribute values succeeded","View sub configuration profile view",,"name_of_service|name_of_sub_configuration"
"ATTEMPT_WRITE_GLOBAL_SUB_CONFIGURATION_ATTRIBUTE_VALUES","CONSOLE-261","Attempt to write sub configuration's attribute values","Click on save button in sub configuration profile view",,"name_of_service|name_of_sub_configuration"
"SUCCEED_WRITE_GLOBAL_SUB_CONFIGURATION_ATTRIBUTE_VALUES","CONSOLE-262","Writing of sub configuration's attribute values succeeded","Click on save button in sub configuration profile view",,"name_of_service|name_of_sub_configuration"
"SSO_EXCEPTION_WRITE_GLOBAL_SUB_CONFIGURATION_ATTRIBUTE_VALUES","CONSOLE-263","Writing of sub configuration's attribute value failed","Unable to write sub configuration's attribute values. It may be the single sign on token of the user has expired; or the user does not have permission to perform this operation","Look under service management log for more information","name_of_service|name_of_sub_configuration|error_message"
"SMS_EXCEPTION_WRITE_GLOBAL_SUB_CONFIGURATION_ATTRIBUTE_VALUES_NAMES","CONSOLE-264","Writing of sub configuration's attribute value failed","Unable to write sub configuration's attribute value due to service management error","Look under service management log for more information","name_of_service|name_of_sub_configuration|error_message"
"ATTEMPT_GET_POLICY_NAMES","CONSOLE-301","Attempt to get policy names under a realm","View policy main page",,"name_of_realm"
"SUCCEED_GET_POLICY_NAMES","CONSOLE-302","Getting policy names under a realm succeeded","View policy main page",,"name_of_realm"
"SSO_EXCEPTION_GET_POLICY_NAMES","CONSOLE-303","Getting policy names under a realm failed","Unable to get policy names under a realm. It may be the single sign on token of the user has expired; or the user does not have permission to perform this operation","Look under policy log for more information","name_of_realm|error_message"
"POLICY_EXCEPTION_GET_POLICY_NAMES","CONSOLE-304","Getting policy names under a realm failed","Unable to get policy names under a realm due to policy SDK related errors","Look under policy log for more information","name_of_realm|error_message"
"ATTEMPT_CREATE_POLICY","CONSOLE-311","Attempt to create policy under a realm","Click on New button in policy creation page",,"name_of_realm|name_of_policy"
"SUCCEED_CREATE_POLICY","CONSOLE-312","Creation of policy succeeded","Click on New button in policy creation page",,"name_of_realm|name_of_policy"
"SSO_EXCEPTION_CREATE_POLICY","CONSOLE-313","Creation of policy failed","Unable to create policy under a realm. It may be the single sign on token of the user has expired; or the user does not have permission to perform this operation","Look under policy log for more information","name_of_realm|name_of_policy|error_message"
"POLICY_EXCEPTION_CREATE_POLICY","CONSOLE-314","Creation of policy failed","Unable to create policy under a realm due to policy SDK related errors","Look under policy log for more information","name_of_realm|name_of_policy|error_message"
"ATTEMPT_MODIFY_POLICY","CONSOLE-321","Attempt to modify policy","Click on Save button in policy profile page",,"name_of_realm|name_of_policy"
"SUCCEED_MODIFY_POLICY","CONSOLE-322","Modification of policy succeeded","Click on Save button in policy profile page",,"name_of_realm|name_of_policy"
"SSO_EXCEPTION_MODIFY_POLICY","CONSOLE-323","Modification of policy failed","Unable to modify policy under a realm. It may be the single sign on token of the user has expired; or the user does not have permission to perform this operation","Look under policy log for more information","name_of_realm|name_of_policy|error_message"
"POLICY_EXCEPTION_MODIFY_POLICY","CONSOLE-324","Modification of policy failed","Unable to modify policy due to policy SDK related errors","Look under policy log for more information","name_of_realm|name_of_policy|error_message"
"ATTEMPT_DELETE_POLICY","CONSOLE-331","Attempt to delete policy","Click on Delete button in policy main page",,"name_of_realm|names_of_policies"
"SUCCEED_DELETE_POLICY","CONSOLE-332","Deletion of policy succeeded","Click on Delete button in policy main page",,"name_of_realm|name_of_policies"
"SSO_EXCEPTION_DELETE_POLICY","CONSOLE-333","Deletion of policy failed","Unable to delete policy. It may be the single sign on token of the user has expired; or the user does not have permission to perform this operation","Look under policy log for more information","name_of_realm|name_of_policies|error_message"
"POLICY_EXCEPTION_DELETE_POLICY","CONSOLE-334","Deletion of policy failed","Unable to delete policy due to policy SDK related errors","Look under policy log for more information","name_of_realm|name_of_policies|error_message"
"ATTEMPT_GET_REALM_NAMES","CONSOLE-401","Attempt to get realm names","View realm main page",,"name_of_parent_realm"
"SUCCEED_GET_REALM_NAMES","CONSOLE-402","Getting realm names succeeded","View realm main page",,"name_of_parent_realm"
"SMS_EXCEPTION_GET_REALM_NAMES","CONSOLE-403","Getting realm names failed","Unable to get realm names due to service management SDK exception","Look under service management log for more information","name_of_parent_realm|error_message"
"ATTEMPT_CREATE_REALM","CONSOLE-411","Attempt to create realm","Click on New button in create realm page",,"name_of_parent_realm|name_of_new_realm"
"SUCCEED_CREATE_REALM","CONSOLE-412","Creation of realm succeeded","Click on New button in create realm page",,"name_of_parent_realm|name_of_new_realm"
"SMS_EXCEPTION_CREATE_REALM","CONSOLE-413","Creation of realm failed","Unable to create new realm due to service management SDK exception","Look under service management log for more information","name_of_parent_realm|name_of_new_realm|error_message"
"ATTEMPT_DELETE_REALM","CONSOLE-421","Attempt to delete realm","Click on Delete button in realm main page",,"name_of_parent_realm|name_of_realm_to_delete"
"SUCCEED_DELETE_REALM","CONSOLE-422","Deletion of realm succeeded","Click on Delete button in realm main page",,"name_of_parent_realm|name_of_realm_to_delete"
"SMS_EXCEPTION_DELETE_REALM","CONSOLE-423","Deletion of realm failed","Unable to delete realm due to service management SDK exception","Look under service management log for more information","name_of_parent_realm|name_of_realm_to_delete|error_message"
"ATTEMPT_GET_ATTR_VALUES_OF_REALM","CONSOLE-431","Attempt to get attribute values of realm","View realm profile page",,"name_of_realm"
"SUCCEED_GET_ATTR_VALUES_OF_REALM","CONSOLE-432","Getting attribute values of realm succeeded","View realm profile page",,"name_of_realm"
"SMS_EXCEPTION_GET_ATTR_VALUES_OF_REALM","CONSOLE-433","Getting attribute values of realm failed","Unable to get attribute values of realm due to service management SDK exception","Look under service management log for more information","name_of_realm|error_message"
"ATTEMPT_SET_ATTR_VALUES_OF_REALM","CONSOLE-441","Attempt to modify realm's profile","Click on Save button in realm profile page",,"name_of_realm"
"SUCCEED_SET_ATTR_VALUES_OF_REALM","CONSOLE-442","Modification of realm's profile succeeded","Click on Save button in realm profile page",,"name_of_realm"
"SMS_EXCEPTION_SET_ATTR_VALUES_OF_REALM","CONSOLE-443","Modification of realm's profile failed","Unable to modify realm's profile due to service management SDK exception","Look under service management log for more information","name_of_realm|error_message"
"ATTEMPT_GET_DELEGATION_SUBJECTS","CONSOLE-501","Attempt to get delegation subjects under a realm","View delegation main page",,"name_of_realm|search_pattern"
"SUCCEED_GET_DELEGATION_SUBJECTS","CONSOLE-502","Getting delegation subjects under a realm succeeded","View delegation main page",,"name_of_realm|search_pattern"
"SSO_EXCEPTION_GET_DELEGATION_SUBJECTS","CONSOLE-503","Getting delegation subjects under a realm failed","Unable to get delegation subjects. It may be the single sign on token of the user has expired; or the user does not have permission to perform this operation","Look under delegation management log for more information","name_of_realm|search_pattern|error_message"
"DELEGATION_EXCEPTION_GET_DELEGATION_SUBJECTS","CONSOLE-504","Getting delegation subjects under a realm failed","Unable to get delegation subjects due to delegation management SDK related errors","Look under delegation management log for more information","name_of_realm|search_pattern|error_message"
"ATTEMPT_GET_PRIVILEGES_OF_DELEGATION_SUBJECT","CONSOLE-511","Attempt to get privileges of delegation subject","View delegation subject profile page",,"name_of_realm|ID_of_delegation_subject"
"SUCCEED_GET_PRIVILEGES_OF_DELEGATION_SUBJECT","CONSOLE-512","Getting privileges of delegation subject succeeded","View delegation subject profile page",,"name_of_realm|ID_of_delegation_subject"
"SSO_EXCEPTION_GET_PRIVILEGES_OF_DELEGATION_SUBJECT","CONSOLE-513","Getting privileges of delegation subject failed","Unable to get privileges of delegation subject. It may be the single sign on token of the user has expired; or the user does not have permission to perform this operation","Look under delegation management log for more information","name_of_realm|ID_of_delegation_subject|error_message"
"DELEGATION_EXCEPTION_GET_PRIVILEGES_OF_DELEGATION_SUBJECT","CONSOLE-514","Getting privileges of delegation subject failed","Unable to get privileges of delegation subject due to delegation management SDK related errors","Look under delegation management log for more information","name_of_realm|ID_of_delegation_subject|error_message"
"ATTEMPT_MODIFY_DELEGATION_PRIVILEGE","CONSOLE-521","Attempt to modify delegation privilege","Click on Save button in delegation subject profile page",,"name_of_realm|ID_of_delegation_privilege|ID_of_subject"
"SUCCEED_MODIFY_DELEGATION_PRIVILEGE","CONSOLE-522","Modification of delegation privilege succeeded","Click on Save button in delegation subject profile page",,"name_of_realm|ID_of_delegation_privilege|ID_of_subject"
"SSO_EXCEPTION_MODIFY_DELEGATION_PRIVILEGE","CONSOLE-523","Modification of delegation privilege failed","Unable to modify delegation privilege. It may be the single sign on token of the user has expired; or the user does not have permission to perform this operation","Look under delegation management log for more information","name_of_realm|ID_of_delegation_privilege|ID_of_subject|error_message"
"DELEGATION_EXCEPTION_MODIFY_DELEGATION_PRIVILEGE","CONSOLE-524","Modification of delegation privilege failed","Unable to modify delegation privilege due to delegation management SDK related errors","Look under delegation management log for more information","name_of_realm|ID_of_delegation_privilege|ID_of_subject|error_message"
"ATTEMPT_GET_ID_REPO_NAMES","CONSOLE-601","Attempt to get data store names","View data store main page",,"name_of_realm"
"SUCCEED_GET_ID_REPO_NAMES","CONSOLE-602","Getting data store names succeeded","View data store main page",,"name_of_realm"
"SSO_EXCEPTION_GET_ID_REPO_NAMES","CONSOLE-603","Getting data store names failed","Unable to get data store names. It may be the single sign on token of the user has expired; or the user does not have permission to perform this operation","Look under service management log for more information","name_of_realm|error_message"
"SMS_EXCEPTION_GET_ID_REPO_NAMES","CONSOLE-604","Getting data store names failed","Unable to get data store names due to service management SDK exception","Look under service management log for more information","name_of_realm|error_message"
"ATTEMPT_GET_ATTR_VALUES_ID_REPO","CONSOLE-611","Attempt to get attribute values of identity repository","View data store profile page",,"name_of_realm|name_of_identity_repository"
"SUCCEED_GET_ATTR_VALUES_ID_REPO","CONSOLE-612","Getting attribute values of data store succeeded","View data store profile page",,"name_of_realm|name_of_identity_repository"
"SSO_EXCEPTION_GET_ATTR_VALUES_ID_REPO","CONSOLE-613","Getting attribute values of data store failed","Unable to get attribute values of identity repository. It may be the single sign on token of the user has expired; or the user does not have permission to perform this operation","Look under service management log for more information","name_of_realm|name_of_identity_repository|error_message"
"SMS_EXCEPTION_GET_ATTR_VALUES_ID_REPO","CONSOLE-614","Getting attribute values of data store failed","Unable to get attribute values of data store due to service management SDK exception","Look under service management log for more information","name_of_realm|name_of_identity_repository|error_message"
"ATTEMPT_CREATE_ID_REPO","CONSOLE-621","Attempt to create identity repository","Click on New button in data store creation page",,"name_of_realm|name_of_identity_repository|type_of_identity_repository"
"SUCCEED_CREATE_ID_REPO","CONSOLE-622","Creation of data store succeeded","Click on New button in data store creation page",,"name_of_realm|name_of_identity_repository|type_of_identity_repository"
"SSO_EXCEPTION_CREATE_ID_REPO","CONSOLE-623","Creation of data store failed","Unable to create identity repository. It may be the single sign on token of the user has expired; or the user does not have permission to perform this operation","Look under service management log for more information","name_of_realm|name_of_identity_repository|type_of_identity_repository|error_message"
"SMS_EXCEPTION_CREATE_ID_REPO","CONSOLE-624","Creation data store failed","Unable to create data store due to service management SDK exception","Look under service management log for more information","name_of_realm|name_of_identity_repository|type_of_identity_repository|error_message"
"ATTEMPT_DELETE_ID_REPO","CONSOLE-631","Attempt to delete identity repository","Click on Delete button in data store main page",,"name_of_realm|name_of_identity_repository"
"SUCCEED_DELETE_ID_REPO","CONSOLE-632","Deletion of data store succeeded","Click on Delete button in data store main page",,"name_of_realm|name_of_identity_repository"
"SSO_EXCEPTION_DELETE_ID_REPO","CONSOLE-633","Deletion of data store failed","Unable to delete identity repository. It may be the single sign on token of the user has expired; or the user does not have permission to perform this operation","Look under service management log for more information","name_of_realm|name_of_identity_repository|error_message"
"SMS_EXCEPTION_DELETE_ID_REPO","CONSOLE-634","Deletion data store failed","Unable to delete data store due to service management SDK exception","Look under service management log for more information","name_of_realm|name_of_identity_repository|error_message"
"ATTEMPT_MODIFY_ID_REPO","CONSOLE-641","Attempt to modify identity repository","Click on Save button in data store profile page",,"name_of_realm|name_of_identity_repository"
"SUCCEED_MODIFY_ID_REPO","CONSOLE-642","Modification of data store succeeded","Click on Save button in data store profile page",,"name_of_realm|name_of_identity_repository"
"SSO_EXCEPTION_MODIFY_ID_REPO","CONSOLE-643","Modification of data store failed","Unable to modify identity repository. It may be the single sign on token of the user has expired; or the user does not have permission to perform this operation","Look under service management log for more information","name_of_realm|name_of_identity_repository|error_message"
"SMS_EXCEPTION_MODIFY_ID_REPO","CONSOLE-644","Modification data store failed","Unable to modify data store due to service management SDK exception","Look under service management log for more information","name_of_realm|name_of_identity_repository|error_message"
"ATTEMPT_GET_ASSIGNED_SERVICE_OF_REALM","CONSOLE-701","Attempt to get assigned services of realm","View realm's service main page",,"name_of_realm"
"SUCCEED_GET_ASSIGNED_SERVICE_OF_REALM","CONSOLE-702","Getting assigned services of realm succeeded","View realm's service main page",,"name_of_realm"
"CONFIGURATION_EXCEPTION_GET_ASSIGNED_SERVICE_OF_REALM","CONSOLE-703","Getting assigned services of realm failed","Unable to get assigned services of realm due authentication configuration exception","Look under authentication log for more information","name_of_realm|error_message"
"SMS_EXCEPTION_GET_ASSIGNED_SERVICE_OF_REALM","CONSOLE-704","Getting assigned services of realm failed","Unable to get assigned services of realm due to service management SDK exception","Look under service management log for more information","name_of_realm|error_message"
"IDREPO_EXCEPTION_GET_ASSIGNED_SERVICE_OF_REALM","CONSOLE-705","Getting assigned services of realm failed","Unable to get assigned services of realm due to data store SDK exception","Look under service management log for more information","name_of_realm|error_message"
"SSO_EXCEPTION_GET_ASSIGNED_SERVICE_OF_REALM","CONSOLE-706","Getting assigned services of realm failed","Unable to get assigned services of realm. It may be the single sign on token of the user has expired; or the user does not have permission to perform this operation","Look under service management log for more information","name_of_realm|error_message"
"ATTEMPT_GET_ASSIGNABLE_SERVICE_OF_REALM","CONSOLE-711","Attempt to get assignable services of realm","View realm's service main page",,"name_of_realm"
"SUCCEED_GET_ASSIGNABLE_SERVICE_OF_REALM","CONSOLE-712","Getting assignable services of realm succeeded","View realm's service main page",,"name_of_realm"
"CONFIGURATION_EXCEPTION_GET_ASSIGNABLE_SERVICE_OF_REALM","CONSOLE-713","Getting assignable services of realm failed","Unable to get assignable services of realm due authentication configuration exception","Look under authentication log for more information","name_of_realm|error_message"
"SMS_EXCEPTION_GET_ASSIGNABLE_SERVICE_OF_REALM","CONSOLE-714","Getting assignable services of realm failed","Unable to get assignable services of realm due to service management SDK exception","Look under service management log for more information","name_of_realm|error_message"
"IDREPO_EXCEPTION_GET_ASSIGNABLE_SERVICE_OF_REALM","CONSOLE-715","Getting assignable services of realm failed","Unable to get assignable services of realm due to ID Repository management SDK exception","Look under ID Repository management log for more information","name_of_realm|error_message"
"SSO_EXCEPTION_GET_ASSIGNABLE_SERVICE_OF_REALM","CONSOLE-716","Getting assignable services of realm failed","Unable to get assignable services of realm. It may be the single sign on token of the user has expired; or the user does not have permission to perform this operation","Look under service management log for more information","name_of_realm|error_message"
"ATTEMPT_UNASSIGN_SERVICE_FROM_REALM","CONSOLE-721","Attempt to unassign service from realm","Click on Unassign button in realm's service page",,"name_of_realm|name_of_service"
"SUCCEED_UNASSIGN_SERVICE_FROM_REALM","CONSOLE-722","Unassign service from realm succeeded","Click on Unassign button in realm's service page",,"name_of_realm|name_of_service"
