name,description,icon,code
Governance,You have effective organisational security management led at board level and articulated clearly in corresponding policies. ,,A1
Risk Management,"The organisation takes appropriate steps to identify, assess and understand security risks to the network and information systems supporting the operation of essential functions. This includes an overall organisational approach to risk management. ",,A2
Asset Management,"Everything required to deliver, maintain or support networks and information systems necessary for the operation of essential functions is determined and understood. This includes data, people and systems, as well as any supporting infrastructure (such as power or cooling).",,A3
Supply Chain,The organisation understands and manages security risks to networks and information systems supporting the operation of essential functions that arise as a result of dependencies on external suppliers. This includes ensuring that appropriate measures are employed where third party services are used.,,A4
Service Protection Policies and Processes,"The organisation defines, implements, communicates and enforces appropriate policies and processes that direct its overall approach to securing systems and data that support operation of essential functions.",,B1
Identity and Access Control,"The organisation understands, documents and manages access to networks and information systems supporting the operation of essential functions. Users (or automated functions) that can access data or systems are appropriately verified, authenticated and authorised.",,B2
Data Security,"Data stored or transmitted electronically is protected from actions such as unauthorised access, modification, or deletion that may cause an adverse impact on essential functions. Such protection extends to the means by which authorised users, devices and systems access critical data necessary for the operation of essential functions. It also covers information that would assist an attacker, such as design details of networks and information systems. ",,B3
System Security,Network and information systems and technology critical for the operation of essential functions are protected from cyber attack. An organisational understanding of risk to essential functions informs the use of robust and reliable protective security measures to effectively limit opportunities for attackers to compromise networks and systems.,,B4
Resilient Networks and Systems,"The organisation builds resilience against cyber attack and system failure into the design, implementation, operation and management of systems that support the operation of essential functions.",,B5
Staff Awareness and Training,"Staff have appropriate awareness, knowledge and skills to carry out their organisational roles effectively in relation to the security of network and information systems supporting the operation of essential functions. ",,B6
Security Monitoring,The organisation monitors the security status of the networks and systems supporting the operation of essential functions in order to detect potential security problems and to track the ongoing effectiveness of protective security measures.,,C1
Proactive Security Event Discovery,"The organisation detects, within networks and information systems, malicious activity affecting, or with the potential to affect, the operation of essential functions even when the activity evades standard signature based security prevent/detect solutions (or when standard solutions are not deployable).",,C2
Response and Recovery Planning,"There are well-defined and tested incident management processes in place, that aim to ensure continuity of essential functions in the event of system or service failure. Mitigation activities designed to contain or limit the impact of compromise are also in place.",,D1
Lessons Learned,"When an incident occurs, steps are taken to understand its root causes and to ensure appropriate remediating action is taken to protect against future incidents.",,D2