capability,"capability_description",dashboard,domain,icon,level,name,"practice_description",visible
"AC-1","Policy and Procedures","AC_1_fisma","Access Control","fas fa-user-lock","Low-Medium-High","AC-1","The organization defines the personnel or roles to be recipients of the access control policy necessary to facilitate the implementation of the access control policy and associated access controls.",TRUE
"AC-2","Account Management","AC_2_fisma","Access Control","fas fa-user-lock","Low-Medium-High","AC-2","Monitor the use of accounts",TRUE
"AC-2","Account Management | Automated System Account Management","AC_2-1_fisma","Access Control","fas fa-user-lock","Medium-High","AC-2(1)","Support the management of system accounts using [Assignment: organization-defined automated mechanisms].",TRUE
"AC-2","Account Management | Usage Conditions","AC_2-11_fisma","Access Control","fas fa-user-lock",High,"AC-2(11)","Enforce [Assignment: organization-defined circumstances and/or usage conditions] for [Assignment: organization-defined system accounts].",TRUE
"AC-2","Account Management | Account Monitoring for Atypical Usage","AC_2-12_fisma","Access Control","fas fa-user-lock",High,"AC-2(12)","Monitor system accounts for [Assignment: organization-defined atypical usage]; and Report atypical usage of system accounts to [Assignment: organization-defined personnel or roles].",TRUE
"AC-2","Account Management | Disable Accounts for High-risk Individuals","AC_2-13_fisma","Access Control","fas fa-user-lock","Medium-High","AC-2(13)","Disable accounts of individuals within [Assignment: organization-defined time period] of discovery of [Assignment: organization-defined significant risks].",TRUE
"AC-2","Account Management | Automated Temporary and Emergency Account Management","AC_2-2_fisma","Access Control","fas fa-user-lock","Medium-High","AC-2(2)","Automatically [Assignment: remove, disable] temporary and emergency accounts after [Assignment: organization-defined time period for each type of account].",TRUE
"AC-2","Account Management | Disable Accounts","AC_2-3_fisma","Access Control","fas fa-user-lock","Medium-High","AC-2(3)","Disable accounts within an organization-defined time period when the accounts: Have expired; Are no longer associated with a user or individual; Are in violation of organizational policy; or Have been inactive for an organization-defined time period.",TRUE
"AC-2","Account Management | Automated Audit Actions","AC_2-4_fisma","Access Control","fas fa-user-lock","Medium-High","AC-2(4)","Automatically audit account creation, modification, enabling, disabling, and removal actions.",TRUE
"AC-2","Account Management | Inactivity Logout","AC_2-5_fisma","Access Control","fas fa-user-lock","Medium-High","AC-2(5)","Require that users log out when [Assignment: organization-defined time period of expected inactivity or description of when to log out].",TRUE
"AC-3","Access Enforcement","AC_3_fisma","Access Control","fas fa-user-lock","Low-Medium-High","AC-3","The information system enforces approved authorizations for logical access to information and system resources in accordance with applicable access control policies.",TRUE
"AC-4","Information Flow Enforcement","AC_4_fisma","Access Control","fas fa-user-lock","Medium-High","AC-4","The information system enforces approved authorizations for controlling the flow of information within the system based on organization-defined information flow control policies.",TRUE
"AC-4","Information Flow Enforcement | Flow Control of Encrypted Information","AC_4-4_fisma","Access Control","fas fa-user-lock",High,"AC-4(4)","The organization defines procedures or methods to be employed by the information system to prevent encrypted information from bypassing content-checking mechanisms, such as decrypting the information, blocking the flow of the encrypted information, and/or terminating communications sessions attempting to pass encrypted information.",TRUE
"AC-5","Separation of Duties","AC_5_fisma","Access Control","fas fa-user-lock","Medium-High","AC-5","The organization separates organization-defined duties of individuals.",TRUE
"AC-6","Least Privilege","AC_6_fisma","Access Control","fas fa-user-lock","Medium-High","AC-6","The organization employs the concept of least privilege, allowing only authorized accesses for users (and processes acting on behalf of users) which are necessary to accomplish assigned tasks in accordance with organizational missions and business functions.",TRUE
"AC-6","Least Privilege | Authorize Access to Security Functions","AC_6-1_fisma","Access Control","fas fa-user-lock","Medium-High","AC-6(1)","The organization defines the security functions (deployed in hardware, software, and firmware) for which access must be explicitly authorized.",TRUE
"AC-6","Least Privilege | Prohibit Non-privileged Users from Executing Privileged Functions","AC_6-10_fisma","Access Control","fas fa-user-lock","Medium-High","AC-6(10)","The information system prevents non-privileged users from executing privileged functions to include disabling, circumventing, or altering implemented security safeguards/countermeasures.",TRUE
"AC-6","Least Privilege | Non-privileged Access for Nonsecurity Functions","AC_6-2_fisma","Access Control","fas fa-user-lock","Medium-High","AC-6(2)","The organization requires that users of information system accounts or roles, with access to organization-defined security functions or security-relevant information, use non-privileged accounts, or roles, when accessing nonsecurity functions.",TRUE
"AC-6","Least Privilege | Network Access to Privileged Commands","AC_6-3_fisma","Access Control","fas fa-user-lock",High,"AC-6(3)","The organization authorizes network access to organization-defined privileged commands only for organization-defined compelling operational needs.",TRUE
"AC-6","Least Privilege | Privileged Accounts","AC_6-5_fisma","Access Control","fas fa-user-lock",Medium,"AC-6(5)","The organization defines the personnel or roles to whom privileged accounts are to be restricted on the information system.",TRUE
"AC-6","Least Privilege | Review of User Privileges","AC_6-7_fisma","Access Control","fas fa-user-lock","Medium-High","AC-6(7)","The organization defines the frequency on which it conducts reviews of the privileges assigned to organization-defined roles or classes of users.",TRUE
"AC-6","Least Privilege | Log Use of Privileged Functions","AC_6-9_fisma","Access Control","fas fa-user-lock","Medium-High","AC-6(9)","The information system audits the execution of privileged functions.",TRUE
"AC-7","Unsuccessful Logon Attempts","AC_7_fisma","Access Control","fas fa-user-lock","Low-Medium-High","AC-7","The organization defines the maximum number of consecutive invalid logon attempts to the information system by a user during an organization-defined time period.",TRUE
"AC-8","System Use Notification","AC_8_fisma","Access Control","fas fa-user-lock","Low-Medium-High","AC-8","The information system displays an organization-defined system use notification message or banner before granting access to the system that provides privacy and security notices consistent with applicable federal laws, Executive Orders, directives, policies, regulations, standards, and guidance.",TRUE
"AC-10","Concurrent Session Control","AC_10_fisma","Access Control","fas fa-user-lock",High,"AC-10","The information system limits the number of concurrent sessions for each organization-defined account and/or account type to an organization-defined number of sessions.",TRUE
"AC-11","Device Lock | Pattern-hiding Displays","AC_11-1_fisma","Access Control","fas fa-user-lock","Medium-High","AC-11(1)","The information system conceals, via the session lock, information previously visible on the display with a publicly viewable image.",TRUE
"AC-11","Device Lock","AC_11_fisma","Access Control","fas fa-user-lock","Medium-High","AC-11","The information system provides the capability for users to directly initiate session lock mechanisms.",TRUE
"AC-12","Session Termination","AC_12_fisma","Access Control","fas fa-user-lock","Medium-High","AC-12","The organization defines the conditions or trigger events requiring session disconnect to be employed by the information system when automatically terminating a user session.",TRUE
"AC-14","Permitted Actions Without Identification or Authentication","AC_14_fisma","Access Control","fas fa-user-lock","Low-Medium-High","AC-14","The organization identifies and defines organization-defined user actions that can be performed on the information system without identification or authentication consistent with organizational missions/business functions.",TRUE
"AC-17","Remote Access | Monitoring and Control","AC_17-1_fisma","Access Control","fas fa-user-lock","Medium-High","AC-17(1)","Employ automated mechanisms to monitor and control remote access methods.",TRUE
"AC-17","Remote Access | Protection of Confidentiality and Integrity Using Encryption","AC_17-2_fisma","Access Control","fas fa-user-lock","Medium-High","AC-17(2)","Implement cryptographic mechanisms to protect the confidentiality and integrity of remote access sessions.",TRUE
"AC-17","Remote Access | Managed Access Control Points","AC_17-3_fisma","Access Control","fas fa-user-lock","Medium-High","AC-17(3)","Route remote accesses through authorized and managed network access control points.",TRUE
"AC-17","Remote Access | Privileged Commands and Access","AC_17-4_fisma","Access Control","fas fa-user-lock","Medium-High","AC-17(4)","Authorize the execution of privileged commands and access to security-relevant information via remote access only in a format that provides assessable evidence and for the following needs: [Assignment: organization-defined needs]; and Document the rationale for remote access in the security plan for the system.",TRUE
"AC-17","Remote Access","AC_17_fisma","Access Control","fas fa-user-lock","Medium-High","AC-17","Establish and document usage restrictions, configuration/connection requirements, and implementation guidance for each type of remote access allowed; and
Authorize each type of remote access to the system prior to allowing such connections.",TRUE
"AC-18","Wireless Access | Authentication and Encryption","AC_18-1_fisma","Access Control","fas fa-user-lock","Medium-High","AC-18(1)","Protect wireless access to the system using authentication of [Assignment (one or more): users, devices] and encryption.",TRUE
"AC-18","Wireless Access | Disable Wireless Networking","AC_18-3_fisma","Access Control","fas fa-user-lock","Medium-High","AC-18(3)","Disable, when not intended for use, wireless networking capabilities embedded within system components prior to issuance and deployment.",TRUE
"AC-18","Wireless Access | Restrict Configurations by Users","AC_18-4_fisma","Access Control","fas fa-user-lock",High,"AC-18(4)","Identify and explicitly authorize users allowed to independently configure wireless networking capabilities.",TRUE
"AC-18","Wireless Access | Antennas and Transmission Power Levels","AC_18-5_fisma","Access Control","fas fa-user-lock",High,"AC-18(5)","Select radio antennas and calibrate transmission power levels to reduce the probability that signals from wireless access points can be received outside of organization-controlled boundaries.",TRUE
"AC-18","Wireless Access","AC_18_fisma","Access Control","fas fa-user-lock","Low-Medium-High","AC-18","Establish configuration requirements, connection requirements, and implementation guidance for each type of wireless access; and
Authorize each type of wireless access to the system prior to allowing such connections.",TRUE
"AC-19","Access Control for Mobile Devices | Full Device or Container-based Encryption","AC_19-5_fisma","Access Control","fas fa-user-lock","Medium-High","AC-19(5)","Employ [Assignment: full-device encryption, container-based encryption] to protect the confidentiality and integrity of information on [Assignment: organization-defined mobile devices].",TRUE
"AC-19","Access Control for Mobile Devices","AC_19_fisma","Access Control","fas fa-user-lock","Low-Medium-High","AC-19","Establish configuration requirements, connection requirements, and implementation guidance for organization-controlled mobile devices, to include when such devices are outside of controlled areas; and
Authorize the connection of mobile devices to organizational systems.",TRUE
"AC-20","Use of External Systems | Limits on Authorized Use","AC_20-1_fisma","Access Control","fas fa-user-lock","Medium-High","AC-20(1)","The organization permits authorized individuals to use an external information system to access the information system only when the organization verifies the implementation of required security controls on the external system as specified in the organization^s information security policy and security plan.",TRUE
"AC-20","Use of External Systems | Portable Storage Devices - Restricted Use","AC_20-2_fisma","Access Control","fas fa-user-lock","Medium-High","AC-20(2)","Restrict the use of organization-controlled portable storage devices by authorized individuals on external systems using [Assignment: organization-defined restrictions]",TRUE
"AC-20","Use of External Systems","AC_20_fisma","Access Control","fas fa-user-lock","Low-Medium-High","AC-20","The organization establishes terms and conditions, consistent with any trust relationships established with other organizations owning, operating, and/or maintaining external information systems, allowing authorized individuals to access the information system from the external information systems.",TRUE
"AC-21","Information Sharing","AC_21_fisma","Access Control","fas fa-user-lock","Medium-High","AC-21","The organization facilitates information sharing by enabling authorized users to determine whether access authorizations assigned to the sharing partner match the access restrictions on the information for organization-defined information circumstances where user discretion is required.",TRUE
"AC-22","Publicly Accessible Content","AC_22_fisma","Access Control","fas fa-user-lock","Low-Medium-High","AC-22","The organization designates individuals authorized to post information onto a publicly accessible information system.",TRUE
"CA-1","Policy and Procedures","CA_1_fisma","Assessment, Authorization, And Monitoring","fas fa-user-lock","Low-Medium-High","CA-1","The organization defines the personnel or roles to whom security assessment and authorization policy is to be disseminated.",TRUE
"CA-2","Control Assessments","CA_2_fisma","Assessment, Authorization, And Monitoring","fas fa-user-lock","Low-Medium-High","CA-2","The organization develops a security assessment plan for the information system and its environment of operation.",TRUE
"CA-2","Control Assessments | Independent Assessors","CA_2-1_fisma","Assessment, Authorization, And Monitoring","fas fa-user-lock","Medium-High","CA-2(1)","The organization employs assessors or assessment teams with an organization-defined level of independence to conduct security control assessments of organizational information systems.",TRUE
"CA-2","Control Assessments | Specialized Assessments","CA_2-2_fisma","Assessment, Authorization, And Monitoring","fas fa-user-lock",High,"CA-2(2)","The organization includes, as part of security control assessments announced or unannounced, one or more of the following: in-depth monitoring; vulnerability scanning; malicious user testing; insider threat assessment; performance/load testing; and organization-defined other forms of security assessment on an organization-defined frequency.",TRUE
"CA-3","Information Exchange","CA_3_fisma","Assessment, Authorization, And Monitoring","fas fa-user-lock","Low-Medium-High","CA-3","The organization authorizes connections from the information system to other information systems through the use of Interconnection Security Agreements.",TRUE
"CA-3","Information Exchange | Transfer Authorizations","CA_3-6_fisma","Assessment, Authorization, And Monitoring","fas fa-user-lock",High,"CA-3(6)","Verify that individuals or systems transferring data between interconnecting systems have the requisite authorizations (i.e., write permissions or privileges) prior to accepting such data.",TRUE
"CA-5","Plan of Action and Milestones","CA_5_fisma","Assessment, Authorization, And Monitoring","fas fa-user-lock","Low-Medium-High","CA-5","The organization develops a plan of action and milestones for the information system to document the organization^s planned remedial actions to correct weaknesses or deficiencies noted during the assessment of the security controls and to reduce or eliminate known vulnerabilities in the system.",TRUE
"CA-6",Authorization,"CA_6_fisma","Assessment, Authorization, And Monitoring","fas fa-user-lock","Low-Medium-High","CA-6","The organization assigns a senior-level executive or manager as the authorizing official for the information system.",TRUE
"CA-7","Continuous Monitoring","CA_7_fisma","Assessment, Authorization, And Monitoring","fas fa-user-lock","Low-Medium-High","CA-7","The organization develops a continuous monitoring strategy.",TRUE
"CA-7","Continuous Monitoring | Independent Assessment","CA_7-1_fisma","Assessment, Authorization, And Monitoring","fas fa-user-lock","Medium-High","CA-7(1)","The organization employs assessors or assessment teams with an organization-defined level of independence to monitor the security controls in the information system on an ongoing basis.",TRUE
"CA-7","Continuous Monitoring | Risk Monitoring","CA_7-4_fisma","Assessment, Authorization, And Monitoring","fas fa-user-lock","Low-Medium-High","CA-7(4)","Ensure risk monitoring is an integral part of the continuous monitoring strategy that includes the following: Effectiveness monitoring; Compliance monitoring; and Change monitoring.",TRUE
"CA-8","Penetration Testing","CA_8_fisma","Assessment, Authorization, And Monitoring","fas fa-user-lock",High,"CA-8","The organization conducts penetration testing in accordance with organization-defined frequency on organization-defined information systems or system components.",TRUE
"CA-8","Penetration Testing | Independent Penetration Testing Agent or Team","CA_8-1_fisma","Assessment, Authorization, And Monitoring","fas fa-user-lock",High,"CA-8(1)","The organization employs an independent penetration agent or penetration team to perform penetration testing on the information system or system components.",TRUE
"CA-9","Internal System Connections","CA_9_fisma","Assessment, Authorization, And Monitoring","fas fa-user-lock","Low-Medium-High","CA-9","The organization authorizes internal connections of organization-defined information system components or classes of components to the information system.",TRUE
"AU-1","Policy and Procedures","AU_1_fisma","Audit and Accountability","fas fa-user-lock","Low-Medium-High","AU-1","The organization defines the organizational personnel or roles to whom the audit and accountability policy is to be disseminated.",TRUE
"AU-2","Event Logging","AU_2_fisma","Audit and Accountability","fas fa-user-lock","Low-Medium-High","AU-2","The organization defines the information system auditable events.",TRUE
"AU-3","Content of Audit Records","AU_3_fisma","Audit and Accountability","fas fa-user-lock","Low-Medium-High","AU-3","The information system generates audit records containing information that establishes what type of event occurred.",TRUE
"AU-3","Content of Audit Records | Additional Audit Information","AU_3-1_fisma","Audit and Accountability","fas fa-user-lock","Medium-High","AU-3(1)","The information system generates audit records containing the organization-defined additional, more detailed information that is to be included in the audit records.",TRUE
"AU-4","Audit Log Storage Capacity","AU_4_fisma","Audit and Accountability","fas fa-user-lock","Low-Medium-High","AU-4","The organization allocates audit record storage capacity in accordance with organization-defined audit record storage requirements.",TRUE
"AU-5","Response to Audit Logging Process Failures","AU_5_fisma","Audit and Accountability","fas fa-user-lock","Low-Medium-High","AU-5","The organization defines actions to be taken by the information system upon audit failure (e.g., shut down information system, overwrite oldest audit records, stop generating audit records).",TRUE
"AU-5","Response to Audit Logging Process Failures | Storage Capacity Warning","AU_5-1_fisma","Audit and Accountability","fas fa-user-lock",High,"AU-5(1)","The organization defines the personnel, roles and/or locations to receive a warning when allocated audit record storage volume reaches a defined percentage of maximum audit records storage capacity.",TRUE
"AU-5","Response to Audit Logging Process Failures | Real-time Alerts","AU_5-2_fisma","Audit and Accountability","fas fa-user-lock",High,"AU-5(2)","The organization defines the real-time period within which the information system is to provide an alert when organization-defined audit failure events occur.",TRUE
"AU-6","Audit Record Review, Analysis, and Reporting","AU_6_fisma","Audit and Accountability","fas fa-user-lock","Low-Medium-High","AU-6","The organization defines the personnel or roles to receive the reports of organization-defined inappropriate or unusual activity.",TRUE
"AU-6","Audit Record Review, Analysis, and Reporting | Automated Process Integration","AU_6-1_fisma","Audit and Accountability","fas fa-user-lock",Medium,"AU-6(1)","The organization employs automated mechanisms to integrate audit review and analysis to support organizational processes for investigation of and response to suspicious activities.",TRUE
"AU-6","Audit Record Review, Analysis, and Reporting | Correlate Audit Record Repositories","AU_6-3_fisma","Audit and Accountability","fas fa-user-lock",High,"AU-6(3)","The organization analyzes and correlates audit records across different repositories to gain organization-wide situational awareness.",TRUE
"AU-6","Audit Record Review, Analysis, and Reporting | Integrated Analysis of Audit Records","AU_6-5_fisma","Audit and Accountability","fas fa-user-lock",High,"AU-6(5)","The organization defines the data/information to be collected from other sources to enhance its ability to identify inappropriate or unusual activity.",TRUE
"AU-6","Audit Record Review, Analysis, and Reporting | Correlation with Physical Monitoring","AU_6-6_fisma","Audit and Accountability","fas fa-user-lock",High,"AU-6(6)","The organization correlates information from audit records with information obtained from monitoring physical access to further enhance the ability to identify suspicious, inappropriate, unusual, or malevolent activity.",TRUE
"AU-7","Audit Record Reduction and Report Generation","AU_7_fisma","Audit and Accountability","fas fa-user-lock","Medium-High","AU-7","The information system provides a report generation capability that does not alter original content or time ordering of audit records.",TRUE
"AU-7","Audit Record Reduction and Report Generation | Automatic Processing","AU_7-1_fisma","Audit and Accountability","fas fa-user-lock","Medium-High","AU-7(1)","The information system provides the capability to process audit records for events of interest based on organization-defined audit fields within audit records.",TRUE
"AU-8","Time Stamps","AU_8_fisma","Audit and Accountability","fas fa-user-lock","Low-Medium-High","AU-8","The information system records time stamps for audit records that can be mapped to Coordinated Universal Time (UTC) or Greenwich Mean Time (GMT).",TRUE
"AU-9","Protection of Audit Information","AU_9_fisma","Audit and Accountability","fas fa-user-lock","Low-Medium-High","AU-9","The information system protects audit tools from unauthorized deletion.",TRUE
"AU-9","Protection of Audit Information | Store on Separate Physical Systems or Components","AU_9-2_fisma","Audit and Accountability","fas fa-user-lock",High,"AU-9(2)","The information system backs up audit records on an organization-defined frequency onto a different system or system component than the system or component being audited.",TRUE
"AU-9","Protection of Audit Information | Cryptographic Protection","AU_9-3_fisma","Audit and Accountability","fas fa-user-lock",High,"AU-9(3)","The information system implements cryptographic mechanisms to protect the integrity of audit information.",TRUE
"AU-9","Protection of Audit Information | Access by Subset of Privileged Users","AU_9-4_fisma","Audit and Accountability","fas fa-user-lock","Medium-High","AU-9(4)","The organization defines the subset of privileged users who will be authorized access to the management of audit functionality.",TRUE
"AU-10","Non-repudiation","AU_10_fisma","Audit and Accountability","fas fa-user-lock",High,"AU-10","The organization defines the actions to be covered by non-repudiation.",TRUE
"AU-11","Audit Record Retention","AU_11_fisma","Audit and Accountability","fas fa-user-lock","Low-Medium-High","AU-11","The organization defines the time period for retention of audit records, which is consistent with its records retention policy, to provide support for after-the-fact investigations of security incidents and meet regulatory and organizational information retention requirements.",TRUE
"AU-12","Audit Record Generation | System-wide and Time-correlated Audit Trail","AU_12-1_fisma","Audit and Accountability","fas fa-user-lock",High,"AU-12(1)","The organization defines the level of tolerance for relationship between time stamps of individual records in the audit trail that will be used for correlation.",TRUE
