capability,"capability_description",dashboard,domain,icon,level,name,"practice_description",visible
"AU-12","Audit Record Generation | Changes by Authorized Individuals","AU_12-3_fisma","Audit and Accountability","fas fa-user-lock",High,"AU-12(3)","The organization defines the selectable event criteria to be used as the basis for changes to the auditing to be performed on organization-defined information system components, by organization-defined individuals or roles, within organization-defined time thresholds.",TRUE
"AU-12","Audit Record Generation","AU_12_fisma","Audit and Accountability","fas fa-user-lock","Low-Medium-High","AU-12","The information system provides audit record generation capability for the auditable events defined in AU-2 a. at organization-defined information system components.",TRUE
"AT-1","Policy and Procedures","AT_1_fisma","Awareness and Training","fas fa-user-lock","Low-Medium-High","AT-1","The organization defines the personnel or roles to whom the security awareness and training policy is disseminated.",TRUE
"AT-2","Literacy Training and Awareness","AT_2_fisma","Awareness and Training","fas fa-user-lock","Low-Medium-High","AT-2","The organization provides basic security awareness training to information system users (including managers, senior executives, and contractors) as part of initial training for new users.",TRUE
"AT-2","Literacy Training and Awareness | Insider Threat","AT_2-2_fisma","Awareness and Training","fas fa-user-lock","Low-Medium-High","AT-2(2)","The organization includes security awareness training on recognizing and reporting potential indicators of insider threat.",TRUE
"AT-2","Literacy Training and Awareness | Social Engineering and Mining","AT_2-3_fisma","Awareness and Training","fas fa-user-lock","Medium-High","AT-2(3)","Provide literacy training on recognizing and reporting potential and actual instances of social engineering and social mining.",TRUE
"AT-3","Role-based Training","AT_3_fisma","Awareness and Training","fas fa-user-lock","Low-Medium-High","AT-3","The organization provides role-based security training to personnel with assigned security roles and responsibilities before authorizing access to the information system or performing assigned duties.",TRUE
"AT-4","Training Records","AT_4_fisma","Awareness and Training","fas fa-user-lock","Low-Medium-High","AT-4","The organization documents individual information system security training activities, including basic security awareness training and specific information system security training.",TRUE
"CM-1","Policy and Procedures","CM_1_fisma","Configuration Management","fas fa-user-lock","Low-Medium-High","CM-1","The organization defines the organizational personnel or roles to whom the configuration management policy is to be disseminated.",TRUE
"CM-2","Baseline Configuration","CM_2_fisma","Configuration Management","fas fa-user-lock","Low-Medium-High","CM-2","The organization maintains, under configuration control, a current baseline configuration of the information system.",TRUE
"CM-2","Baseline Configuration | Automation Support for Accuracy and Currency","CM_2-2_fisma","Configuration Management","fas fa-user-lock","Medium-High","CM-2(2)","The organization employs automated mechanisms to maintain a readily available baseline configuration of the information system.",TRUE
"CM-2","Baseline Configuration | Retention of Previous Configurations","CM_2-3_fisma","Configuration Management","fas fa-user-lock","Medium-High","CM-2(3)","The organization retains organization-defined previous versions of baseline configurations of the information system to support rollback.",TRUE
"CM-2","Baseline Configuration | Configure Systems and Components for High-risk Areas","CM_2-7_fisma","Configuration Management","fas fa-user-lock","Medium-High","CM-2(7)","The organization defines the information systems, system components, or devices that are to have organization-defined configurations applied when located in areas of significant risk.",TRUE
"CM-3","Configuration Change Control","CM_3_fisma","Configuration Management","fas fa-user-lock","Medium-High","CM-3","The organization coordinates and provides oversight for configuration change control activities through an organization-defined configuration change control element (e.g., committee, board) that convenes at the organization-defined frequency and/or for any organization-defined configuration change conditions.",TRUE
"CM-3","Configuration Change Control | Automated Documentation, Notification, and Prohibition of Changes","CM_3-1_fisma","Configuration Management","fas fa-user-lock",High,"CM-3(1)","The organization employs automated mechanisms to notify organization-defined personnel when approved changes to the information system are completed.",TRUE
"CM-3","Configuration Change Control | Testing, Validation, and Documentation of Changes","CM_3-2_fisma","Configuration Management","fas fa-user-lock",Medium,"CM-3(2)","The organization tests changes to the information system before implementing the changes on the operational system.",TRUE
"CM-3","Configuration Change Control | Security and Privacy Representatives","CM_3-4_fisma","Configuration Management","fas fa-user-lock","Medium-High","CM-3(4)","The organization requires an information security representative to be a member of the organization-defined configuration change control element.",TRUE
"CM-3","Configuration Change Control | Cryptography Management","CM_3-6_fisma","Configuration Management","fas fa-user-lock",High,"CM-3(6)","The organization defines the security safeguards that are to be provided by the cryptographic mechanisms which are employed by the organization.",TRUE
"CM-4","Impact Analyses","CM_4_fisma","Configuration Management","fas fa-user-lock","Low-Medium-High","CM-4","The organization analyzes changes to the information system to determine potential security impacts prior to change implementation.",TRUE
"CM-4","Impact Analyses | Separate Test Environments","CM_4-1_fisma","Configuration Management","fas fa-user-lock",High,"CM-4(1)","The organization, when analyzing changes to the information system, looks for security impacts due to flaws, weaknesses, incompatibility, or intentional malice.",TRUE
"CM-4","Impact Analyses | Verification of Controls","CM_4-2_fisma","Configuration Management","fas fa-user-lock","Medium-High","CM-4(2)","The organization, after the information system is changed, checks the security functions to verify the functions are producing the desired outcome with regard to meeting the security requirements for the system.",TRUE
"CM-5","Access Restrictions for Change","CM_5_fisma","Configuration Management","fas fa-user-lock","Low-Medium-High","CM-5","The organization enforces logical access restrictions associated with changes to the information system.",TRUE
"CM-5","Access Restrictions for Change | Automated Access Enforcement and Audit Records","CM_5-1_fisma","Configuration Management","fas fa-user-lock",High,"CM-5(1)","The information system enforces access restrictions.",TRUE
"CM-6","Configuration Settings","CM_6_fisma","Configuration Management","fas fa-user-lock","Low-Medium-High","CM-6","The organization defines security configuration checklists to be used to establish and document configuration settings for the information system technology products employed.",TRUE
"CM-6","Configuration Settings | Automated Management, Application, and Verification","CM_6-1_fisma","Configuration Management","fas fa-user-lock",High,"CM-6(1)","The organization employs automated mechanisms to centrally manage configuration settings for organization-defined information system components.",TRUE
"CM-6","Configuration Settings | Respond to Unauthorized Changes","CM_6-2_fisma","Configuration Management","fas fa-user-lock",High,"CM-6(2)","The organization employs organization-defined security safeguards to respond to unauthorized changes to organization-defined configuration settings.",TRUE
"CM-7","Least Functionality","CM_7_fisma","Configuration Management","fas fa-user-lock","Low-Medium-High","CM-7","The organization configures the information system to provide only essential capabilities.",TRUE
"CM-7","Least Functionality | Periodic Review","CM_7-1_fisma","Configuration Management","fas fa-user-lock","Medium-High","CM-7(1)","The organization reviews the information system per organization-defined frequency to identify unnecessary and nonsecure functions, ports, protocols, and services.",TRUE
"CM-7","Least Functionality | Prevent Program Execution","CM_7-2_fisma","Configuration Management","fas fa-user-lock","Medium-High","CM-7(2)","The information system prevents program execution in accordance with organization-defined policies regarding software program usage and restrictions, and/or rules authorizing the terms and conditions of software program usage.",TRUE
"CM-7","Least Functionality | Authorized Software ? Allow-by-exception","CM_7-5_fisma","Configuration Management","fas fa-user-lock","Medium-High","CM-7(5)","The organization reviews and updates the list of authorized software programs per organization-defined frequency.",TRUE
"CM-8","System Component Inventory","CM_8_fisma","Configuration Management","fas fa-user-lock","Low-Medium-High","CM-8","The organization reviews and updates the information system component inventory per organization-defined frequency.",TRUE
"CM-8","System Component Inventory | Updates During Installation and Removal","CM_8-1_fisma","Configuration Management","fas fa-user-lock","Medium-High","CM-8(1)","The organization updates the inventory of information system components as an integral part of component installations.",TRUE
"CM-8","System Component Inventory | Automated Maintenance","CM_8-2_fisma","Configuration Management","fas fa-user-lock",High,"CM-8(2)","The organization employs automated mechanisms to help maintain a readily available inventory of information system components.",TRUE
"CM-8","System Component Inventory | Automated Unauthorized Component Detection","CM_8-3_fisma","Configuration Management","fas fa-user-lock","Medium-High","CM-8(3)","When unauthorized hardware, software, and firmware components are detected within the information system, the organization takes action to disable network access by such components, isolates the components, and/or notifies organization-defined personnel or roles.",TRUE
"CM-8","System Component Inventory | Accountability Information","CM_8-4_fisma","Configuration Management","fas fa-user-lock",High,"CM-8(4)","The organization includes, in the information system component inventory information, a means for identifying by name, position, and/or role, individuals responsible/accountable for administering those components.",TRUE
"CM-9","Configuration Management Plan","CM_9_fisma","Configuration Management","fas fa-user-lock","Medium-High","CM-9","The organization develops a configuration management plan for the information system that places the configuration items under configuration management.",TRUE
"CM-10","Software Usage Restrictions","CM_10_fisma","Configuration Management","fas fa-user-lock","Low-Medium-High","CM-10","The organization documents the use of peer-to-peer file sharing technology to ensure that this capability is not used for the unauthorized distribution, display, performance, or reproduction of copyrighted work.",TRUE
"CM-11","User-installed Software","CM_11_fisma","Configuration Management","fas fa-user-lock","Low-Medium-High","CM-11","The organization monitors software installation policy compliance per an organization-defined frequency.",TRUE
"CP-1","Policy and Procedures","CP_1_fisma","Contingency Planning","fas fa-user-lock","Low-Medium-High","CP-1","The organization develops and documents a contingency planning policy that addresses purpose, scope, roles, responsibilities, management commitment, coordination among organizational entities, and compliance.",TRUE
"CP-2","Contingency Plan","CP_2_fisma","Contingency Planning","fas fa-user-lock","Low-Medium-High","CP-2","The organization develops a contingency plan for the information system that addresses maintaining essential business functions despite an information system disruption.",TRUE
"CP-2","Contingency Plan | Coordinate with Related Plans","CP_2-1_fisma","Contingency Planning","fas fa-user-lock","Medium-High","CP-2(1)","The organization coordinates contingency plan development with organizational elements responsible for related plans.",TRUE
"CP-2","Contingency Plan | Capacity Planning","CP_2-2_fisma","Contingency Planning","fas fa-user-lock",High,"CP-2(2)","The organization conducts capacity planning so that necessary capacity for environmental support exists during contingency operations.",TRUE
"CP-2","Contingency Plan | Resume Mission and Business Functions","CP_2-3_fisma","Contingency Planning","fas fa-user-lock","Medium-High","CP-2(3)","The organization defines the time period for planning the resumption of essential missions as a result of contingency plan activation.",TRUE
"CP-2","Contingency Plan | Continue Mission and Business Functions","CP_2-5_fisma","Contingency Planning","fas fa-user-lock",High,"CP-2(5)","The organization sustains operational continuity of essential business functions until full information system restoration at primary processing and/or storage sites.",TRUE
"CP-2","Contingency Plan | Identify Critical Assets","CP_2-8_fisma","Contingency Planning","fas fa-user-lock","Medium-High","CP-2(8)","The organization identifies critical information system assets supporting essential business functions.",TRUE
"CP-3","Contingency Training","CP_3_fisma","Contingency Planning","fas fa-user-lock","Low-Medium-High","CP-3","The organization provides refresher contingency training to information system users consistent with assigned roles and responsibilities in accordance with organization-defined frequency.",TRUE
"CP-3","Contingency Training | Simulated Events","CP_3-1_fisma","Contingency Planning","fas fa-user-lock",High,"CP-3(1)","The organization incorporates simulated events into contingency training to facilitate effective response by personnel in crisis situations.",TRUE
"CP-4","Contingency Plan Testing","CP_4_fisma","Contingency Planning","fas fa-user-lock","Low-Medium-High","CP-4","The organization initiates corrective actions, if needed, after reviewing the contingency plan test results.",TRUE
"CP-4","Contingency Plan Testing | Coordinate with Related Plans","CP_4-1_fisma","Contingency Planning","fas fa-user-lock","Medium-High","CP-4(1)","The organization coordinates contingency plan testing with organizational elements responsible for related plans.",TRUE
"CP-4","Contingency Plan Testing | Alternate Processing Site","CP_4-2_fisma","Contingency Planning","fas fa-user-lock",High,"CP-4(2)","The organization tests the contingency plan at the alternate processing site to familiarize contingency personnel with the facility and available resources.",TRUE
"CP-6","Alternate Storage Site","CP_6_fisma","Contingency Planning","fas fa-user-lock","Medium-High","CP-6","The organization ensures that the alternate storage site provides information security safeguards equivalent to that of the primary site.",TRUE
"CP-6","Alternate Storage Site | Separation from Primary Site","CP_6-1_fisma","Contingency Planning","fas fa-user-lock","Medium-High","CP-6(1)","The organization identifies an alternate storage site that is separated from the primary storage site to reduce susceptibility to the same threats.",TRUE
"CP-6","Alternate Storage Site | Recovery Time and Recovery Point Objectives","CP_6-2_fisma","Contingency Planning","fas fa-user-lock",High,"CP-6(2)","The organization configures the alternate storage site to facilitate recovery operations in accordance with recovery time and recovery point objectives.",TRUE
"CP-6","Alternate Storage Site | Accessibility","CP_6-3_fisma","Contingency Planning","fas fa-user-lock","Medium-High","CP-6(3)","The organization outlines explicit mitigation actions for organization identified accessibility problems to the alternate storage site in the event of an area-wide disruption or disaster.",TRUE
"CP-7","Alternate Processing Site","CP_7_fisma","Contingency Planning","fas fa-user-lock","Medium-High","CP-7","The organization ensures that the alternate processing site provides information security safeguards equivalent to that of the primary site.",TRUE
"CP-7","Alternate Processing Site | Separation from Primary Site","CP_7-1_fisma","Contingency Planning","fas fa-user-lock","Medium-High","CP-7(1)","The organization identifies an alternate processing site that is separated from the primary processing site to reduce susceptibility to the same threats.",TRUE
"CP-7","Alternate Processing Site | Accessibility","CP_7-2_fisma","Contingency Planning","fas fa-user-lock","Medium-High","CP-7(2)","The organization outlines explicit mitigation actions for organization-identified potential accessibility problems to the alternate processing site in the event of an area-wide disruption or disaster.",TRUE
"CP-7","Alternate Processing Site | Priority of Service","CP_7-3_fisma","Contingency Planning","fas fa-user-lock","Medium-High","CP-7(3)","The organization develops alternate processing site agreements that contain priority-of-service provisions in accordance with the organizational availability requirements (including recovery time objectives).",TRUE
"CP-7","Alternate Processing Site | Preparation for Use","CP_7-4_fisma","Contingency Planning","fas fa-user-lock",High,"CP-7(4)","The organization prepares the alternate processing site so that it is ready to be used as the operational site supporting essential missions.",TRUE
"CP-8","Telecommunications Services","CP_8_fisma","Contingency Planning","fas fa-user-lock","Medium-High","CP-8","The organization defines the information system operations to be resumed for essential business functions within the organization-defined time period when the primary telecommunications capabilities are unavailable at either the primary or alternate processing or storage sites.",TRUE
"CP-8","Telecommunications Services | Priority of Service Provisions","CP_8-1_fisma","Contingency Planning","fas fa-user-lock","Medium-High","CP-8(1)","The organization develops primary telecommunications service agreements that contain priority-of-service provisions in accordance with the organization^s availability requirements (including recovery time objectives).",TRUE
"CP-8","Telecommunications Services | Single Points of Failure","CP_8-2_fisma","Contingency Planning","fas fa-user-lock","Medium-High","CP-8(2)","The organization obtains alternate telecommunications services to reduce the likelihood of sharing a single point of failure with primary telecommunications services.",TRUE
"CP-8","Telecommunications Services | Separation of Primary and Alternate Providers","CP_8-3_fisma","Contingency Planning","fas fa-user-lock",High,"CP-8(3)","The organization obtains alternate telecommunications services from providers that are separated from primary service providers to reduce susceptibility to the same threats.",TRUE
"CP-8","Telecommunications Services | Provider Contingency Plan","CP_8-4_fisma","Contingency Planning","fas fa-user-lock",High,"CP-8(4)","The organization requires primary telecommunications service providers to have contingency plans.",TRUE
"CP-9","System Backup","CP_9_fisma","Contingency Planning","fas fa-user-lock","Low-Medium-High","CP-9","The organization protects the confidentiality, integrity, and availability of backup information at storage locations.",TRUE
"CP-9","System Backup | Testing for Reliability and Integrity","CP_9-1_fisma","Contingency Planning","fas fa-user-lock","Medium-High","CP-9(1)","The organization defines the frequency with which to test backup information to verify media reliability and information integrity.",TRUE
"CP-9","System Backup | Test Restoration Using Sampling","CP_9-2_fisma","Contingency Planning","fas fa-user-lock",High,"CP-9(2)","The organization uses a sample of backup information in the restoration of selected information system functions as part of contingency plan testing.",TRUE
"CP-9","System Backup | Separate Storage for Critical Information","CP_9-3_fisma","Contingency Planning","fas fa-user-lock",High,"CP-9(3)","The organization stores backup copies of organization-defined critical information system software and other security-related information in a separate facility or in a fire-rated container that is not collocated with the operational system.",TRUE
"CP-9","System Backup | Transfer to Alternate Storage Site","CP_9-5_fisma","Contingency Planning","fas fa-user-lock",High,"CP-9(5)","The organization defines the time period and transfer rate of the information system backup information to the alternate storage site consistent with the recovery time and recovery point objectives.",TRUE
"CP-9","System Backup | Cryptographic Protection","CP_9-8_fisma","Contingency Planning","fas fa-user-lock","Medium-High","CP-9(8)","The organization enforces dual authorization for the deletion or destruction of organization-defined backup information.",TRUE
"CP-10","System Recovery and Reconstitution | Transaction Recovery","CP_10-2_fisma","Contingency Planning","fas fa-user-lock","Medium-High","CP-10(2)","The information system implements transaction recovery for systems that are transaction-based.",TRUE
"CP-10","System Recovery and Reconstitution | Restore Within Time Period","CP_10-4_fisma","Contingency Planning","fas fa-user-lock",High,"CP-10(4)","The organization defines restoration time periods within which to restore information system components from configuration-controlled and integrity-protected information representing a known, operational state for the components.",TRUE
"CP-10","System Recovery and Reconstitution","CP_10_fisma","Contingency Planning","fas fa-user-lock","Low-Medium-High","CP-10","The organization provides for the recovery and reconstitution of the information system to a known state after a failure.",TRUE
"IA-1","Policy and Procedures","IA_1_fisma","Identification and Authentication","fas fa-user-lock","Low-Medium-High","IA-1","The organization defines the personnel or roles to be recipients of the identification and authentication policy and the procedures to facilitate the implementation of the identification and authentication policy and associated identification and authentication controls.",TRUE
"IA-2","Identification and Authentication (Organizational Users)","IA_2_fisma","Identification and Authentication","fas fa-user-lock","Low-Medium-High","IA-2","The information system uniquely identifies and authenticates organizational users (or processes acting on behalf of organizational users).",TRUE
"IA-2","Identification and Authentication (Organizational Users) | Multi-factor Authentication to Privileged Accounts","IA_2-1_fisma","Identification and Authentication","fas fa-user-lock","Low-Medium-High","IA-2(1)","The information system implements multifactor authentication for network access to privileged accounts.",TRUE
"IA-2","Identification and Authentication (Organizational Users) | Acceptance of PIV Credentials","IA_2-12_fisma","Identification and Authentication","fas fa-user-lock","Low-Medium-High","IA-2(12)","The information system electronically verifies Personal Identity Verification (PIV) credentials.",TRUE
"IA-2","Identification and Authentication (Organizational Users) | Multi-factor Authentication to Non-privileged Accounts","IA_2-2_fisma","Identification and Authentication","fas fa-user-lock","Low-Medium-High","IA-2(2)","The information system implements multifactor authentication for network access to non-privileged accounts.",TRUE
"IA-2","Identification and Authentication (Organizational Users) | Individual Authentication with Group Authentication","IA_2-5_fisma","Identification and Authentication","fas fa-user-lock",High,"IA-2(5)","The organization requires individuals to be authenticated with an individual authenticator when a group authenticator is employed.",TRUE
"IA-2","Identification and Authentication (Organizational Users) | Access to Accounts ? Replay Resistant","IA_2-8_fisma","Identification and Authentication","fas fa-user-lock","Low-Medium-High","IA-2(8)","The information system implements replay-resistant authentication mechanisms for network access to privileged accounts.",TRUE
"IA-3","Device Identification and Authentication","IA_3_fisma","Identification and Authentication","fas fa-user-lock","Medium-High","IA-3","The information system authenticates an organization-defined list of specific and/or types of devices before establishing a local, remote, or network connection.",TRUE
"IA-4","Identifier Management","IA_4_fisma","Identification and Authentication","fas fa-user-lock","Low-Medium-High","IA-4","The organization manages information system identifiers by disabling the identifier after an organization-defined time period of inactivity.",TRUE
"IA-4","Identifier Management | Identify User Status","IA_4-4_fisma","Identification and Authentication","fas fa-user-lock","Medium-High","IA-4(4)","The organization manages individual identifiers by uniquely identifying each individual by organization-defined characteristics identifying individual status.",TRUE
"IA-5","Authenticator Management","IA_5_fisma","Identification and Authentication","fas fa-user-lock","Low-Medium-High","IA-5","The organization manages information system authenticators by implementing administrative procedures for lost/compromised authenticators.",TRUE
"IA-5","Authenticator Management | Password-based Authentication","IA_5-1_fisma","Identification and Authentication","fas fa-user-lock","Low-Medium-High","IA-5(1)","The information system enforces password complexity by the minimum number of upper case characters used.",TRUE
