options,order,question,type,description
,1,"## Permissions Review\nConfirm the saved search has the right owner, sharing scope, and role permissions for its operational purpose.",markdown,
"yes,no,n/a",2,Is the sharing scope appropriate (private/app/global)?,radio,"Private searches are easy to lose; global searches should be justified."
"yes,no,n/a",3,Is the owner the right person or role for ongoing maintenance?,radio,"Prefer durable ownership such as a team/service account where possible."
"yes,no,n/a",4,Are read permissions limited to the right roles?,radio,"Confirm sensitive search logic or data access is not overexposed."
"yes,no,n/a",5,Are write permissions limited to the right roles?,radio,"Only maintainers should be able to alter production detections."
,6,Permissions review notes,freetext,"Record ownership changes, permission fixes, or approvals."
