options,order,question,type,description
,1,"## Intent Review\nConfirm the detection has a clear reason to exist and that its assumptions are visible to future maintainers.",markdown,
,2,What is this detection intended to catch?,freetext,"Describe the suspicious behaviour, affected platform, and expected investigation outcome."
"yes,no,partial",3,Is the intent clearly documented in the description?,radio,"The saved-search description should be enough for an analyst to understand why the search exists."
"yes,no,n/a",4,Is the threat model for this detection understood?,radio,"Reference attacker behaviour, MITRE technique, control gap, or business risk when applicable."
,5,Known limitations or scope notes,freetext,"Document blind spots, expected false positives, data-source assumptions, and tuning boundaries."
