options,order,question,type,description
,1,"## Trigger Activity\nConfirm the search is firing as expected based on the recent scheduler history shown in the table above.",markdown,
,2,When did you last confirm this search fires correctly?,date,"Pick the date of your most recent validation."
,3,Roughly how many times should this search fire per day?,number,"Your expected daily run count, based on its cron schedule."
"as expected,higher than expected,lower than expected,not firing,unknown",4,How does the recent trigger volume compare to expectations?,dropdown,"Compare the run count in the table above against your expectation."
"yes,no,n/a",5,Were there any skipped or continued runs that need investigation?,radio,"Skipped runs often mean the search overlaps its schedule window or the scheduler is saturated."
,6,Trigger activity review notes,freetext,
