saved_search_name,uuid,search,cui_system_splunk_id
"ASCERA Status Check - AC.L1-3.1.1 - Unauthorized User with Successful Authentication",723ad4fc-e461-4d61-bfd1-c992205ef0c0,"| tstats `sp6_dm_summariesonly` count values(Authentication.tag) AS tag from datamodel=Authentication groupby Authentication.user, Authentication.src, Authentication.dest, Authentication.action, _time, sourcetype| rename Authentication.* AS *| `filter_system_tags`| mvexpand cui_system_splunk_id| `user_lookup(user)`| where isnull(user_identity) AND action==""success""| stats count AS accesses, dc(src) AS num_of_srcs, values(src) AS srcs, dc(user) AS num_of_users, values(user) AS users, dc(sourcetype) AS num_of_sourcetypes, values(sourcetype) AS sourcetypes by cui_system_splunk_id",default_system
"ASCERA Status Check - AC.L1-3.1.1 - Unauthorized Process Execution",41872268-e1a4-453f-bd90-3ae83c9e8eac,"| tstats `sp6_dm_summariesonly` count values(Processes.parent_process) AS parent_process, values(Processes.tag) AS tag from datamodel=Endpoint.Processes groupby Processes.process, Processes.user, _time, sourcetype| rename Processes.* AS *| `filter_system_tags`| mvexpand cui_system_splunk_id| lookup sp6_interesting_processes app AS process OUTPUT is_user_process| lookup identity_lookup_expanded cui_system_splunk_id identity AS user OUTPUT category | search NOT category=""npe"" OR category=""service""| stats count AS process_events, dc(process) AS num_of_processes, values(process) AS processes, dc(user) AS num_of_users, values(user) AS users, dc(sourcetype) AS num_of_sourcetypes, values(sourcetype) AS sourcetypes by cui_system_splunk_id",default_system
"ASCERA Status Check - AC.L1-3.1.1 - Unauthorized Systems or Devices",eaccc219-5a5d-4278-ac1c-b0e17e1f47d6,"| tstats `sp6_dm_summariesonly` count values(Authentication.tag) AS tag from datamodel=Authentication groupby Authentication.user, Authentication.src, Authentication.dest, Authentication.action, _time, sourcetype | rename Authentication.* AS * | `filter_system_tags`| mvexpand cui_system_splunk_id| `asset_lookup(src)`| where isnull(src_asset) AND action==""success"" | stats count AS accesses, dc(src) AS num_of_srcs, values(src) AS srcs, dc(user) AS num_of_users, values(user) AS users, dc(sourcetype) AS num_of_sourcetypes, values(sourcetype) AS sourcetypes by cui_system_splunk_id",default_system
"ASCERA Status Check - AC.L2-3.1.7 - Non Privileged Account Used for Security Function",7e1c1bb7-994b-4f8d-a2e6-f4087a69e362,"| tstats count values(Authentication.tag) AS tag from datamodel=Authentication where nodename=Authentication.Privileged_Authentication.Failed_Privileged_Authentication by _time ,Authentication.src, Authentication.user,Authentication.app sourcetype | rename Authentication.* as * | `filter_system_tags`| mvexpand cui_system_splunk_id| `sp6_permitted_functions` | lookup identity_lookup_expanded identity AS user OUTPUT identity category| search category=""security"" | stats dc(user) AS non_privileged_users, dc(app) AS num_of_apps, values(app) AS apps, dc(user) AS num_of_users, values(user) AS users, dc(sourcetype) AS num_of_sourcetypes, values(sourcetype) AS sourcetypes by cui_system_splunk_id",default_system
"ASCERA Status Check - AC.L2-3.1.14 - Remote Access from Unmanaged Device",beb2edb9-252e-4348-8605-313539aafe23,"| tstats `sp6_dm_summariesonly` count values(All_Traffic.tag) AS tag from datamodel=Network_Traffic where nodename=""All_Traffic"" `sp6_remote_access_ports(""All_Traffic.src_port"")` OR `sp6_remote_access_ports(""All_Traffic.dest_port"")` All_Traffic.action != ""allowed"" by All_Traffic.src All_Traffic.dest All_Traffic.dest_port All_Traffic.user sourcetype _time | rename All_Traffic.* as * | `filter_system_tags`| mvexpand cui_system_splunk_id| lookup sp6_remote_access_lookup ra_cidr as src OUTPUTNEW ra_category | lookup sp6_remote_access_lookup ra_hostname as src OUTPUTNEW ra_category | lookup sp6_remote_access_lookup ra_ip as src OUTPUTNEW ra_category | search NOT ra_category=*| stats count AS unmanaged_events, dc(src) as num_of_devices values(src) as devices dc(sourcetype) as num_of_sourcetypes values(sourcetype) as sourcetypes dc(user) as num_of_users values(user) as users by cui_system_splunk_id",default_system
"ASCERA Status Check - RA.L2-3.11.2 - No Vulnerability Scan Result Events",4704a739-176a-4569-a7b6-3eda81fc22a1,"| inputlookup sp6_assets_by_str | join type=left nt_host     [| tstats `sp6_dm_summariesonly` count latest(_time) AS latest_scan_date values(Vulnerabilities.tag) AS tag from datamodel=Vulnerabilities.Vulnerabilities where earliest=-`sp6_vulnerability_scanning_period`d@d by Vulnerabilities.dest     | rename Vulnerabilities.* AS *     | `filter_system_tags`     | mvexpand cui_system_splunk_id     | eval nt_host=lower(dest) ] | eval latest_scan_date=if(isnotnull(latest_scan_date), ""Last Scanned Within 30 Days"", ""No Scans Within The Last 30 Days"") | stats dc(asset) as host_count by latest_scan_date cui_system_splunk_id | append     [| inputlookup sp6_control_status     | stats count by cui_system_splunk_id     | fields - count     | eval count=0, latest_scan_date=0,host_count=0] | eval cui_system_splunk_id =IF(REPLACE(cui_system_splunk_id , "" "", """") == """", ""None"", cui_system_splunk_id ) | search NOT cui_system_splunk_id=""None"" ",default_system
"ASCERA Status Check - AC.L2-3.1.8 - User Account Lockout Configuration",74eee903-41f9-45f7-a145-ef0128c3128a,"| ldapsearch domain=`cui_system_domain` search=""(objectClass=Domain)"" attrs=""name,lockoutThreshold,whenCreated,whenChanged""| table name lockoutThreshold, whenCreated, whenChanged| appendpipe [stats count | where count=0]",default_system
"ASCERA Status Check - AC.L1-3.1.20 - Unverified Connections to External Systems",06d4b105-a449-40d7-b05e-856c28558844,"| tstats `sp6_dm_summariesonly` count values(Web.tag) AS tag values(Web.url) as url from datamodel=Web WHERE earliest=-30d `sp6_internal_ip_ranges(Web.src)` NOT `sp6_internal_ip_ranges(Web.dest)` All_Traffic.dest_ip!=unknown by Web.dest, Web.src, Web.dest_port Web.vendor_product, Web.bytes Web.http_method Web.category sourcetype, _time | rename Web.* as * | lookup ascera_authorized_external_sites cidr as dest output approver | lookup ascera_authorized_external_sites url as url output is_approved| where isnull(approver) AND isnull(is_approved)| `filter_system_tags`| mvexpand cui_system_splunk_id| stats count as unverified_external_systems dc(sourcetype) AS num_of_sourcetypes, values(sourcetype) AS sourcetypes, dc(src) AS num_of_devices dc(dest) as num_of_destinations by cui_system_splunk_id",default_system
"ASCERA Status Check - AU.L2-3.3.1 - Splunk Log Retention Check",a1093fa3-ffed-4ef6-b360-f78eb8f493a8,"| metadata type=sources where index=* | sort + firstTime | eval retentionLookDays=`sp6_log_retention_period`| eval retentionLookBack=""-"".'retentionLookDays'.""d@d""| eval logRetentionThreshold=relative_time(now(),'retentionLookBack')| fields - retentionLookDays retentionLookBack| where firstTime<logRetentionThreshold| stats min(firstTime) as oldestEvent dc(source) as sources by logRetentionThreshold | convert ctime(oldestEvent) ctime(logRetentionThreshold) | appendpipe [stats count as sources | where sources=0]",default_system