assessment_objective,assessment_objective_id,assessment_objective_letter,control,control_ace,control_ccm,control_cmmc_level,control_dod_weight,control_evidence_found,control_family,control_group,control_operator,control_owner,control_prereq_met,control_review_due,control_review_message,control_review_overdue,control_review_status,control_review_time,control_status,control_supercedes_until,control_update_message,control_update_time,cui_system_id,cui_system_name,cui_system_splunk_id,status_type
Determine if unauthorized and unintended information transfer via shared system resources is prevented.,3.13.4[a],a,SC.L2-3.13.4,FALSE,FALSE,2,1,0,CMMC ML 1,System and Communications Protection (SC),Operator,Owner,0,0,No message yet,0,Incomplete,0,N/A,0,No message yet,0,default_system,Default System,default_system,objective
publicly accessible system components are identified.,3.13.5[a],a,SC.L1-3.13.5,FALSE,FALSE,1,5,0,CMMC ML 1,System and Communications Protection (SC),Operator,Owner,0,0,No message yet,0,Incomplete,0,N/A,0,No message yet,0,default_system,Default System,default_system,objective
subnetworks for publicly accessible system components are physically or logically separated from internal networks.,3.13.5[b],b,SC.L1-3.13.5,FALSE,FALSE,1,5,0,CMMC ML 1,System and Communications Protection (SC),Operator,Owner,0,0,No message yet,0,Incomplete,0,N/A,0,No message yet,0,default_system,Default System,default_system,objective
network communications traffic is denied by default.,3.13.6[a],a,SC.L2-3.13.6,FALSE,FALSE,2,5,0,CMMC ML 1,System and Communications Protection (SC),Operator,Owner,0,0,No message yet,0,Incomplete,0,N/A,0,No message yet,0,default_system,Default System,default_system,objective
network communications traffic is allowed by exception.,3.13.6[b],b,SC.L2-3.13.6,FALSE,FALSE,2,5,0,CMMC ML 1,System and Communications Protection (SC),Operator,Owner,0,0,No message yet,0,Incomplete,0,N/A,0,No message yet,0,default_system,Default System,default_system,objective
Determine if remote devices are prevented from simultaneously establishing non-remote connections with the system and communicating via some other connection to resources in external networks (i.e.,3.13.7[a],a,SC.L2-3.13.7,TRUE,TRUE,2,1,0,CMMC ML 1,System and Communications Protection (SC),Operator,Owner,0,0,No message yet,0,Incomplete,0,N/A,0,No message yet,0,default_system,Default System,default_system,objective
cryptographic mechanisms intended to prevent unauthorized disclosure of CUI are identified.,3.13.8[a],a,SC.L2-3.13.8,FALSE,FALSE,2,3,0,CMMC ML 1,System and Communications Protection (SC),Operator,Owner,0,0,No message yet,0,Incomplete,0,N/A,0,No message yet,0,default_system,Default System,default_system,objective
alternative physical safeguards intended to prevent unauthorized disclosure of CUI are identified.,3.13.8[b],b,SC.L2-3.13.8,FALSE,FALSE,2,3,0,CMMC ML 1,System and Communications Protection (SC),Operator,Owner,0,0,No message yet,0,Incomplete,0,N/A,0,No message yet,0,default_system,Default System,default_system,objective
either cryptographic mechanisms or alternative physical safeguards are implemented to prevent unauthorized disclosure of CUI during transmission.,3.13.8[c],c,SC.L2-3.13.8,FALSE,FALSE,2,3,0,CMMC ML 1,System and Communications Protection (SC),Operator,Owner,0,0,No message yet,0,Incomplete,0,N/A,0,No message yet,0,default_system,Default System,default_system,objective
a period of inactivity to terminate network connections associated with communications sessions is defined.,3.13.9[a],a,SC.L2-3.13.9,FALSE,FALSE,2,1,0,CMMC ML 1,System and Communications Protection (SC),Operator,Owner,0,0,No message yet,0,Incomplete,0,N/A,0,No message yet,0,default_system,Default System,default_system,objective
network connections associated with communications sessions are terminated at the end of the sessions.,3.13.9[b],b,SC.L2-3.13.9,TRUE,TRUE,2,1,0,CMMC ML 1,System and Communications Protection (SC),Operator,Owner,0,0,No message yet,0,Incomplete,0,N/A,0,No message yet,0,default_system,Default System,default_system,objective
network connections associated with communications sessions are terminated after the defined period of inactivity.,3.13.9[c],c,SC.L2-3.13.9,TRUE,FALSE,2,1,0,CMMC ML 1,System and Communications Protection (SC),Operator,Owner,0,0,No message yet,0,Incomplete,0,N/A,0,No message yet,0,default_system,Default System,default_system,objective
cryptographic keys are established whenever cryptography is employed.,3.13.10[a],a,SC.L2-3.13.10,FALSE,FALSE,2,1,0,CMMC ML 1,System and Communications Protection (SC),Operator,Owner,0,0,No message yet,0,Incomplete,0,N/A,0,No message yet,0,default_system,Default System,default_system,objective
cryptographic keys are managed whenever cryptography is employed.,3.13.10[b],b,SC.L2-3.13.10,FALSE,FALSE,2,1,0,CMMC ML 1,System and Communications Protection (SC),Operator,Owner,0,0,No message yet,0,Incomplete,0,N/A,0,No message yet,0,default_system,Default System,default_system,objective
Determine if FIPS-validated cryptography is employed to protect the confidentiality of CUI.,3.13.11[a],a,SC.L2-3.13.11,FALSE,FALSE,2,5,0,CMMC ML 1,System and Communications Protection (SC),Operator,Owner,0,0,No message yet,0,Incomplete,0,N/A,0,No message yet,0,default_system,Default System,default_system,objective
collaborative computing devices are identified.,3.13.12[a],a,SC.L2-3.13.12,FALSE,FALSE,2,1,0,CMMC ML 1,System and Communications Protection (SC),Operator,Owner,0,0,No message yet,0,Incomplete,0,N/A,0,No message yet,0,default_system,Default System,default_system,objective
collaborative computing devices provide indication to users of devices in use.,3.13.12[b],b,SC.L2-3.13.12,FALSE,FALSE,2,1,0,CMMC ML 1,System and Communications Protection (SC),Operator,Owner,0,0,No message yet,0,Incomplete,0,N/A,0,No message yet,0,default_system,Default System,default_system,objective
remote activation of collaborative computing devices is prohibited.,3.13.12[c],c,SC.L2-3.13.12,FALSE,FALSE,2,1,0,CMMC ML 1,System and Communications Protection (SC),Operator,Owner,0,0,No message yet,0,Incomplete,0,N/A,0,No message yet,0,default_system,Default System,default_system,objective
use of mobile code is controlled.,3.13.13[a],a,SC.L2-3.13.13,FALSE,FALSE,2,1,0,CMMC ML 1,System and Communications Protection (SC),Operator,Owner,0,0,No message yet,0,Incomplete,0,N/A,0,No message yet,0,default_system,Default System,default_system,objective
use of mobile code is monitored.,3.13.13[b],b,SC.L2-3.13.13,FALSE,FALSE,2,1,0,CMMC ML 1,System and Communications Protection (SC),Operator,Owner,0,0,No message yet,0,Incomplete,0,N/A,0,No message yet,0,default_system,Default System,default_system,objective
use of Voice over Internet Protocol (VoIP) technologies is controlled.,3.13.14[a],a,SC.L2-3.13.14,FALSE,FALSE,2,1,0,CMMC ML 1,System and Communications Protection (SC),Operator,Owner,0,0,No message yet,0,Incomplete,0,N/A,0,No message yet,0,default_system,Default System,default_system,objective
use of Voice over Internet Protocol (VoIP) technologies is monitored.,3.13.14[b],b,SC.L2-3.13.14,TRUE,FALSE,2,1,0,CMMC ML 1,System and Communications Protection (SC),Operator,Owner,0,0,No message yet,0,Incomplete,0,N/A,0,No message yet,0,default_system,Default System,default_system,objective
Determine if the authenticity of communications sessions is protected.,3.13.15[a],a,SC.L2-3.13.15,FALSE,FALSE,2,5,0,CMMC ML 1,System and Communications Protection (SC),Operator,Owner,0,0,No message yet,0,Incomplete,0,N/A,0,No message yet,0,default_system,Default System,default_system,objective
Determine if the confidentiality of CUI at rest is protected.,3.13.16[a],a,SC.L2-3.13.16,TRUE,FALSE,2,1,0,CMMC ML 1,System and Communications Protection (SC),Operator,Owner,0,0,No message yet,0,Incomplete,0,N/A,0,No message yet,0,default_system,Default System,default_system,objective
the time within which to identify system flaws is specified.,3.14.1[a],a,SI.L1-3.14.1,FALSE,FALSE,1,5,0,CMMC ML 1,System and Information Integrity (SI),Operator,Owner,0,0,No message yet,0,Incomplete,0,N/A,0,No message yet,0,default_system,Default System,default_system,objective
system flaws are identified within the specified time frame.,3.14.1[b],b,SI.L1-3.14.1,FALSE,FALSE,1,5,0,CMMC ML 1,System and Information Integrity (SI),Operator,Owner,0,0,No message yet,0,Incomplete,0,N/A,0,No message yet,0,default_system,Default System,default_system,objective
the time within which to report system flaws is specified.,3.14.1[c],c,SI.L1-3.14.1,FALSE,FALSE,1,5,0,CMMC ML 1,System and Information Integrity (SI),Operator,Owner,0,0,No message yet,0,Incomplete,0,N/A,0,No message yet,0,default_system,Default System,default_system,objective
system flaws are reported within the specified time frame.,3.14.1[d],d,SI.L1-3.14.1,FALSE,FALSE,1,5,0,CMMC ML 1,System and Information Integrity (SI),Operator,Owner,0,0,No message yet,0,Incomplete,0,N/A,0,No message yet,0,default_system,Default System,default_system,objective
the time within which to correct system flaws is specified.,3.14.1[e],e,SI.L1-3.14.1,FALSE,FALSE,1,5,0,CMMC ML 1,System and Information Integrity (SI),Operator,Owner,0,0,No message yet,0,Incomplete,0,N/A,0,No message yet,0,default_system,Default System,default_system,objective
system flaws are corrected within the specified time frame.,3.14.1[f],f,SI.L1-3.14.1,FALSE,FALSE,1,5,0,CMMC ML 1,System and Information Integrity (SI),Operator,Owner,0,0,No message yet,0,Incomplete,0,N/A,0,No message yet,0,default_system,Default System,default_system,objective
designated locations for malicious code protection are identified.,3.14.2[a],a,SI.L1-3.14.2,TRUE,FALSE,1,5,0,CMMC ML 1,System and Information Integrity (SI),Operator,Owner,0,0,No message yet,0,Incomplete,0,N/A,0,No message yet,0,default_system,Default System,default_system,objective
protection from malicious code at designated locations is provided.,3.14.2[b],b,SI.L1-3.14.2,TRUE,TRUE,1,5,0,CMMC ML 1,System and Information Integrity (SI),Operator,Owner,0,0,No message yet,0,Incomplete,0,N/A,0,No message yet,0,default_system,Default System,default_system,objective
response actions to system security alerts and advisories are identified.,3.14.3[a],a,SI.L2-3.14.3,FALSE,FALSE,2,5,0,CMMC ML 1,System and Information Integrity (SI),Operator,Owner,0,0,No message yet,0,Incomplete,0,N/A,0,No message yet,0,default_system,Default System,default_system,objective
system security alerts and advisories are monitored.,3.14.3[b],b,SI.L2-3.14.3,FALSE,FALSE,2,5,0,CMMC ML 1,System and Information Integrity (SI),Operator,Owner,0,0,No message yet,0,Incomplete,0,N/A,0,No message yet,0,default_system,Default System,default_system,objective
actions in response to system security alerts and advisories are taken.,3.14.3[c],c,SI.L2-3.14.3,FALSE,FALSE,2,5,0,CMMC ML 1,System and Information Integrity (SI),Operator,Owner,0,0,No message yet,0,Incomplete,0,N/A,0,No message yet,0,default_system,Default System,default_system,objective
Determine if malicious code protection mechanisms are updated when new releases are available.,3.14.4[a],a,SI.L1-3.14.4,TRUE,TRUE,1,5,0,CMMC ML 1,System and Information Integrity (SI),Operator,Owner,0,0,No message yet,0,Incomplete,0,N/A,0,No message yet,0,default_system,Default System,default_system,objective
the frequency for malicious code scans is defined.,3.14.5[a],a,SI.L1-3.14.5,FALSE,FALSE,1,3,0,CMMC ML 1,System and Information Integrity (SI),Operator,Owner,0,0,No message yet,0,Incomplete,0,N/A,0,No message yet,0,default_system,Default System,default_system,objective
malicious code scans are performed with the defined frequency.,3.14.5[b],b,SI.L1-3.14.5,TRUE,TRUE,1,3,0,CMMC ML 1,System and Information Integrity (SI),Operator,Owner,0,0,No message yet,0,Incomplete,0,N/A,0,No message yet,0,default_system,Default System,default_system,objective
real-time malicious code scans of files from external sources as files are downloaded,3.14.5[c],c,SI.L1-3.14.5,TRUE,TRUE,1,3,0,CMMC ML 1,System and Information Integrity (SI),Operator,Owner,0,0,No message yet,0,Incomplete,0,N/A,0,No message yet,0,default_system,Default System,default_system,objective
the system is monitored to detect attacks and indicators of potential attacks.,3.14.6[a],a,SI.L2-3.14.6,TRUE,TRUE,2,5,0,CMMC ML 1,System and Information Integrity (SI),Operator,Owner,0,0,No message yet,0,Incomplete,0,Met,0,No message yet,0,default_system,Default System,default_system,objective
inbound communications traffic is monitored to detect attacks and indicators of potential attacks.,3.14.6[b],b,SI.L2-3.14.6,FALSE,FALSE,2,5,0,CMMC ML 1,System and Information Integrity (SI),Operator,Owner,0,0,No message yet,0,Incomplete,0,Met,0,No message yet,0,default_system,Default System,default_system,objective
outbound communications traffic is monitored to detect attacks and indicators of potential attacks.,3.14.6[c],c,SI.L2-3.14.6,FALSE,FALSE,2,5,0,CMMC ML 1,System and Information Integrity (SI),Operator,Owner,0,0,No message yet,0,Incomplete,0,Met,0,No message yet,0,default_system,Default System,default_system,objective
authorized use of the system is defined.,3.14.7[a],a,SI.L2-3.14.7,FALSE,FALSE,2,3,0,CMMC ML 1,System and Information Integrity (SI),Operator,Owner,0,0,No message yet,0,Incomplete,0,N/A,0,No message yet,0,default_system,Default System,default_system,objective
unauthorized use of the system is identified.,3.14.7[b],b,SI.L2-3.14.7,FALSE,FALSE,2,3,0,CMMC ML 1,System and Information Integrity (SI),Operator,Owner,0,0,No message yet,0,Incomplete,0,N/A,0,No message yet,0,default_system,Default System,default_system,objective
,,,AC.L1-3.1.1,TRUE,TRUE,1,5,0,CMMC ML 1,Access Control (AC),Operator,Owner,0,0,No message yet,0,Incomplete,0,N/A,0,No message yet,0,default_system,Default System,default_system,control
,,,AC.L1-3.1.2,TRUE,TRUE,1,5,0,CMMC ML 1,Access Control (AC),Operator,Owner,0,0,No message yet,0,Incomplete,0,N/A,0,No message yet,0,default_system,Default System,default_system,control
,,,AC.L1-3.1.20,TRUE,TRUE,1,1,0,CMMC ML 1,Access Control (AC),Operator,Owner,0,0,No message yet,0,Incomplete,0,Met,0,No message yet,0,default_system,Default System,default_system,control
,,,AC.L1-3.1.22,FALSE,FALSE,1,1,0,CMMC ML 1,Access Control (AC),Operator,Owner,0,0,No message yet,0,Incomplete,0,N/A,0,No message yet,0,default_system,Default System,default_system,control
,,,AC.L2-3.1.9,TRUE,FALSE,2,1,0,CMMC ML 1,Access Control (AC),Operator,Owner,0,0,No message yet,0,Incomplete,0,N/A,0,No message yet,0,default_system,Default System,default_system,control
,,,AC.L2-3.1.21,FALSE,FALSE,2,1,0,CMMC ML 1,Access Control (AC),Operator,Owner,0,0,No message yet,0,Incomplete,0,N/A,0,No message yet,0,default_system,Default System,default_system,control
,,,AC.L2-3.1.5,TRUE,FALSE,2,3,0,CMMC ML 1,Access Control (AC),Operator,Owner,0,0,No message yet,0,Incomplete,0,N/A,0,No message yet,0,default_system,Default System,default_system,control
,,,AC.L2-3.1.6,TRUE,TRUE,2,1,0,CMMC ML 1,Access Control (AC),Operator,Owner,0,0,No message yet,0,Incomplete,0,N/A,0,No message yet,0,default_system,Default System,default_system,control
,,,AC.L2-3.1.8,TRUE,TRUE,2,1,0,CMMC ML 1,Access Control (AC),Operator,Owner,0,0,No message yet,0,Incomplete,0,N/A,0,No message yet,0,default_system,Default System,default_system,control
,,,AC.L2-3.1.10,TRUE,TRUE,2,1,0,CMMC ML 1,Access Control (AC),Operator,Owner,0,0,No message yet,0,Incomplete,0,Met,0,No message yet,0,default_system,Default System,default_system,control
,,,AC.L2-3.1.16,TRUE,TRUE,2,5,0,CMMC ML 1,Access Control (AC),Operator,Owner,0,0,No message yet,0,Incomplete,0,N/A,0,No message yet,0,default_system,Default System,default_system,control
,,,AC.L2-3.1.12,TRUE,TRUE,2,5,0,CMMC ML 1,Access Control (AC),Operator,Owner,0,0,No message yet,0,Incomplete,0,N/A,0,No message yet,0,default_system,Default System,default_system,control
,,,AC.L2-3.1.14,TRUE,TRUE,2,1,0,CMMC ML 1,Access Control (AC),Operator,Owner,0,0,No message yet,0,Incomplete,0,N/A,0,No message yet,0,default_system,Default System,default_system,control
,,,AC.L2-3.1.3,TRUE,FALSE,2,1,0,CMMC ML 1,Access Control (AC),Operator,Owner,0,0,No message yet,0,Incomplete,0,N/A,0,No message yet,0,default_system,Default System,default_system,control
,,,AC.L2-3.1.13,TRUE,TRUE,2,5,0,CMMC ML 1,Access Control (AC),Operator,Owner,0,0,No message yet,0,Incomplete,0,N/A,0,No message yet,0,default_system,Default System,default_system,control
,,,AC.L2-3.1.17,TRUE,TRUE,2,5,0,CMMC ML 1,Access Control (AC),Operator,Owner,0,0,No message yet,0,Incomplete,0,N/A,0,No message yet,0,default_system,Default System,default_system,control
,,,AC.L2-3.1.15,TRUE,TRUE,2,1,0,CMMC ML 1,Access Control (AC),Operator,Owner,0,0,No message yet,0,Incomplete,0,N/A,0,No message yet,0,default_system,Default System,default_system,control
,,,AC.L2-3.1.4,TRUE,TRUE,2,1,0,CMMC ML 1,Access Control (AC),Operator,Owner,0,0,No message yet,0,Incomplete,0,N/A,0,No message yet,0,default_system,Default System,default_system,control
,,,AC.L2-3.1.7,TRUE,TRUE,2,1,0,CMMC ML 1,Access Control (AC),Operator,Owner,0,0,No message yet,0,Incomplete,0,N/A,0,No message yet,0,default_system,Default System,default_system,control
,,,AC.L2-3.1.11,TRUE,TRUE,2,1,0,CMMC ML 1,Access Control (AC),Operator,Owner,0,0,No message yet,0,Incomplete,0,Met,0,No message yet,0,default_system,Default System,default_system,control
,,,AC.L2-3.1.18,TRUE,TRUE,2,5,0,CMMC ML 1,Access Control (AC),Operator,Owner,0,0,No message yet,0,Incomplete,0,N/A,0,No message yet,0,default_system,Default System,default_system,control
,,,AC.L2-3.1.19,TRUE,FALSE,2,3,0,CMMC ML 1,Access Control (AC),Operator,Owner,0,0,No message yet,0,Incomplete,0,N/A,0,No message yet,0,default_system,Default System,default_system,control
,,,AU.L2-3.3.2,TRUE,FALSE,2,3,0,CMMC ML 1,Audit and Accountability (AU),Operator,Owner,0,0,No message yet,0,Incomplete,0,N/A,0,No message yet,0,default_system,Default System,default_system,control
,,,AU.L2-3.3.1,TRUE,TRUE,2,5,0,CMMC ML 1,Audit and Accountability (AU),Operator,Owner,0,0,No message yet,0,Incomplete,0,Met,0,No message yet,0,default_system,Default System,default_system,control
,,,AU.L2-3.3.7,TRUE,TRUE,2,1,0,CMMC ML 1,Audit and Accountability (AU),Operator,Owner,0,0,No message yet,0,Incomplete,0,Met,0,No message yet,0,default_system,Default System,default_system,control
,,,AU.L2-3.3.3,FALSE,FALSE,2,1,0,CMMC ML 1,Audit and Accountability (AU),Operator,Owner,0,0,No message yet,0,Incomplete,0,N/A,0,No message yet,0,default_system,Default System,default_system,control
,,,AU.L2-3.3.4,TRUE,TRUE,2,1,0,CMMC ML 1,Audit and Accountability (AU),Operator,Owner,0,0,No message yet,0,Incomplete,0,Met,0,No message yet,0,default_system,Default System,default_system,control
,,,AU.L2-3.3.8,TRUE,TRUE,2,1,0,CMMC ML 1,Audit and Accountability (AU),Operator,Owner,0,0,No message yet,0,Incomplete,0,Met,0,No message yet,0,default_system,Default System,default_system,control
,,,AU.L2-3.3.9,TRUE,TRUE,2,1,0,CMMC ML 1,Audit and Accountability (AU),Operator,Owner,0,0,No message yet,0,Incomplete,0,Met,0,No message yet,0,default_system,Default System,default_system,control
,,,AU.L2-3.3.5,TRUE,FALSE,2,5,0,CMMC ML 1,Audit and Accountability (AU),Operator,Owner,0,0,No message yet,0,Incomplete,0,N/A,0,No message yet,0,default_system,Default System,default_system,control
,,,AU.L2-3.3.6,FALSE,FALSE,2,1,0,CMMC ML 1,Audit and Accountability (AU),Operator,Owner,0,0,No message yet,0,Incomplete,0,N/A,0,No message yet,0,default_system,Default System,default_system,control
,,,AT.L2-3.2.1,TRUE,FALSE,2,5,0,CMMC ML 1,Awareness and Training (AT),Operator,Owner,0,0,No message yet,0,Incomplete,0,N/A,0,No message yet,0,default_system,Default System,default_system,control
,,,AT.L2-3.2.2,TRUE,FALSE,2,5,0,CMMC ML 1,Awareness and Training (AT),Operator,Owner,0,0,No message yet,0,Incomplete,0,N/A,0,No message yet,0,default_system,Default System,default_system,control
,,,AT.L2-3.2.3,TRUE,TRUE,2,1,0,CMMC ML 1,Awareness and Training (AT),Operator,Owner,0,0,No message yet,0,Incomplete,0,N/A,0,No message yet,0,default_system,Default System,default_system,control
,,,CM.L2-3.4.1,TRUE,FALSE,2,5,0,CMMC ML 1,Configuration Management (CM),Operator,Owner,0,0,No message yet,0,Incomplete,0,N/A,0,No message yet,0,default_system,Default System,default_system,control
,,,CM.L2-3.4.6,TRUE,FALSE,2,5,0,CMMC ML 1,Configuration Management (CM),Operator,Owner,0,0,No message yet,0,Incomplete,0,N/A,0,No message yet,0,default_system,Default System,default_system,control
,,,CM.L2-3.4.9,TRUE,FALSE,2,1,0,CMMC ML 1,Configuration Management (CM),Operator,Owner,0,0,No message yet,0,Incomplete,0,N/A,0,No message yet,0,default_system,Default System,default_system,control
,,,CM.L2-3.4.2,FALSE,FALSE,2,5,0,CMMC ML 1,Configuration Management (CM),Operator,Owner,0,0,No message yet,0,Incomplete,0,N/A,0,No message yet,0,default_system,Default System,default_system,control
,,,CM.L2-3.4.3,FALSE,FALSE,2,1,0,CMMC ML 1,Configuration Management (CM),Operator,Owner,0,0,No message yet,0,Incomplete,0,N/A,0,No message yet,0,default_system,Default System,default_system,control
,,,CM.L2-3.4.4,FALSE,FALSE,2,1,0,CMMC ML 1,Configuration Management (CM),Operator,Owner,0,0,No message yet,0,Incomplete,0,N/A,0,No message yet,0,default_system,Default System,default_system,control
,,,CM.L2-3.4.5,FALSE,FALSE,2,5,0,CMMC ML 1,Configuration Management (CM),Operator,Owner,0,0,No message yet,0,Incomplete,0,N/A,0,No message yet,0,default_system,Default System,default_system,control
,,,CM.L2-3.4.7,TRUE,TRUE,2,5,0,CMMC ML 1,Configuration Management (CM),Operator,Owner,0,0,No message yet,0,Incomplete,0,N/A,0,No message yet,0,default_system,Default System,default_system,control
,,,CM.L2-3.4.8,TRUE,TRUE,2,5,0,CMMC ML 1,Configuration Management (CM),Operator,Owner,0,0,No message yet,0,Incomplete,0,N/A,0,No message yet,0,default_system,Default System,default_system,control
,,,IA.L1-3.5.1,TRUE,FALSE,1,5,0,CMMC ML 1,Identification and Authentication (IA),Operator,Owner,0,0,No message yet,0,Incomplete,0,N/A,0,No message yet,0,default_system,Default System,default_system,control
,,,IA.L1-3.5.2,TRUE,FALSE,1,5,0,CMMC ML 1,Identification and Authentication (IA),Operator,Owner,0,0,No message yet,0,Incomplete,0,Met,0,No message yet,0,default_system,Default System,default_system,control
,,,IA.L2-3.5.7,FALSE,FALSE,2,1,0,CMMC ML 1,Identification and Authentication (IA),Operator,Owner,0,0,No message yet,0,Incomplete,0,N/A,0,No message yet,0,default_system,Default System,default_system,control
,,,IA.L2-3.5.8,FALSE,FALSE,2,1,0,CMMC ML 1,Identification and Authentication (IA),Operator,Owner,0,0,No message yet,0,Incomplete,0,N/A,0,No message yet,0,default_system,Default System,default_system,control
,,,IA.L2-3.5.9,TRUE,FALSE,2,1,0,CMMC ML 1,Identification and Authentication (IA),Operator,Owner,0,0,No message yet,0,Incomplete,0,N/A,0,No message yet,0,default_system,Default System,default_system,control
,,,IA.L2-3.5.10,TRUE,FALSE,2,5,0,CMMC ML 1,Identification and Authentication (IA),Operator,Owner,0,0,No message yet,0,Incomplete,0,N/A,0,No message yet,0,default_system,Default System,default_system,control
,,,IA.L2-3.5.11,FALSE,FALSE,2,1,0,CMMC ML 1,Identification and Authentication (IA),Operator,Owner,0,0,No message yet,0,Incomplete,0,N/A,0,No message yet,0,default_system,Default System,default_system,control
,,,IA.L2-3.5.3,TRUE,TRUE,2,5,0,CMMC ML 1,Identification and Authentication (IA),Operator,Owner,0,0,No message yet,0,Incomplete,0,Met,0,No message yet,0,default_system,Default System,default_system,control
,,,IA.L2-3.5.4,FALSE,FALSE,2,1,0,CMMC ML 1,Identification and Authentication (IA),Operator,Owner,0,0,No message yet,0,Incomplete,0,N/A,0,No message yet,0,default_system,Default System,default_system,control
,,,IA.L2-3.5.5,FALSE,FALSE,2,1,0,CMMC ML 1,Identification and Authentication (IA),Operator,Owner,0,0,No message yet,0,Incomplete,0,N/A,0,No message yet,0,default_system,Default System,default_system,control
,,,IA.L2-3.5.6,TRUE,TRUE,2,1,0,CMMC ML 1,Identification and Authentication (IA),Operator,Owner,0,0,No message yet,0,Incomplete,0,N/A,0,No message yet,0,default_system,Default System,default_system,control
,,,IR.L2-3.6.1,FALSE,FALSE,2,5,0,CMMC ML 1,Incident Response (IR),Operator,Owner,0,0,No message yet,0,Incomplete,0,N/A,0,No message yet,0,default_system,Default System,default_system,control
,,,IR.L2-3.6.2,FALSE,FALSE,2,5,0,CMMC ML 1,Incident Response (IR),Operator,Owner,0,0,No message yet,0,Incomplete,0,N/A,0,No message yet,0,default_system,Default System,default_system,control
,,,IR.L2-3.6.3,FALSE,FALSE,2,1,0,CMMC ML 1,Incident Response (IR),Operator,Owner,0,0,No message yet,0,Incomplete,0,N/A,0,No message yet,0,default_system,Default System,default_system,control
,,,MA.L2-3.7.1,TRUE,FALSE,2,3,0,CMMC ML 1,Maintenance (MA),Operator,Owner,0,0,No message yet,0,Incomplete,0,N/A,0,No message yet,0,default_system,Default System,default_system,control
,,,MA.L2-3.7.2,FALSE,FALSE,2,5,0,CMMC ML 1,Maintenance (MA),Operator,Owner,0,0,No message yet,0,Incomplete,0,N/A,0,No message yet,0,default_system,Default System,default_system,control
,,,MA.L2-3.7.5,TRUE,TRUE,2,5,0,CMMC ML 1,Maintenance (MA),Operator,Owner,0,0,No message yet,0,Incomplete,0,N/A,0,No message yet,0,default_system,Default System,default_system,control
,,,MA.L2-3.7.6,FALSE,FALSE,2,1,0,CMMC ML 1,Maintenance (MA),Operator,Owner,0,0,No message yet,0,Incomplete,0,N/A,0,No message yet,0,default_system,Default System,default_system,control
,,,MA.L2-3.7.3,FALSE,FALSE,2,1,0,CMMC ML 1,Maintenance (MA),Operator,Owner,0,0,No message yet,0,Incomplete,0,N/A,0,No message yet,0,default_system,Default System,default_system,control
,,,MA.L2-3.7.4,FALSE,FALSE,2,3,0,CMMC ML 1,Maintenance (MA),Operator,Owner,0,0,No message yet,0,Incomplete,0,N/A,0,No message yet,0,default_system,Default System,default_system,control
,,,MP.L1-3.8.3,FALSE,FALSE,1,5,0,CMMC ML 1,Media Protection (MP),Operator,Owner,0,0,No message yet,0,Incomplete,0,N/A,0,No message yet,0,default_system,Default System,default_system,control
