assessment_objective,assessment_objective_id,assessment_objective_letter,control,control_ace,control_ccm,control_cmmc_level,control_dod_weight,control_evidence_found,control_family,control_group,control_operator,control_owner,control_prereq_met,control_review_due,control_review_message,control_review_overdue,control_review_status,control_review_time,control_status,control_supercedes_until,control_update_message,control_update_time,cui_system_id,cui_system_name,cui_system_splunk_id,status_type
authorities to whom incidents are to be reported are identified.,3.6.2[c],c,IR.L2-3.6.2,FALSE,FALSE,2,5,0,CMMC ML 1,Incident Response (IR),Operator,Owner,0,0,No message yet,0,Incomplete,0,N/A,0,No message yet,0,default_system,Default System,default_system,objective
organizational officials to whom incidents are to be reported are identified.,3.6.2[d],d,IR.L2-3.6.2,FALSE,FALSE,2,5,0,CMMC ML 1,Incident Response (IR),Operator,Owner,0,0,No message yet,0,Incomplete,0,N/A,0,No message yet,0,default_system,Default System,default_system,objective
identified authorities are notified of incidents.,3.6.2[e],e,IR.L2-3.6.2,FALSE,FALSE,2,5,0,CMMC ML 1,Incident Response (IR),Operator,Owner,0,0,No message yet,0,Incomplete,0,N/A,0,No message yet,0,default_system,Default System,default_system,objective
identified organizational officials are notified of incidents.,3.6.2[f],f,IR.L2-3.6.2,FALSE,FALSE,2,5,0,CMMC ML 1,Incident Response (IR),Operator,Owner,0,0,No message yet,0,Incomplete,0,N/A,0,No message yet,0,default_system,Default System,default_system,objective
Determine if the incident response capability is tested.,3.6.3[a],a,IR.L2-3.6.3,FALSE,FALSE,2,1,0,CMMC ML 1,Incident Response (IR),Operator,Owner,0,0,No message yet,0,Incomplete,0,N/A,0,No message yet,0,default_system,Default System,default_system,objective
Determine if system maintenance is performed.,3.7.1[a],a,MA.L2-3.7.1,TRUE,FALSE,2,3,0,CMMC ML 1,Maintenance (MA),Operator,Owner,0,0,No message yet,0,Incomplete,0,N/A,0,No message yet,0,default_system,Default System,default_system,objective
tools used to conduct system maintenance are controlled.,3.7.2[a],a,MA.L2-3.7.2,FALSE,FALSE,2,5,0,CMMC ML 1,Maintenance (MA),Operator,Owner,0,0,No message yet,0,Incomplete,0,N/A,0,No message yet,0,default_system,Default System,default_system,objective
techniques used to conduct system maintenance are controlled.,3.7.2[b],b,MA.L2-3.7.2,FALSE,FALSE,2,5,0,CMMC ML 1,Maintenance (MA),Operator,Owner,0,0,No message yet,0,Incomplete,0,N/A,0,No message yet,0,default_system,Default System,default_system,objective
mechanisms used to conduct system maintenance are controlled.,3.7.2[c],c,MA.L2-3.7.2,FALSE,FALSE,2,5,0,CMMC ML 1,Maintenance (MA),Operator,Owner,0,0,No message yet,0,Incomplete,0,N/A,0,No message yet,0,default_system,Default System,default_system,objective
personnel used to conduct system maintenance are controlled.,3.7.2[d],d,MA.L2-3.7.2,FALSE,FALSE,2,5,0,CMMC ML 1,Maintenance (MA),Operator,Owner,0,0,No message yet,0,Incomplete,0,N/A,0,No message yet,0,default_system,Default System,default_system,objective
Determine if equipment to be removed from organizational spaces for off-site maintenance is sanitized of any CUI.,3.7.3[a],a,MA.L2-3.7.3,FALSE,FALSE,2,1,0,CMMC ML 1,Maintenance (MA),Operator,Owner,0,0,No message yet,0,Incomplete,0,N/A,0,No message yet,0,default_system,Default System,default_system,objective
Determine if media containing diagnostic and test programs are checked for malicious code before being used in organizational systems that process,3.7.4[a],a,MA.L2-3.7.4,FALSE,FALSE,2,3,0,CMMC ML 1,Maintenance (MA),Operator,Owner,0,0,No message yet,0,Incomplete,0,N/A,0,No message yet,0,default_system,Default System,default_system,objective
multifactor authentication is used to establish nonlocal maintenance sessions via external network connections.,3.7.5[a],a,MA.L2-3.7.5,TRUE,TRUE,2,5,0,CMMC ML 1,Maintenance (MA),Operator,Owner,0,0,No message yet,0,Incomplete,0,N/A,0,No message yet,0,default_system,Default System,default_system,objective
nonlocal maintenance sessions established via external network connections are terminated when nonlocal maintenance is complete.,3.7.5[b],b,MA.L2-3.7.5,TRUE,TRUE,2,5,0,CMMC ML 1,Maintenance (MA),Operator,Owner,0,0,No message yet,0,Incomplete,0,N/A,0,No message yet,0,default_system,Default System,default_system,objective
Determine if maintenance personnel without required access authorization are supervised during maintenance activities.,3.7.6[a],a,MA.L2-3.7.6,FALSE,FALSE,2,1,0,CMMC ML 1,Maintenance (MA),Operator,Owner,0,0,No message yet,0,Incomplete,0,N/A,0,No message yet,0,default_system,Default System,default_system,objective
paper media containing CUI is physically controlled.,3.8.1[a],a,MP.L2-3.8.1,FALSE,FALSE,2,3,0,CMMC ML 1,Media Protection (MP),Operator,Owner,0,0,No message yet,0,Incomplete,0,N/A,0,No message yet,0,default_system,Default System,default_system,objective
digital media containing CUI is physically controlled.,3.8.1[b],b,MP.L2-3.8.1,FALSE,FALSE,2,3,0,CMMC ML 1,Media Protection (MP),Operator,Owner,0,0,No message yet,0,Incomplete,0,N/A,0,No message yet,0,default_system,Default System,default_system,objective
paper media containing CUI is securely stored.,3.8.1[c],c,MP.L2-3.8.1,FALSE,FALSE,2,3,0,CMMC ML 1,Media Protection (MP),Operator,Owner,0,0,No message yet,0,Incomplete,0,N/A,0,No message yet,0,default_system,Default System,default_system,objective
digital media containing CUI is securely stored.,3.8.1[d],d,MP.L2-3.8.1,FALSE,FALSE,2,3,0,CMMC ML 1,Media Protection (MP),Operator,Owner,0,0,No message yet,0,Incomplete,0,N/A,0,No message yet,0,default_system,Default System,default_system,objective
Determine if access to CUI on system media is limited to authorized users.,3.8.2[a],a,MP.L2-3.8.2,FALSE,FALSE,2,3,0,CMMC ML 1,Media Protection (MP),Operator,Owner,0,0,No message yet,0,Incomplete,0,N/A,0,No message yet,0,default_system,Default System,default_system,objective
system media containing CUI is sanitized or destroyed before disposal.,3.8.3[a],a,MP.L1-3.8.3,FALSE,FALSE,1,5,0,CMMC ML 1,Media Protection (MP),Operator,Owner,0,0,No message yet,0,Incomplete,0,N/A,0,No message yet,0,default_system,Default System,default_system,objective
system media containing CUI is sanitized before it is released for reuse.,3.8.3[b],b,MP.L1-3.8.3,FALSE,FALSE,1,5,0,CMMC ML 1,Media Protection (MP),Operator,Owner,0,0,No message yet,0,Incomplete,0,N/A,0,No message yet,0,default_system,Default System,default_system,objective
media containing CUI is marked with applicable CUI markings.,3.8.4[a],a,MP.L2-3.8.4,FALSE,FALSE,2,1,0,CMMC ML 1,Media Protection (MP),Operator,Owner,0,0,No message yet,0,Incomplete,0,N/A,0,No message yet,0,default_system,Default System,default_system,objective
media containing CUI is marked with distribution limitations.,3.8.4[b],b,MP.L2-3.8.4,FALSE,FALSE,2,1,0,CMMC ML 1,Media Protection (MP),Operator,Owner,0,0,No message yet,0,Incomplete,0,N/A,0,No message yet,0,default_system,Default System,default_system,objective
access to media containing CUI is controlled.,3.8.5[a],a,MP.L2-3.8.5,FALSE,FALSE,2,1,0,CMMC ML 1,Media Protection (MP),Operator,Owner,0,0,No message yet,0,Incomplete,0,N/A,0,No message yet,0,default_system,Default System,default_system,objective
accountability for media containing CUI is maintained during transport outside of controlled areas.,3.8.5[b],b,MP.L2-3.8.5,FALSE,FALSE,2,1,0,CMMC ML 1,Media Protection (MP),Operator,Owner,0,0,No message yet,0,Incomplete,0,N/A,0,No message yet,0,default_system,Default System,default_system,objective
Determine if the confidentiality of CUI stored on digital media is protected during transport using cryptographic mechanisms or alternative physical safeguards.,3.8.6[a],a,MP.L2-3.8.6,FALSE,FALSE,2,1,0,CMMC ML 1,Media Protection (MP),Operator,Owner,0,0,No message yet,0,Incomplete,0,N/A,0,No message yet,0,default_system,Default System,default_system,objective
Determine if the use of removable media on system components is controlled.,3.8.7[a],a,MP.L2-3.8.7,TRUE,FALSE,2,5,0,CMMC ML 1,Media Protection (MP),Operator,Owner,0,0,No message yet,0,Incomplete,0,N/A,0,No message yet,0,default_system,Default System,default_system,objective
Determine if the use of portable storage devices is prohibited when such devices have no identifiable owner.,3.8.8[a],a,MP.L2-3.8.8,FALSE,FALSE,2,3,0,CMMC ML 1,Media Protection (MP),Operator,Owner,0,0,No message yet,0,Incomplete,0,N/A,0,No message yet,0,default_system,Default System,default_system,objective
Determine if the confidentiality of backup CUI is protected at storage locations.,3.8.9[a],a,MP.L2-3.8.9,FALSE,FALSE,2,1,0,CMMC ML 1,Media Protection (MP),Operator,Owner,0,0,No message yet,0,Incomplete,0,N/A,0,No message yet,0,default_system,Default System,default_system,objective
Determine if individuals are screened prior to authorizing access to organizational systems containing CUI.,3.9.1[a],a,PS.L2-3.9.1,FALSE,FALSE,2,3,0,CMMC ML 1,Personnel Security (PS),Operator,Owner,0,0,No message yet,0,Incomplete,0,N/A,0,No message yet,0,default_system,Default System,default_system,objective
a policy and/or process for terminating system access and any credentials coincident with personnel actions is established.,3.9.2[a],a,PS.L2-3.9.2,FALSE,FALSE,2,5,0,CMMC ML 1,Personnel Security (PS),Operator,Owner,0,0,No message yet,0,Incomplete,0,N/A,0,No message yet,0,default_system,Default System,default_system,objective
system access and credentials are terminated consistent with personnel actions such as termination or transfer.,3.9.2[b],b,PS.L2-3.9.2,FALSE,FALSE,2,5,0,CMMC ML 1,Personnel Security (PS),Operator,Owner,0,0,No message yet,0,Incomplete,0,N/A,0,No message yet,0,default_system,Default System,default_system,objective
the system is protected during and after personnel transfer actions.,3.9.2[c],c,PS.L2-3.9.2,FALSE,FALSE,2,5,0,CMMC ML 1,Personnel Security (PS),Operator,Owner,0,0,No message yet,0,Incomplete,0,N/A,0,No message yet,0,default_system,Default System,default_system,objective
authorized individuals allowed physical access are identified.,3.10.1[a],a,PE.L1-3.10.1,FALSE,FALSE,1,5,0,CMMC ML 1,Physical Protection (PE),Operator,Owner,0,0,No message yet,0,Incomplete,0,N/A,0,No message yet,0,default_system,Default System,default_system,objective
physical access to organizational systems is limited to authorized individuals.,3.10.1[b],b,PE.L1-3.10.1,FALSE,FALSE,1,5,0,CMMC ML 1,Physical Protection (PE),Operator,Owner,0,0,No message yet,0,Incomplete,0,N/A,0,No message yet,0,default_system,Default System,default_system,objective
physical access to equipment is limited to authorized individuals.,3.10.1[c],c,PE.L1-3.10.1,FALSE,FALSE,1,5,0,CMMC ML 1,Physical Protection (PE),Operator,Owner,0,0,No message yet,0,Incomplete,0,N/A,0,No message yet,0,default_system,Default System,default_system,objective
physical access to operating environments is limited to authorized individuals.,3.10.1[d],d,PE.L1-3.10.1,FALSE,FALSE,1,5,0,CMMC ML 1,Physical Protection (PE),Operator,Owner,0,0,No message yet,0,Incomplete,0,N/A,0,No message yet,0,default_system,Default System,default_system,objective
the physical facility where organizational systems reside is protected.,3.10.2[a],a,PE.L2-3.10.2,FALSE,FALSE,2,5,0,CMMC ML 1,Physical Protection (PE),Operator,Owner,0,0,No message yet,0,Incomplete,0,N/A,0,No message yet,0,default_system,Default System,default_system,objective
the support infrastructure for organizational systems is protected.,3.10.2[b],b,PE.L2-3.10.2,FALSE,FALSE,2,5,0,CMMC ML 1,Physical Protection (PE),Operator,Owner,0,0,No message yet,0,Incomplete,0,N/A,0,No message yet,0,default_system,Default System,default_system,objective
the physical facility where organizational systems reside is monitored.,3.10.2[c],c,PE.L2-3.10.2,FALSE,FALSE,2,5,0,CMMC ML 1,Physical Protection (PE),Operator,Owner,0,0,No message yet,0,Incomplete,0,N/A,0,No message yet,0,default_system,Default System,default_system,objective
the support infrastructure for organizational systems is monitored.,3.10.2[d],d,PE.L2-3.10.2,FALSE,FALSE,2,5,0,CMMC ML 1,Physical Protection (PE),Operator,Owner,0,0,No message yet,0,Incomplete,0,N/A,0,No message yet,0,default_system,Default System,default_system,objective
visitors are escorted.,3.10.3[a],a,PE.L1-3.10.3,FALSE,FALSE,1,1,0,CMMC ML 1,Physical Protection (PE),Operator,Owner,0,0,No message yet,0,Incomplete,0,N/A,0,No message yet,0,default_system,Default System,default_system,objective
visitor activity is monitored.,3.10.3[b],b,PE.L1-3.10.3,FALSE,FALSE,1,1,0,CMMC ML 1,Physical Protection (PE),Operator,Owner,0,0,No message yet,0,Incomplete,0,N/A,0,No message yet,0,default_system,Default System,default_system,objective
Determine if audit logs of physical access are maintained.,3.10.4[a],a,PE.L1-3.10.4,FALSE,FALSE,1,1,0,CMMC ML 1,Physical Protection (PE),Operator,Owner,0,0,No message yet,0,Incomplete,0,N/A,0,No message yet,0,default_system,Default System,default_system,objective
physical access devices are identified.,3.10.5[a],a,PE.L1-3.10.5,FALSE,FALSE,1,1,0,CMMC ML 1,Physical Protection (PE),Operator,Owner,0,0,No message yet,0,Incomplete,0,N/A,0,No message yet,0,default_system,Default System,default_system,objective
physical access devices are controlled.,3.10.5[b],b,PE.L1-3.10.5,FALSE,FALSE,1,1,0,CMMC ML 1,Physical Protection (PE),Operator,Owner,0,0,No message yet,0,Incomplete,0,N/A,0,No message yet,0,default_system,Default System,default_system,objective
physical access devices are managed.,3.10.5[c],c,PE.L1-3.10.5,FALSE,FALSE,1,1,0,CMMC ML 1,Physical Protection (PE),Operator,Owner,0,0,No message yet,0,Incomplete,0,N/A,0,No message yet,0,default_system,Default System,default_system,objective
safeguarding measures for CUI are defined for alternate work sites.,3.10.6[a],a,PE.L2-3.10.6,FALSE,FALSE,2,1,0,CMMC ML 1,Physical Protection (PE),Operator,Owner,0,0,No message yet,0,Incomplete,0,N/A,0,No message yet,0,default_system,Default System,default_system,objective
safeguarding measures for CUI are enforced for alternate work sites.,3.10.6[b],b,PE.L2-3.10.6,FALSE,FALSE,2,1,0,CMMC ML 1,Physical Protection (PE),Operator,Owner,0,0,No message yet,0,Incomplete,0,N/A,0,No message yet,0,default_system,Default System,default_system,objective
the frequency to assess risk to organizational operations,3.11.1[a],a,RA.L2-3.11.1,FALSE,FALSE,2,3,0,CMMC ML 1,Risk Assessment (RA),Operator,Owner,0,0,No message yet,0,Incomplete,0,N/A,0,No message yet,0,default_system,Default System,default_system,objective
risk to organizational operations,3.11.1[b],b,RA.L2-3.11.1,FALSE,FALSE,2,3,0,CMMC ML 1,Risk Assessment (RA),Operator,Owner,0,0,No message yet,0,Incomplete,0,N/A,0,No message yet,0,default_system,Default System,default_system,objective
the frequency to scan for vulnerabilities in organizational systems and applications is defined.,3.11.2[a],a,RA.L2-3.11.2,FALSE,FALSE,2,5,0,CMMC ML 1,Risk Assessment (RA),Operator,Owner,0,0,No message yet,0,Incomplete,0,N/A,0,No message yet,0,default_system,Default System,default_system,objective
vulnerability scans are performed on organizational systems with the defined frequency.,3.11.2[b],b,RA.L2-3.11.2,TRUE,TRUE,2,5,0,CMMC ML 1,Risk Assessment (RA),Operator,Owner,0,0,No message yet,0,Incomplete,0,N/A,0,No message yet,0,default_system,Default System,default_system,objective
vulnerability scans are performed on applications with the defined frequency.,3.11.2[c],c,RA.L2-3.11.2,FALSE,FALSE,2,5,0,CMMC ML 1,Risk Assessment (RA),Operator,Owner,0,0,No message yet,0,Incomplete,0,N/A,0,No message yet,0,default_system,Default System,default_system,objective
vulnerability scans are performed on organizational systems when new vulnerabilities are identified.,3.11.2[d],d,RA.L2-3.11.2,FALSE,FALSE,2,5,0,CMMC ML 1,Risk Assessment (RA),Operator,Owner,0,0,No message yet,0,Incomplete,0,N/A,0,No message yet,0,default_system,Default System,default_system,objective
vulnerability scans are performed on applications when new vulnerabilities are identified.,3.11.2[e],e,RA.L2-3.11.2,FALSE,FALSE,2,5,0,CMMC ML 1,Risk Assessment (RA),Operator,Owner,0,0,No message yet,0,Incomplete,0,N/A,0,No message yet,0,default_system,Default System,default_system,objective
vulnerabilities are identified.,3.11.3[a],a,RA.L2-3.11.3,FALSE,FALSE,2,1,0,CMMC ML 1,Risk Assessment (RA),Operator,Owner,0,0,No message yet,0,Incomplete,0,N/A,0,No message yet,0,default_system,Default System,default_system,objective
vulnerabilities are remediated in accordance with risk assessments.,3.11.3[b],b,RA.L2-3.11.3,FALSE,FALSE,2,1,0,CMMC ML 1,Risk Assessment (RA),Operator,Owner,0,0,No message yet,0,Incomplete,0,N/A,0,No message yet,0,default_system,Default System,default_system,objective
the frequency of security control assessments is defined.,3.12.1[a],a,CA.L2-3.12.1,FALSE,FALSE,2,5,0,CMMC ML 1,Security Assessment (CA),Operator,Owner,0,0,No message yet,0,Incomplete,0,N/A,0,No message yet,0,default_system,Default System,default_system,objective
security controls are assessed with the defined frequency to determine if the controls are effective in their application.,3.12.1[b],b,CA.L2-3.12.1,FALSE,FALSE,2,5,0,CMMC ML 1,Security Assessment (CA),Operator,Owner,0,0,No message yet,0,Incomplete,0,N/A,0,No message yet,0,default_system,Default System,default_system,objective
deficiencies and vulnerabilities to be addressed by the plan of action are identified.,3.12.2[a],a,CA.L2-3.12.2,FALSE,FALSE,2,3,0,CMMC ML 1,Security Assessment (CA),Operator,Owner,0,0,No message yet,0,Incomplete,0,N/A,0,No message yet,0,default_system,Default System,default_system,objective
a plan of action is developed to correct identified deficiencies and reduce or eliminate identified vulnerabilities.,3.12.2[b],b,CA.L2-3.12.2,FALSE,FALSE,2,3,0,CMMC ML 1,Security Assessment (CA),Operator,Owner,0,0,No message yet,0,Incomplete,0,N/A,0,No message yet,0,default_system,Default System,default_system,objective
the plan of action is implemented to correct identified deficiencies and reduce or eliminate identified vulnerabilities.,3.12.2[c],c,CA.L2-3.12.2,FALSE,FALSE,2,3,0,CMMC ML 1,Security Assessment (CA),Operator,Owner,0,0,No message yet,0,Incomplete,0,N/A,0,No message yet,0,default_system,Default System,default_system,objective
Determine if security controls are monitored on an ongoing basis to ensure the continued effectiveness of those controls.,3.12.3[a],a,CA.L2-3.12.3,FALSE,FALSE,2,5,0,CMMC ML 1,Security Assessment (CA),Operator,Owner,0,0,No message yet,0,Incomplete,0,N/A,0,No message yet,0,default_system,Default System,default_system,objective
a system security plan is developed.,3.12.4[a],a,CA.L2-3.12.4,FALSE,FALSE,2,N/A,0,CMMC ML 1,Security Assessment (CA),Operator,Owner,0,0,No message yet,0,Incomplete,0,N/A,0,No message yet,0,default_system,Default System,default_system,objective
the system boundary is described and documented in the system security plan.,3.12.4[b],b,CA.L2-3.12.4,FALSE,FALSE,2,N/A,0,CMMC ML 1,Security Assessment (CA),Operator,Owner,0,0,No message yet,0,Incomplete,0,N/A,0,No message yet,0,default_system,Default System,default_system,objective
the system environment of operation is described and documented in the system security plan.,3.12.4[c],c,CA.L2-3.12.4,FALSE,FALSE,2,N/A,0,CMMC ML 1,Security Assessment (CA),Operator,Owner,0,0,No message yet,0,Incomplete,0,N/A,0,No message yet,0,default_system,Default System,default_system,objective
the security requirements identified and approved by the designated authority as non-applicable are identified.,3.12.4[d],d,CA.L2-3.12.4,FALSE,FALSE,2,N/A,0,CMMC ML 1,Security Assessment (CA),Operator,Owner,0,0,No message yet,0,Incomplete,0,N/A,0,No message yet,0,default_system,Default System,default_system,objective
the method of security requirement implementation is described and documented in the system security plan.,3.12.4[e],e,CA.L2-3.12.4,FALSE,FALSE,2,N/A,0,CMMC ML 1,Security Assessment (CA),Operator,Owner,0,0,No message yet,0,Incomplete,0,N/A,0,No message yet,0,default_system,Default System,default_system,objective
the relationship with or connection to other systems is described and documented in the system security plan.,3.12.4[f],f,CA.L2-3.12.4,FALSE,FALSE,2,N/A,0,CMMC ML 1,Security Assessment (CA),Operator,Owner,0,0,No message yet,0,Incomplete,0,N/A,0,No message yet,0,default_system,Default System,default_system,objective
the frequency to update the system security plan is defined.,3.12.4[g],g,CA.L2-3.12.4,FALSE,FALSE,2,N/A,0,CMMC ML 1,Security Assessment (CA),Operator,Owner,0,0,No message yet,0,Incomplete,0,N/A,0,No message yet,0,default_system,Default System,default_system,objective
system security plan is updated with the defined frequency.,3.12.4[h],h,CA.L2-3.12.4,FALSE,FALSE,2,N/A,0,CMMC ML 1,Security Assessment (CA),Operator,Owner,0,0,No message yet,0,Incomplete,0,N/A,0,No message yet,0,default_system,Default System,default_system,objective
the external system boundary is defined.,3.13.1[a],a,SC.L1-3.13.1,FALSE,FALSE,1,5,0,CMMC ML 1,System and Communications Protection (SC),Operator,Owner,0,0,No message yet,0,Incomplete,0,N/A,0,No message yet,0,default_system,Default System,default_system,objective
key internal system boundaries are defined.,3.13.1[b],b,SC.L1-3.13.1,FALSE,FALSE,1,5,0,CMMC ML 1,System and Communications Protection (SC),Operator,Owner,0,0,No message yet,0,Incomplete,0,N/A,0,No message yet,0,default_system,Default System,default_system,objective
communications are monitored at the external system boundary.,3.13.1[c],c,SC.L1-3.13.1,TRUE,FALSE,1,5,0,CMMC ML 1,System and Communications Protection (SC),Operator,Owner,0,0,No message yet,0,Incomplete,0,N/A,0,No message yet,0,default_system,Default System,default_system,objective
communications are monitored at key internal boundaries.,3.13.1[d],d,SC.L1-3.13.1,TRUE,FALSE,1,5,0,CMMC ML 1,System and Communications Protection (SC),Operator,Owner,0,0,No message yet,0,Incomplete,0,N/A,0,No message yet,0,default_system,Default System,default_system,objective
communications are controlled at the external system boundary.,3.13.1[e],e,SC.L1-3.13.1,TRUE,TRUE,1,5,0,CMMC ML 1,System and Communications Protection (SC),Operator,Owner,0,0,No message yet,0,Incomplete,0,N/A,0,No message yet,0,default_system,Default System,default_system,objective
communications are controlled at key internal boundaries.,3.13.1[f],f,SC.L1-3.13.1,TRUE,TRUE,1,5,0,CMMC ML 1,System and Communications Protection (SC),Operator,Owner,0,0,No message yet,0,Incomplete,0,N/A,0,No message yet,0,default_system,Default System,default_system,objective
communications are protected at the external system boundary.,3.13.1[g],g,SC.L1-3.13.1,FALSE,FALSE,1,5,0,CMMC ML 1,System and Communications Protection (SC),Operator,Owner,0,0,No message yet,0,Incomplete,0,N/A,0,No message yet,0,default_system,Default System,default_system,objective
communications are protected at key internal boundaries.,3.13.1[h],h,SC.L1-3.13.1,FALSE,FALSE,1,5,0,CMMC ML 1,System and Communications Protection (SC),Operator,Owner,0,0,No message yet,0,Incomplete,0,N/A,0,No message yet,0,default_system,Default System,default_system,objective
architectural designs that promote effective information security are identified.,3.13.2[a],a,SC.L2-3.13.2,FALSE,FALSE,2,5,0,CMMC ML 1,System and Communications Protection (SC),Operator,Owner,0,0,No message yet,0,Incomplete,0,N/A,0,No message yet,0,default_system,Default System,default_system,objective
software development techniques that promote effective information security are identified.,3.13.2[b],b,SC.L2-3.13.2,FALSE,FALSE,2,5,0,CMMC ML 1,System and Communications Protection (SC),Operator,Owner,0,0,No message yet,0,Incomplete,0,N/A,0,No message yet,0,default_system,Default System,default_system,objective
systems engineering principles that promote effective information security are identified.,3.13.2[c],c,SC.L2-3.13.2,FALSE,FALSE,2,5,0,CMMC ML 1,System and Communications Protection (SC),Operator,Owner,0,0,No message yet,0,Incomplete,0,N/A,0,No message yet,0,default_system,Default System,default_system,objective
identified architectural designs that promote effective information security are employed.,3.13.2[d],d,SC.L2-3.13.2,FALSE,FALSE,2,5,0,CMMC ML 1,System and Communications Protection (SC),Operator,Owner,0,0,No message yet,0,Incomplete,0,N/A,0,No message yet,0,default_system,Default System,default_system,objective
identified software development techniques that promote effective information security are employed.,3.13.2[e],e,SC.L2-3.13.2,FALSE,FALSE,2,5,0,CMMC ML 1,System and Communications Protection (SC),Operator,Owner,0,0,No message yet,0,Incomplete,0,N/A,0,No message yet,0,default_system,Default System,default_system,objective
identified systems engineering principles that promote effective information security are employed.,3.13.2[f],f,SC.L2-3.13.2,FALSE,FALSE,2,5,0,CMMC ML 1,System and Communications Protection (SC),Operator,Owner,0,0,No message yet,0,Incomplete,0,N/A,0,No message yet,0,default_system,Default System,default_system,objective
user functionality is identified.,3.13.3[a],a,SC.L2-3.13.3,FALSE,FALSE,2,1,0,CMMC ML 1,System and Communications Protection (SC),Operator,Owner,0,0,No message yet,0,Incomplete,0,N/A,0,No message yet,0,default_system,Default System,default_system,objective
system management functionality is identified.,3.13.3[b],b,SC.L2-3.13.3,FALSE,FALSE,2,1,0,CMMC ML 1,System and Communications Protection (SC),Operator,Owner,0,0,No message yet,0,Incomplete,0,N/A,0,No message yet,0,default_system,Default System,default_system,objective
user functionality is separated from system management functionality.,3.13.3[c],c,SC.L2-3.13.3,FALSE,FALSE,2,1,0,CMMC ML 1,System and Communications Protection (SC),Operator,Owner,0,0,No message yet,0,Incomplete,0,N/A,0,No message yet,0,default_system,Default System,default_system,objective
