displayName,description,suggestedAction,documentationLink,provider,category,service,level,mitre_tactic,mitre_technique,mitre_id,mitre_link
A CloudTrail log has been deleted or disabled (GuardDuty),"Amazon GuardDuty provides monitoring and alerting based on analysis of VPC Flow Logs, CloudTrail logs, and DNS logs.  It can alert you about traffic to or from sources that are known to be malicious.  It can also identify unusual patterns in AWS account activity.  AWS CloudTrail logs AWS API calls used within an AWS account, including calls made from the AWS Management Console, SDKs, command line tools, and other AWS services.  When a CloudTrail trail is deleted or disabled without your knowledge, that may be evidence of malicious activity.
",Verify that disabled CloudTrail is desired and which credential was used to make the configuration change.,https://kb.securestate.vmware.com/aws-guardduty-cloud-trail-logging-disabled.html,aws,Stealth,iam,Low,Not Available,Not Available,Not Available,Not Available
A Key Vault secret has no scheduled expiration,"Azure Key Vault secrets allow for storage of sensitive information like passwords and database connection strings.  By default, secrets do not expire, but you can set an expiration.  CIS 8.2 recommends that you set expirations for all secrets.  Expiring secrets will ensure that they cannot be used beyond their intended lifetime and will help to ensure that you rotate the passwords, connection strings, or other data contained in secrets.  Secrets do not expire by default; you must set an expiration date.
","You should schedule expiration dates for all Key Vault secrets to help ensure that passwords, connection strings, and other secret data is rotated periodically.",https://kb.securestate.vmware.com/azure-key-vault-expiry-date-set-for-all-secrets.html,azure,Security,Microsoft.KeyVault,Medium,Not Available,Not Available,Not Available,Not Available
A password policy is not configured,"Amazon recommends that you set a password policy for your AWS account that enforces password expiration, length, complexity, and other parameters.
",You should create and use a password policy to ensure that passwords are more difficult to compromise.,https://kb.securestate.vmware.com/iam-missing-password-policy.html,aws,Access,iam,High,Not Available,Not Available,Not Available,Not Available
A port range is defined in a security group,"AWS security groups act as firewalls, controlling both inbound and outbound traffic.  Although it is possible to configure security group rules that use a port range, the best practice is to specify individual ports.  By specifying a port range, you may inadvertently allow access to ports that are not used by your application.

This rule will alert on all security group rules that use a port range.  A port range is not necessarily a problem and there may be situations where it makes sense to use one, such as when an application uses a large number of contiguous ports.
","You should create security group rules for specific ports, rather than for ranges of ports.",https://kb.securestate.vmware.com/ec2-ports-range.html,aws,Security,ec2,Low,Not Available,Not Available,Not Available,Not Available
A principal has attempted to assign a highly permissive policy to themselves. This behavior is associated with a privilege escalation attack (GuardDuty),"This finding informs you that a specific principal in your AWS environment is exhibiting behavior that can be indicative of a privilege escalation attack. This finding is triggered when a user or role attempts to assign a highly permissive policy to themselves. If the user or role in question is not meant to have administrative privileges, either the user's credentials may be compromised or the role's permissions may not be configured properly. In an effort to maximize their ability to access your account, even after they have been discovered, attackers can use stolen credentials or a misconfigured role to escalate their privileges and then create new users, add access policies to existing users, create access keys, etc.
",Verify that IAM credentials used for this API access are valid and needed. Change credentials if there is any doubt.,https://kb.securestate.vmware.com/aws-guardduty-privilege-escalation-iamuser-administrative-permissions.html,aws,PrivilegeEscalation,iam,Low,Persistence,Account Manipulation,T1098,https://attack.mitre.org/techniques/T1098/
A Redshift cluster is accessible from the Internet,"You can configure an Amazon Redshift cluster to be publicly accessible from the Internet or they can be deployed within VPCs and accessed according to security group and routing policies.  We recommend that you configure Redshift clusters so that they are not publicly accessible.
",You should deploy Redshift within a VPC and restrict access from the Internet.,https://kb.securestate.vmware.com/redshift-publicly-accessible.html,aws,Security,redshift,High,Collection,Data from Cloud Storage Object,T1530,https://attack.mitre.org/techniques/T1530/
A security group allows unrestricted protocol access,"AWS security groups act as firewalls, controlling both inbound and outbound traffic.  Other than when troubleshooting or testing, you should not configure a security group to allow any protocol.  Attackers can use protocols like ICMP and UDP to gain information about your network and virtual machines.
",You should configure security groups to allow only those protocols that you require.,https://kb.securestate.vmware.com/ec2-all-ports-all-protocols.html,aws,Security,ec2,Low,Initial Access,Exploit Public-Facing Application,T1190,https://attack.mitre.org/techniques/T1190/
A security group is configured to allow unrestricted access,"AWS security groups act as firewalls, controlling both inbound and outbound traffic.  If you configure a rule that uses a source address of 0.0.0.0/0 or ::/0, you are allowing connections from any combination of address and port.  Although you might need to occasionally remove all restrictions for testing or troubleshooting, it is never safe in a production environment.  The best practice is to restrict access to the minimum number of IP addresses and ports that are required for your application.
",You should restrict security groups to the minimum number of IP addresses and ports that you require.,https://kb.securestate.vmware.com/ec2-unrestricted-traffic.html,aws,Security,ec2,Low,Initial Access,Exploit Public-Facing Application,T1190,https://attack.mitre.org/techniques/T1190/
A security group's FTP control port (21) is accessible through any source address,"Because FTP is a plain text protocol, the FTP ports are attractive targets for attackers.  At minimum, you should configure the security group to restrict access to the FTP control port, TCP port 21.  We recommend that you disable access to FTP and use a more secure file transfer service.
",You should restrict access to the FTP control port.,https://kb.securestate.vmware.com/ec2-TCP-21.html,aws,Security,ec2,Low,"Initial Access,Discovery","Exploit Public-Facing Application,System Network Connections Discovery","T1190,T1049","https://attack.mitre.org/techniques/T1190/,https://attack.mitre.org/techniques/T1049/"
A security group's FTP data port (20) is accessible through any source address,"Because FTP is a plain text protocol, the FTP ports are attractive targets for attackers.  At minimum, you should configure the security group to restrict access to the FTP data port, TCP port 20.  We recommend that you disable access to FTP and use a more secure file transfer service.
",You should restrict access to the FTP data port.,https://kb.securestate.vmware.com/ec2-TCP-20.html,aws,Security,ec2,Low,"Initial Access,Discovery","Exploit Public-Facing Application,System Network Connections Discovery","T1190,T1049","https://attack.mitre.org/techniques/T1190/,https://attack.mitre.org/techniques/T1049/"
A security group's MongoDB server port (27017) is accessible through any source address,"Because it is commonly used for database access, the default MongoDB listener port is an attractive target for attackers.  We recommend that you restrict access to the MongoDB port (TCP 27017) with a security group.
",You should restrict access to the MongoDB server port.,https://kb.securestate.vmware.com/ec2-TCP-27017-0.0.0.0-0.html,aws,Security,ec2,Low,"Initial Access,Discovery","Exploit Public-Facing Application,System Network Connections Discovery","T1190,T1049","https://attack.mitre.org/techniques/T1190/,https://attack.mitre.org/techniques/T1049/"
A security group's MySQL Server port (3306) is accessible through any source address,"Because it is commonly used for database access, the default MySQL Server listener port is an attractive target for attackers.  We recommend that you restrict access to the MySQL port (TCP 3306) with a security group.
",You should restrict access to the MySQL server port.,https://kb.securestate.vmware.com/ec2-TCP-3306-0.0.0.0-0.html,aws,Security,ec2,Low,Initial Access,Exploit Public-Facing Application,T1190,https://attack.mitre.org/techniques/T1190/
A security group's Oracle SQL port (1521) is accessible through any source address,"Because it is commonly used for database access, the default Oracle SQL Listener port is an attractive target for attackers.  We recommend that you restrict access to the Oracle SQL port (TCP 1521) with a security group.
",You should restrict access to the Oracle SQL port.,https://kb.securestate.vmware.com/ec2-TCP-1521-0.0.0.0-0.html,aws,Security,ec2,Low,"Initial Access,Discovery","Exploit Public-Facing Application,System Network Connections Discovery","T1190,T1049","https://attack.mitre.org/techniques/T1190/,https://attack.mitre.org/techniques/T1049/"
A security group's PostgreSQL Server port (5432) is accessible through any source address,"Because it is commonly used for database access, the default PostgreSQL Server listener port is an attractive target for attackers.  We recommend that you restrict access to the PostgreSQL port (TCP 5432) with a security group.
",You should restrict access to the PostgreSQL server port.,https://kb.securestate.vmware.com/ec2-TCP-5432-0.0.0.0-0.html,aws,Security,ec2,Low,"Initial Access,Discovery","Exploit Public-Facing Application,System Network Connections Discovery","T1190,T1049","https://attack.mitre.org/techniques/T1190/,https://attack.mitre.org/techniques/T1049/"
A security group's Redshift port (5439) is accessible through any source address,"Because it is well known port, the default Redshift port is an attractive target for attackers.  We recommend that you restrict access to the Redshift port (TCP 5439) with a security group.
",You should restrict access to the Redshift port.,https://kb.securestate.vmware.com/ec2-TCP-5439-0.0.0.0-0.html,aws,Security,ec2,Low,"Initial Access,Discovery","Exploit Public-Facing Application,System Network Connections Discovery","T1190,T1049","https://attack.mitre.org/techniques/T1190/,https://attack.mitre.org/techniques/T1049/"
A security group's Remote Desktop port (3389) is accessible through any source address,"Because it is commonly used for administrative access, the Remote Desktop Protocol is an attractive target for attackers.  CIS 4.2 recommends that you restrict access to the RDP port (TCP 3389) with a security group.
",You should restrict access to the Remote Desktop port.,https://kb.securestate.vmware.com/ec2-TCP-3389-0.0.0.0-0.html,aws,Security,ec2,Medium,"Initial Access,Discovery","Exploit Public-Facing Application,System Network Connections Discovery","T1190,T1049","https://attack.mitre.org/techniques/T1190/,https://attack.mitre.org/techniques/T1049/"
A security group's SQL Server port (1433) is accessible through any source address,"Because it is commonly used for database access, the default SQL Server port is an attractive target for attackers.  We recommend that you restrict access to the SQL Server port (TCP 1433) with a security group.
",You should restrict access to the SQL server port.,https://kb.securestate.vmware.com/ec2-TCP-1433-0.0.0.0-0.html,aws,Security,ec2,Low,"Initial Access,Discovery","Exploit Public-Facing Application,System Network Connections Discovery","T1190,T1049","https://attack.mitre.org/techniques/T1190/,https://attack.mitre.org/techniques/T1049/"
A security group's SSH port (22) is accessible through any source address,"Because it is commonly used for administrative access, the SSH port is an attractive target for attackers.  CIS 4.1 recommends that you restrict access to the SSH port (TCP 22) with a security group.
",You should configure security groups to prevent SSH access from the Internet.,https://kb.securestate.vmware.com/ec2-TCP-22-0.0.0.0-0.html,aws,Security,ec2,Medium,"Initial Access,Discovery","Exploit Public-Facing Application,System Network Connections Discovery","T1190,T1049","https://attack.mitre.org/techniques/T1190/,https://attack.mitre.org/techniques/T1049/"
A security group's TCP port 8080 is accessible through any source address,"TCP port 8080 has historically had diverse uses, as an alternate web server port, for development environments, and for HTTP proxies.  Often, these alternative services are not as well secured as the HTTP and HTTPS ports.  We recommend that you restrict access to TCP port 8080 with a security group.
",You should restrict access to TCP port 8080.,https://kb.securestate.vmware.com/ec2-TCP-8080.html,aws,Security,ec2,Low,"Initial Access,Discovery","Exploit Public-Facing Application,System Network Connections Discovery","T1190,T1049","https://attack.mitre.org/techniques/T1190/,https://attack.mitre.org/techniques/T1049/"
A security group's Telnet port (23) is accessible through any source address,"Because Telnet is a plain text protocol, the Telnet port (TCP 23) is an attractive target for attackers.  At minimum, you should configure the security group to restrict access to the Telnet port, TCP port 23.  We recommend that you disable access to Telnet and use SSH instead.
",You should restrict access to the Telnet port.,https://kb.securestate.vmware.com/ec2-TCP-23.html,aws,Security,ec2,Low,"Initial Access,Discovery","Exploit Public-Facing Application,System Network Connections Discovery","T1190,T1049","https://attack.mitre.org/techniques/T1190/,https://attack.mitre.org/techniques/T1049/"
A user has logged in to the AWS console from more than one location in a short period of time (GuardDuty),"Amazon GuardDuty provides monitoring and alerting based on analysis of VPC Flow Logs, CloudTrail logs, and DNS logs.  It can alert you about traffic to or from sources that are known to be malicious.  It can also identify unusual patterns in AWS account activity.  GuardDuty reports when an IAM user logs in successfully to the AWS console from more than one geopgraphic location over a short period of time.  This might indicate that the IAM credentials have been compromised.
",Verify that IAM credentials used for this API access are valid and needed. Change credentials if there is any doubt.,https://kb.securestate.vmware.com/aws-guardduty-console-login-success.b.html,aws,UnauthorizedAccess,iam,Medium,"Initial Access,Persistence,Defense Evasion,Privlege Escalation",Valid Accounts,T1078,https://attack.mitre.org/techniques/T1078/
A user has logged in to the AWS console in a way that does not fit the established pattern (GuardDuty),"Amazon GuardDuty provides monitoring and alerting based on analysis of VPC Flow Logs, CloudTrail logs, and DNS logs.  It can alert you about traffic to or from sources that are known to be malicious.  It can also identify unusual patterns in AWS account activity.  GuardDuty reports when an IAM user logs in successfully to the AWS console without a prior history of doing so or from an unusual location.  This might indicate that the IAM credentials have been compromised.
",Verify that IAM credentials used for this API access are valid and needed. Change credentials if there is any doubt.,https://kb.securestate.vmware.com/aws-guardduty-console-login.html,aws,UnauthorizedAccess,iam,Medium,Not Available,Not Available,Not Available,Not Available
A user has made an API call to read permissions data in a manner inconsistent with prior activity (GuardDuty),"Amazon GuardDuty provides monitoring and alerting based on analysis of VPC Flow Logs, CloudTrail logs, and DNS logs.  It can alert you about traffic to or from sources that are known to be malicious.  It can also identify unusual patterns in AWS account activity.  GuardDuty reports when a user has made an API call to read information about users, groups, policies, or permissions and this activity not consistent with the normal activity pattern of that user.  This may indicate that the account has been compromised and an attacker is attempting to gather information.
",Verify that IAM credentials used for this API access are valid and needed. Change credentials if there is any doubt.,https://kb.securestate.vmware.com/aws-guardduty-user-permissions-recon-iamuser.html,aws,Recon,iam,Medium,Not Available,Not Available,Not Available,Not Available
A user has made API calls to read network configurations in a way that does not fit the established pattern (GuardDuty),"Amazon GuardDuty provides monitoring and alerting based on analysis of VPC Flow Logs, CloudTrail logs, and DNS logs.  It can alert you about traffic to or from sources that are known to be malicious.  It can also identify unusual patterns in AWS account activity.  GuardDuty reports when an user makes API calls to read the configuration of security groups, routes, or ACLs and that activity is not consistent with their previous API usage.  This may indicate that the user account has been compromised.
",Verify that IAM credentials used for this API access are valid and needed. Change credentials if there is any doubt.,https://kb.securestate.vmware.com/aws-guardduty-network-permissions-recon-iamuser.html,aws,Recon,iam,Medium,Not Available,Not Available,Not Available,Not Available
"A user has made changes to IAM users, groups, or policies in a manner inconsistent with prior activity (GuardDuty)","Amazon GuardDuty provides monitoring and alerting based on analysis of VPC Flow Logs, CloudTrail logs, and DNS logs.  It can alert you about traffic to or from sources that are known to be malicious.  It can also identify unusual patterns in AWS account activity.  GuardDuty reports when a user has made changes to IAM users, groups, or policies and those changes are not consistent with the normal activity pattern of that user.  This may indicate that the account has been compromised and an attacker is attempting to develop additional means of access to the account.
",Verify that IAM credentials used for this API access are valid and needed. Change credentials if there is any doubt.,https://kb.securestate.vmware.com/aws-guardduty-user-permissions-persistence-iamuser.html,aws,Persistence,iam,Medium,Not Available,Not Available,Not Available,Not Available
A user has made network configuration changes in a way that does not fit the established pattern (GuardDuty),"Amazon GuardDuty provides monitoring and alerting based on analysis of VPC Flow Logs, CloudTrail logs, and DNS logs.  It can alert you about traffic to or from sources that are known to be malicious.  It can also identify unusual patterns in AWS account activity.  GuardDuty reports when a user makes changes to security groups, routes, or ACLs that are not consistent with their usual pattern of activity.  This may indicate that the user account has been compromised.
",Verify that IAM credentials used for this API access are valid and needed. Change credentials if there is any doubt.,https://kb.securestate.vmware.com/aws-guardduty-network-permissions-persistence-iamuser.html,aws,Persistence,iam,Medium,Not Available,Not Available,Not Available,Not Available
A user made logging configuration changes to your AWS account (GuardDuty),"Amazon GuardDuty provides monitoring and alerting based on analysis of VPC Flow Logs, CloudTrail logs, and DNS logs.  It can alert you about traffic to or from sources that are known to be malicious.  It can also identify unusual patterns in AWS account activity.  GuardDuty reports when a user makes logging changes to your AWS account that do not fit the established pattern.  This might be evidence that someone is trying to conceal malicious activity.
",Verify that disabled CloudTrail is desired and which credential was used to make the configuration change.,https://kb.securestate.vmware.com/aws-guardduty-logging-configuration-modified.html,aws,Stealth,iam,Medium,Not Available,Not Available,Not Available,Not Available
A user without a history of similar activity has modified IAM user permissions (GuardDuty),"Amazon GuardDuty provides monitoring and alerting based on analysis of VPC Flow Logs, CloudTrail logs, and DNS logs.  It can alert you about traffic to or from sources that are known to be malicious.  It can also identify unusual patterns in AWS account activity.  GuardDuty reports when a user modifies permissions for an IAM user and the activity is not consistent with their past account activities.  This might indicate that the user account has been compromised.
",Verify that IAM credentials used for this API access are valid and needed. Change credentials if there is any doubt.,https://kb.securestate.vmware.com/aws-guardduty-resource-permissions-persistence-iamuser.html,aws,Persistence,iam,Medium,Not Available,Not Available,Not Available,Not Available
A user without a history of similar activity has read the permissions of an IAM user (GuardDuty),"Amazon GuardDuty provides monitoring and alerting based on analysis of VPC Flow Logs, CloudTrail logs, and DNS logs.  It can alert you about traffic to or from sources that are known to be malicious.  It can also identify unusual patterns in AWS account activity.  GuardDuty reports when a user reads permissions for an IAM user and the activity is not consistent with their past account activities.  This might indicate that the user account has been compromised.
",Verify that IAM credentials used for this API access are valid and needed. Change credentials if there is any doubt.,https://kb.securestate.vmware.com/aws-guardduty-resource-permissions-recon-iamuser.html,aws,Recon,iam,Medium,Not Available,Not Available,Not Available,Not Available
Access logging is not enabled for CloudTrail S3 buckets,"AWS CloudTrail records AWS API calls used within an AWS account, including calls made from the AWS Management Console, SDKs, command line tools, and other AWS services.  CloudTrail logs are stored in Amazon S3 buckets.  Because CloudTrail data is potentially sensitive, we recommend that you enable access logging on all CloudTrail buckets.
",You should enable access logging for all CloudTrail S3 buckets to ensure that you have an audit trail.,https://kb.securestate.vmware.com/s3-cloudtrail-no-logging.html,aws,Audit,user,Medium,Collection,Data from Cloud Storage Object,T1530,https://attack.mitre.org/techniques/T1530/
Access to CloudTrail S3 buckets is unrestricted,"AWS CloudTrail records AWS API calls used within an AWS account, including calls made from the AWS Management Console, SDKs, command line tools, and other AWS services.  CloudTrail logs are stored in Amazon S3 buckets.  Because CloudTrail data is potentially sensitive, CIS 2.3 recommends that you restrict access to CloudTrail buckets.
",You should restrict access to CloudTrail S3 buckets to only users who require it.,https://kb.securestate.vmware.com/s3-cloudtrail-public-access.html,aws,Audit,user,High,Collection,Data from Cloud Storage Object,T1530,https://attack.mitre.org/techniques/T1530/
Activity logs are retained for less than 365 days,"Azure allows you to create Activity Logs for configuration events.  By default, activity logs are retained for 90 days, but because it typically takes more than seven months to detect a security breach, CIS 5.2 recommends that you configure Azure to retain logs for one year or longer.
",You should retain activity logs for one year or longer to ensure that you have a sufficient audit trail to detect a breach.,https://kb.securestate.vmware.com/azure-monitoring-activity-log-retention-365-days-or-greater.html,azure,Logging,Microsoft.Insights,Low,Not Available,Not Available,Not Available,Not Available
Adaptive Application Controls are not enabled,"Azure Adaptive Application Controls limit the applications that are allowed to run within virtual machines.  CIS 2.13 recommends that you enable Adaptive Application Controls to help protect against malware.  This feature is enabled by default.
",You should enable Adaptive Application Controls to ensure that virtual machines cannot run proscribed software.,https://kb.securestate.vmware.com/azure-security-adaptive-application-controls-on.html,azure,Security,Microsoft.Security,Medium,Initial Access,Exploit Public-Facing Application,T1190,https://attack.mitre.org/techniques/T1190/
An active IAM key has not been rotated for more than 90 days,"AWS IAM keys present a security risk if they are not managed carefully.  In many cases, it is better to use IAM roles and generate temporary security credentials, rather than to issue user-based credentials of unlimited duration.  When you use IAM keys, CIS 1.4 recommends that you rotate keys every 90 days.  IAM key rotation is not enabled by default; you must enable it.
",You should rotate IAM keys every 90 days or less to reduce the risk of lost or stolen keys.,https://kb.securestate.vmware.com/iam-active-key-no-rotation.html,aws,Access,iam,Medium,"Initial Access,Persistence,Defense Evasion,Privlege Escalation",Valid Accounts,T1078,https://attack.mitre.org/techniques/T1078/
