displayName,description,suggestedAction,documentationLink,provider,category,service,level,mitre_tactic,mitre_technique,mitre_id,mitre_link
KMS automated key rotation is not enabled,"The AWS Key Management Service (KMS) allows you to rotate encryption keys so that your exposure is reduced in the event that an individual key is compromised.  CIS 2.8 recommends that you enable automatic key rotation.  This feature is not enabled be default; you must enable it.
",You should enable automated key rotation to help limit exposure in case of lost or stolen encryption keys.,https://kb.securestate.vmware.com/kms-key-rotates.html,aws,Audit,kms,Medium,Not Available,Not Available,Not Available,Not Available
Logging For Keyvault Enabled,"Azure Key Vault secrets allow for storage of sensitive information like passwords and database connection strings.  Because of the sensitive nature of Key Vault data, CIS 5.13 recommends that you enable Key Vault logging.  When you enable logging, access logs are stored in an Azure container.  Logging is not enabled by default; you must enable it.
","Azure Key Vault contains sensitive data, so you should enable Key Vault logging to ensure that you have an audit trail.",https://kb.securestate.vmware.com/azure-key-vault-logging-for-keyvault-enabled.html,azure,Logging,Microsoft.KeyVault,Medium,Not Available,Not Available,Not Available,Not Available
Microsoft Monitoring Agent autoprovisioning is disabled,"When you enable monitoring agent autoprovisioning, Azure Security Center will automatically provision the Microsoft Monitoring Agent for all compatible virtual machines.  The Microsoft Monitoring Agent alerts on security configurations, updates, and vulnerabilities.  CIS 2.2 recommends that you enable this setting.  This feature is enabled by default.
",You should enable Microsoft Monitoring Agent autoprovisioning to ensure that the agent is installed on all compatible virtual machines.,https://kb.securestate.vmware.com/azure-security-monitoring-agent-on.html,azure,Security,Microsoft.Security,Medium,Initial Access,Exploit Public-Facing Application,T1190,https://attack.mitre.org/techniques/T1190/
Multi-factor authentication is not enabled,"When multi-factor authentication (MFA) is enabled, AWS users must provide a one-time authentication code at login in addition to their user name and password.  CIS 1.2 recommends that you enable multi-factor authentication for all accounts that can access the AWS console.
",You should enable multi-factor authentication and use it with all accounts that have AWS Console access.,https://kb.securestate.vmware.com/iam-mfa-password-holders.html,aws,Security,iam,Medium,"Initial Access,Persistence,Defense Evasion,Privlege Escalation",Valid Accounts,T1078,https://attack.mitre.org/techniques/T1078/
Multi-factor authentication is not required for all users,"When multi-factor authentication (MFA) is enabled, AWS users must provide a one-time authentication code at login in addition to their user name and password.  CIS 1.2 recommends that you enable multi-factor authentication for all accounts that can access the AWS console.  We recommend that you take a more conservative approach and enable multi-factor authentication for all users.
",You should use multi-factor authentication for all IAM accounts.,https://kb.securestate.vmware.com/iam-no-mfa.html,aws,Security,iam,High,"Initial Access,Persistence,Defense Evasion,Privlege Escalation",Valid Accounts,T1078,https://attack.mitre.org/techniques/T1078/
Network flow logs are retained for less than 90 days,"Azure allows you to create packet flow logs that capture traffic to and from network security groups.  CIS 6.4 recommends that you enable flow logs and configure log retention for 90 days or longer.  Network flow logs are disabled by default; you must enable this feature.  Once enabled, flow logs are retained indefinitely by default.
",You should retain network flow logs for 90 days or longer in order to ensure that you have a sufficient audit trail for anomalous network traffic.,https://kb.securestate.vmware.com/azure-network-watcher-network-security-group-flow-log-retention-greater-than-90-days.html,azure,Security,Microsoft.Network,Low,Not Available,Not Available,Not Available,Not Available
Network security group recommendations are disabled,"When you enable the ""Network Security Groups"" security policy, Azure will recommend network security group configurations that restrict access to virtual machines with public endpoints.  CIS 2.7 recommends that you enable this setting.  This feature is enabled by default.
",You should enable network security group recommendations to ensure that you are aware of possible risks.,https://kb.securestate.vmware.com/azure-security-network-security-groups-on.html,azure,Security,Microsoft.Security,High,Initial Access,Exploit Public-Facing Application,T1190,https://attack.mitre.org/techniques/T1190/
Network Watcher Enabled,"Azure Network Watcher allows you to diagnose connectivity problems and capture packet flows to and from virtual machines and network security groups.  CIS 6.5 recommends that you enable Network Watcher because it is required for packet capture and logging.  This feature is not enabled by default; you must enable it.
",You should enable Network Watcher so that you can use it to obtain packet logs.,https://kb.securestate.vmware.com/azure-network-watcher-network-watcher-enabled.html,azure,Security,Microsoft.Network,High,Not Available,Not Available,Not Available,Not Available
Next generation firewall recommendations are disabled,"Next generation firewalls incorporate traditional firewall features with packet inspection and intrusion prevention features.  Azure Security Center allows you to deploy next generation firewalls, virtual devices that provide security infrastructure.  When you enable the ""Next Generation Firewall"" security policy, Azure will recommend when you should provision a next generation firewall.  CIS 2.9 recommends that you enable this setting.  This feature is enabled by default.
",You should enable next generation firewall recommendations to ensure that you are aware of conifgurations that may benefit from additional protection.,https://kb.securestate.vmware.com/azure-security-next-generation-firewall-on.html,azure,Security,Microsoft.Security,Medium,Initial Access,Exploit Public-Facing Application,T1190,https://attack.mitre.org/techniques/T1190/
No alarm is configured for AWS Config configuration changes,"AWS CloudTrail records AWS API calls used within an AWS account, including calls made from the AWS Management Console, SDKs, command line tools, and other AWS services.  AWS CloudWatch can perform real time analysis of CloudTrail logs.  AWS Config is a service that allows you to monitor AWS resources.  CIS 3.9 recommends that you create CloudWatch metric filters and alarms to detect changes in AWS Config.
",You should monitor AWS Config configuration changes.,https://kb.securestate.vmware.com/monitor-cloudwatch-config-changes.html,aws,Audit,user,Low,Not Available,Not Available,Not Available,Not Available
No alarm is configured for AWS Console logins that do not use MFA,"AWS CloudTrail records AWS API calls used within an AWS account, including calls made from the AWS Management Console, SDKs, command line tools, and other AWS services.  AWS CloudWatch can perform real time analysis of CloudTrail logs.  CIS 3.2 recommends that you configure a metric filter and alarm for logins that are not protected by multi-factor authentication.
",You should monitor AWS Console logins that do not use multi-factor authentication.,https://kb.securestate.vmware.com/monitor-console-login-without-mfa.html,aws,Audit,user,Medium,Not Available,Not Available,Not Available,Not Available
No alarm is configured for AWS Console root login attempts,"AWS CloudTrail records AWS API calls used within an AWS account, including calls made from the AWS Management Console, SDKs, command line tools, and other AWS services.  AWS CloudWatch can perform real time analysis of CloudTrail logs.  CIS 3.3 recommends that you configure a metric filter and alarm for root login attempts.
",You should monitor root login attempts to the AWS Console so that you are aware of any suspicious activity.,https://kb.securestate.vmware.com/monitor-root-account-usage.html,aws,Audit,user,High,Not Available,Not Available,Not Available,Not Available
No alarm is configured for CloudTrail configuration changes,"AWS CloudTrail records AWS API calls used within an AWS account, including calls made from the AWS Management Console, SDKs, command line tools, and other AWS services.  AWS CloudWatch can perform real time analysis of CloudTrail logs.  CIS 3.5 recommends that you create CloudWatch metric filters and alarms to detect changes in the CloudTrail configuration.
",You should monitor CloudTrail configuration changes.,https://kb.securestate.vmware.com/monitor-cloudtrail-config-changes.html,aws,Audit,user,Medium,Not Available,Not Available,Not Available,Not Available
No alarm is configured for customer master key deletion events,"AWS CloudTrail records AWS API calls used within an AWS account, including calls made from the AWS Management Console, SDKs, command line tools, and other AWS services.  AWS CloudWatch can perform real time analysis of CloudTrail logs.  CIS 3.7 recommends that you create CloudWatch metric filters and alarms to detect customer master keys (CMKs) that have been disabled or scheduled for deletion.
",You should monitor deletion events for customer master keys to ensure that keys are transitioned gracefully.,https://kb.securestate.vmware.com/monitor-cmk-change-delete.html,aws,Audit,user,Medium,Not Available,Not Available,Not Available,Not Available
No alarm is configured for failed AWS Console login attempts,"AWS CloudTrail records AWS API calls used within an AWS account, including calls made from the AWS Management Console, SDKs, command line tools, and other AWS services.  AWS CloudWatch can perform real time analysis of CloudTrail logs.  CIS 3.6 recommends that you configure a metric filter and alarm for failed AWS console login attempts.
",You should monitor failed login attempts for the AWS Console so that you are aware of any suspicious activity.,https://kb.securestate.vmware.com/monitor-console-auth-failures.html,aws,Audit,user,Medium,Not Available,Not Available,Not Available,Not Available
No alarm is configured for IAM policy changes,"AWS CloudTrail records AWS API calls used within an AWS account, including calls made from the AWS Management Console, SDKs, command line tools, and other AWS services.  AWS CloudWatch can perform real time analysis of CloudTrail logs.  CIS 3.4 recommends that you configure a metric filter and alarm for changes made to IAM policies.
",You should monitor changes to IAM policies to ensure that they are compatible with your security policy.,https://kb.securestate.vmware.com/monitor-iam-policy-changes.html,aws,Audit,user,High,Not Available,Not Available,Not Available,Not Available
No alarm is configured for network access control list changes,"AWS CloudTrail records AWS API calls used within an AWS account, including calls made from the AWS Management Console, SDKs, command line tools, and other AWS services.  AWS CloudWatch can perform real time analysis of CloudTrail logs.  Network Access Control Lists (NACLs) are used to control traffic to and from VPC subnets.  CIS 3.11 recommends that you configure a metric filter and alarm for changes made to NACL configuration.
",You should monitor changes to network access control lists to ensure that they are compatible with your security policy.,https://kb.securestate.vmware.com/monitor-nacl-changes.html,aws,Audit,user,High,Not Available,Not Available,Not Available,Not Available
No alarm is configured for network gateway configuration changes,"AWS CloudTrail records AWS API calls used within an AWS account, including calls made from the AWS Management Console, SDKs, command line tools, and other AWS services.  AWS CloudWatch can perform real time analysis of CloudTrail logs.  A network gateway is required to send traffic to or from a VPC subnet.  CIS 3.12 recommends that you configure a metric filter and alarm for changes made to network gateway configurations.
",You should monitor configuration changes to network gateways to ensure that they are compatible with your security policy.,https://kb.securestate.vmware.com/monitor-network-gateway-changes.html,aws,Audit,user,High,Not Available,Not Available,Not Available,Not Available
No alarm is configured for routing table configuration changes,"AWS CloudTrail records AWS API calls used within an AWS account, including calls made from the AWS Management Console, SDKs, command line tools, and other AWS services.  AWS CloudWatch can perform real time analysis of CloudTrail logs.  Routing tables define the flow of traffic between subnets and gateways.  CIS 3.13 recommends that you configure a metric filter and alarm for routing table configuration changes.
",You should monitor routing table configuration changes to ensure that they are compatible with your security policy.,https://kb.securestate.vmware.com/monitor-route-table-changes.html,aws,Audit,user,High,Not Available,Not Available,Not Available,Not Available
No alarm is configured for S3 bucket policy changes,"AWS CloudTrail records AWS API calls used within an AWS account, including calls made from the AWS Management Console, SDKs, command line tools, and other AWS services.  AWS CloudWatch can perform real time analysis of CloudTrail logs.  CIS 3.8 recommends that you configure a metric filter and alarm for changes to S3 bucket policies.
",You should monitor S3 bucket policy changes to ensure that they are compatible with your security policy.,https://kb.securestate.vmware.com/monitor-s3-bucket-policy-changes.html,aws,Audit,user,High,Not Available,Not Available,Not Available,Not Available
No alarm is configured for security group configuration changes,"AWS CloudTrail records AWS API calls used within an AWS account, including calls made from the AWS Management Console, SDKs, command line tools, and other AWS services.  AWS CloudWatch can perform real time analysis of CloudTrail logs.  AWS security groups act as firewalls, controlling both inbound and outbound traffic.  CIS 3.10 recommends that you configure a metric filter and alarm for changes to security group configuration.
",You should monitor security group configuration changes to ensure that they are compatible with your security policy.,https://kb.securestate.vmware.com/monitor-security-group-changes.html,aws,Audit,user,Medium,Not Available,Not Available,Not Available,Not Available
No alarm is configured for unauthorized API access attempts,"AWS CloudTrail records AWS API calls used within an AWS account, including calls made from the AWS Management Console, SDKs, command line tools, and other AWS services.  AWS CloudWatch can perform real time analysis of CloudTrail logs.  CIS 3.1 recommends that you configure a metric filter and alarm to monitor AWS API calls that are made with insufficient permissions or that are otherwise unauthorized.
",You should monitor unauthorized API access attempts to ensure that you are aware of any suspicious activity.,https://kb.securestate.vmware.com/monitor-unauthorized-api-calls.html,aws,Audit,user,Medium,Not Available,Not Available,Not Available,Not Available
No alarm is configured for VPC configuration changes,"AWS CloudTrail records AWS API calls used within an AWS account, including calls made from the AWS Management Console, SDKs, command line tools, and other AWS services.  AWS CloudWatch can perform real time analysis of CloudTrail logs.  CIS 3.14 recommends that you configure a metric filter and alarm to monitor VPC configuration changes.
",You should monitor VPC configuration changes to ensure that they are compatible with your security policy.,https://kb.securestate.vmware.com/monitor-vpc-changes.html,aws,Audit,user,High,Not Available,Not Available,Not Available,Not Available
No log profile exists for activity logs,"Azure allows you to create activity logs for configuration events.  Log profiles allow you to make changes to the default settings for activity logs.  By default, activity logs are retained for 90 days, but because it typically takes more than seven months to detect a security breach, CIS 5.1 recommends that you create a log profile and configure it to retain activity logs for one year or longer.  Log profiles do not exist by default; you must create them.
",You should create a log profile for activity logs so that you can configure the log retention period.,https://kb.securestate.vmware.com/azure-monitoring-log-profile-exists.html,azure,Logging,Microsoft.Insights,Low,Not Available,Not Available,Not Available,Not Available
Not all database threat detection types are enabled,"When you enable SQL threat detection, Azure will log threat information to your Azure storage.  CIS 4.2.3 recommends that you enable all threat detection types, which will provide detection of SQL injection attempts, unusual access patterns, brute force attacks, and other anomalous events.
",You should enable all SQL database threat detection types.,https://kb.securestate.vmware.com/azure-sql-threat-detection-types-all-database.html,azure,Security,Microsoft.Sql,High,Defense Evasion,Revert Cloud Instance,T1536,https://attack.mitre.org/techniques/T1536/
Not all server threat detection types are enabled,"When you enable SQL threat detection, Azure will log threat information to your Azure storage.  CIS 4.1.3 recommends that you enable all threat detection types, which will provide detection of SQL injection attempts, unusual access patterns, brute force attacks, and other anomalous events.
",You should enable all SQL server threat detection types.,https://kb.securestate.vmware.com/azure-sql-threat-detection-types-all-server.html,azure,Security,Microsoft.Sql,High,Defense Evasion,Revert Cloud Instance,T1536,https://attack.mitre.org/techniques/T1536/
One or more unused IAM groups exist,"Amazon recommends that you delete any unused IAM groups in order to both manage complexity and tighten security.
",You should delete empty IAM groups.,https://kb.securestate.vmware.com/iam-unusediamgroup.html,aws,Access,iam,Low,"Initial Access,Persistence,Defense Evasion,Privlege Escalation",Valid Accounts,T1078,https://attack.mitre.org/techniques/T1078/
Public read access is enabled for blob storage,"It is possible to configure public read access for Azure blob storage.  Public read permissions can be appealing when you want to provide access to users who do not have accounts in your organization.  CIS 3.7 recommends that you do not enable public access to blob storage but instead use a shared access token when necessary.  Blob containers do not allow public access by default.
",You should use a shared access token to allow blob storage access for users that lack accounts.,https://kb.securestate.vmware.com/azure-storage-public-access-level-set-private-for-blob-containers.html,azure,Security,Microsoft.Storage,High,Collection,Data from Cloud Storage Object,T1530,https://attack.mitre.org/techniques/T1530/
RDS snapshots are not encrypted,"This rule checks for any AWS RDB snapshots that are not encrypted.  When you enable RDS encryption, instance and snapshot data at rest is automatically encrypted.  Encrypting your snapshots can protect data in the event of a data breach.  We recommend that you encrypt RDS instances whenever possible.
",You should enable encryption for RDS snapshots to protect against data breaches.,https://kb.securestate.vmware.com/rds-db-snapshot-unencrypted.html,aws,Security,rds,High,Collection,Data from Cloud Storage Object,T1530,https://attack.mitre.org/techniques/T1530/
Read access to an S3 bucket by authenticated users is unrestricted,"Historically, access to all Amazon S3 resources was controlled through an access control list (ACL).  Now, Amazon recommends that you control S3 access instead by using IAM or S3 bucket policies.  By default, only the account owner has access to an S3 bucket and its contents, but you can change the permissions to allow access by any user.  If you provide unrestricted read access to a bucket, anyone can list the objects in the bucket.  Best practice is always to limit access to  only those who require it, so we recommend that you disable public read access unless it is truly required.
",You should limit S3 read access to only those parties who require it.,https://kb.securestate.vmware.com/s3-authenticatedusers-read.html,aws,Security,s3,High,Collection,Data from Cloud Storage Object,T1530,https://attack.mitre.org/techniques/T1530/
Read access to an S3 bucket is unrestricted,"Historically, access to all Amazon S3 resources was controlled through an access control list (ACL).  Now, Amazon recommends that you control S3 access instead by using IAM or S3 bucket policies.  By default, only the account owner has access to an S3 bucket and its contents, but you can change the permissions to allow access by any user.  If you provide unrestricted read access to a bucket, anyone can list the objects in the bucket.  Best practice is always to limit access to  only those who require it, so we recommend that you disable public read access unless it is truly required.
",You should limit S3 read access to only those parties who require it.,https://kb.securestate.vmware.com/s3-allusers-read.html,aws,Security,s3,High,Collection,Data from Cloud Storage Object,T1530,https://attack.mitre.org/techniques/T1530/
Redshift audit logging is not enabled,"AWS Redshift is able to track user activity and log connection data, user configuration changes, and other user requests.  We recommend that you enable this logging in order to provide an audit trail.
",You should enable Redshift audit logging.,https://kb.securestate.vmware.com/redshift-no-user-logging.html,aws,Audit,redshift,Low,Not Available,Not Available,Not Available,Not Available
Redshift cluster encryption is not enabled,"By default, AWS Redshift cluster data is not encrypted, but Amazon recommends that you enable encryption for clusters that contain sensitive data.  Encryption can protect your Redshift data in the event of a breach.  
",You should enable encryption on Redshift clusters to protect against data breaches.,https://kb.securestate.vmware.com/redshift-encrypted.html,aws,Security,redshift,Low,Collection,Data from Cloud Storage Object,T1530,https://attack.mitre.org/techniques/T1530/
Redshift engine upgrades are disabled,"The Amazon Redshift engine is updated periodically.  You can enable or disable engine upgrades.  We recommend that you enable engine upgrades in order to receive security updates as soon as they become available.
",You should enable Redshift engine automatic upgrades in order to apply security updates as quickly as possible.,https://kb.securestate.vmware.com/redshift-no-version-upgrade.html,aws,Reliability,redshift,Low,Not Available,Not Available,Not Available,Not Available
Redshift is not configured to require SSL connections,"By default, AWS Redshift does not require an SSL connection.  We recommend that you configure Redshift to use SSL in order to protect data in transit.
",You should enable SSL connections for Redshift to protect data in transit.,https://kb.securestate.vmware.com/redshift-no-require-ssl.html,aws,Security,redshift,High,Collection,Data from Cloud Storage Object,T1530,https://attack.mitre.org/techniques/T1530/
S3 access logging is not enabled,"You can enable access logging on Amazon S3 buckets in order to gain a better understanding of the requests that users make for bucket objects.  We recommend that you enable logging in order to have an audit trail for your S3 buckets.  This feature is not enabled by default; you must enable it.
",You should enable S3 access logging for all buckets to ensure that you have an audit trail.,https://kb.securestate.vmware.com/s3-logging-disabled.html,aws,Audit,s3,Low,Collection,Data from Cloud Storage Object,T1530,https://attack.mitre.org/techniques/T1530/
S3 bucket access is restricted only by IP address,"Amazon S3 bucket policies can control access to a bucket by user, group, or host IP address.  Because more than one user can use a particular IP address, we recommend that you only use IP address restrictions in combination with user restrictions.
",You should restrict access to S3 buckets by user or group rather than by IP address.,https://kb.securestate.vmware.com/s3-only-ip-based-policy.html,aws,Security,s3,High,Collection,Data from Cloud Storage Object,T1530,https://attack.mitre.org/techniques/T1530/
Secure connections are not enabled for storage transactions,"When you enable secure transfer for Azure storage, Azure will require secure (SSL/TLS) connections for storage transactions.  CIS 3.1 recommends that you enable this feature.  This feature is not enabled by default; you must enable it.
",You should enable secure connections for storage transactions in order to protect data in transit.,https://kb.securestate.vmware.com/azure-storage-secure-transfer-required-enabled.html,azure,Security,Microsoft.Storage,High,Collection,Data from Cloud Storage Object,T1530,https://attack.mitre.org/techniques/T1530/
Security alert emails are not enabled,"When you enable email security alerts and provide a security contact email address, Microsoft will email security alerts about your account to that address.  CIS 2.18 recommends that you enable this feature.  This feature is not enabled by default; you must enable it.
",You should enable security alert emails to ensure that you receive security alerts in a timely fashion.,https://kb.securestate.vmware.com/azure-security-send-email-alerts-on.html,azure,Security,Microsoft.Security,Low,Not Available,Not Available,Not Available,Not Available
